user_username,text,created_at,user_url,user_name,user_location,user_verified,retweet_count,like_count,quote_count,reply_count,ratio_reply_like,ratio_quote_retweet
nytimes,"As Wounded Warrior Project became a big name, it spent millions on things that seemed more lavish than appropriate https://t.co/jlsWTw7n0S",2016-01-31T02:45:09.000Z,http://t.co/ahvuWqicF9,The New York Times,New York City,true,172,186,0,25,-161,-172
CBSEveningNews,Chip Reid investigates accusations that the Wounded Warrior Project is wasting millions and shortchanging veterans https://t.co/ccKj0q8ks6,2016-01-26T23:39:23.000Z,https://t.co/Mm7FlsMteV,CBS Evening News,📺 6:30 p.m. ET,true,83,51,0,23,-28,-83
wwp,An orthopedic surgeon joins the @USMC at age 60 to honor his son: https://t.co/fcHnnP20EI via @taskandpurpose https://t.co/7Vj7N9TZAU,2016-02-06T20:20:08.000Z,https://t.co/823KUG2zCi,WWP,"Jacksonville, FL",true,27,47,0,4,-43,-27
USATODAY,The Wounded Warrior Project is being accused of blowing millions on its staff https://t.co/hQG1Og0Wlz (AP photo) https://t.co/261sXTyJPx,2016-01-30T20:30:19.000Z,https://t.co/yNKGMNvztv,USA TODAY,"USA TODAY HQ, McLean, Va.",true,69,34,0,7,-27,-69
CBSEveningNews,"AHEAD: @CBSNews investigates Wounded Warrior Project. Former staffers/vets accuse WWP of wasting millions of dollars
https://t.co/U0Lg7csEqd",2016-01-26T22:44:30.000Z,https://t.co/Mm7FlsMteV,CBS Evening News,📺 6:30 p.m. ET,true,82,32,0,18,-14,-82
nytopinion,"""I was saddened to read of the wasteful spending at the Wounded Warrior Project"" #NYTLetters https://t.co/vHLoooxHJ2 https://t.co/TC4Ygnozdi",2016-01-30T17:38:53.000Z,https://t.co/oy7Q8cSQqk,New York Times Opinion,"NYC, London, Paris, Hong Kong",true,18,24,0,1,-23,-18
wwp,America’s Warrior Partnership’s Communications Contractor on rethinking #nonprofit overhead: https://t.co/k3WryokcFa https://t.co/DQiufEp4FC,2016-02-02T19:05:04.000Z,https://t.co/823KUG2zCi,WWP,"Jacksonville, FL",true,10,12,0,1,-11,-10
SSIReview,Complaints about @wwp's overhead costs made headlines this week. But are sizable overheads at nonprofits always bad? https://t.co/g5kOviGwQY,2016-01-30T18:09:41.000Z,https://t.co/4WLW0c1HOO,Stanford Social Innovation Review,"Stanford, CA",false,11,11,0,3,-8,-11
Popehat,"Charity Navigator puts Wounded Warrior Project on the watchlist: excessive salary, ""overhead,"" little help for vets. https://t.co/yBH5yeduKQ",2016-01-31T16:29:13.000Z,https://t.co/WHJPylylr2,WrongAndBadHat,Los Angeles,false,33,11,0,3,-8,-33
CBSMornings,#WoundedWarriorProject on Charity Navigator's watch list: https://t.co/pSGQgayrDS,2016-01-30T16:02:20.000Z,https://t.co/jLzzFAF7Ld,CBS Mornings,United States,true,10,9,0,0,-9,-10
chicagotribune,Wounded Warrior Project promises review amid spending scrutiny https://t.co/VAs9MwKoEE https://t.co/eXaEv9BWP8,2016-02-03T02:22:51.000Z,https://t.co/DekZkEnIYp,Chicago Tribune,"Chicago, IL",true,1,7,0,1,-6,-1
MindfulMajority,"Wounded Warrior Project spends lavishly on itself, ex-employees say https://t.co/wiekx90uy0 via @HoustonChron",2016-01-30T19:06:51.000Z,,Mindful Majority,"Denver, CO",false,12,6,0,1,-5,-12
MissionMeasure,Criticism of @wwp is misplaced. Overhead cost is not the metric that matters. Cost per outcome is: https://t.co/qBM8cqw1y6 #WWP,2016-02-04T19:43:51.000Z,http://t.co/Vqy8bK3kqP,Mission Measurement,"Chicago, IL",false,5,6,0,1,-5,-5
CBSNewsPress,".@CharityNav says @WWP spends 60% on vets, while other vet orgs top 90%. @CBSEveningNews investigation coming up. https://t.co/yUQoGYJ6uj",2016-01-26T23:03:06.000Z,https://t.co/JvEtHPBp0b,CBS News PR,NA,true,9,5,0,0,-5,-9
9a1e6c8a99984e2,https://t.co/KWqL1V1cH1 Some Of These Right Wing Charity Groups Are Nortorious For Fraud Embezzellment And Abusing The Tax Exempt Status ...,2016-01-30T00:18:38.000Z,,@towman883,@towman883,false,7,5,0,1,-4,-7
KING5Seattle,Wounded Warrior Project under fire for reported overspending https://t.co/2EYsTKyxUC,2016-01-31T21:00:29.000Z,https://t.co/DTGVWWcuRo,KING 5 News,"Seattle, Washington, USA",true,7,5,0,0,-5,-7
npquarterly,When a scandals hit like the @wwp accusations of outlandish spending what’s a nonprofit CEO to do? Hire a PR firm! https://t.co/ogE8NFjGkn,2016-02-05T03:00:06.000Z,https://t.co/NtRRDyXic0,Nonprofit Quarterly,"Boston, MA",true,5,5,0,0,-5,-5
AndreaGrymesTV,Wow .. major investigation just now into how @wwp spends donated $$ meant for veterans from #ChipReid on @CBSEveningNews.,2016-01-26T23:46:21.000Z,http://t.co/BjVbi6ICSW,Andrea Grymes,New York City,true,4,4,0,2,-2,-4
KytKatz,@overcameit Thank YOU for exposing the rephehensible spending of the @WWP donors money! They have no souls! #Boycott #WoundedWarriorProject,2016-01-26T23:53:03.000Z,https://t.co/dXH0UQmfcI,Karyn A. K. Fleck,Rhode Island USA @Dollarocracy,false,4,4,0,0,-4,-4
CJR,"While @WWP says it devotes 80% of its fundraising to services, news organizations found it was closer to 60% https://t.co/g0wMZLdRzt",2016-01-30T00:31:18.000Z,https://t.co/XVWBCm6hH1,CJR,"New York, NY",true,4,4,0,0,-4,-4
petercoffin,"Donald Trump spent Thursday raising money for ""veterans."" https://t.co/MO3fa5A1vg https://t.co/VCjfv2vWNC",2016-01-30T15:51:45.000Z,https://t.co/66yYXCNwJV,Peter Coffin,they/all/michigander,true,2,4,0,1,-3,-2
Ranger_Up,"The Rhino Den is covering the recent WWP controversy with special guest contributor Marty Skovlund, Jr. Not... https://t.co/V9o19ERfsj",2016-02-01T18:40:35.000Z,https://t.co/DsICRgwXu6,Nick Palmisciano,"Durham, NC",true,2,4,0,0,-4,-2
DisabledVetsCPX,"VIDEO: CBS reports on wounded warrior project accused of waste &amp; calls for ""ceo"" resignation https://t.co/175jcXNzAJ @ConcernedVets @iava",2016-02-05T13:53:30.000Z,,Disabled Veterans,NA,false,6,4,0,1,-3,-6
OnePercntBetter,"Wounded Warrior Project Spends Lavishly on Itself, Insiders Say https://t.co/sAkhcxmTlJ",2016-02-25T03:01:20.000Z,,1% Better,NA,false,8,4,0,3,-1,-8
9a1e6c8a99984e2,"Wounded Warrior Project Spends Lavishly on Itself, Insiders Say https://t.co/10R7UIRTCM #WoundedWarriorProject
On Watch List &amp; Investigation",2016-01-30T00:10:51.000Z,,@towman883,@towman883,false,3,3,0,0,-3,-3
Local12,Wounded Warrior Project accused of wasting donation money: https://t.co/MhMJ2b5yD7 https://t.co/dBdckZDoTM,2016-01-30T09:00:09.000Z,https://t.co/PFzcUlCOSi,Local 12/WKRC-TV,"Cincinnati, OH",true,2,3,0,1,-2,-2
DailyCaller,Investigation: Wounded Warrior Charity Only Spends 60&amp; Of Funds On Veterans https://t.co/hs3P99N3vg https://t.co/xHcxpspFib,2016-01-31T12:46:07.000Z,https://t.co/ePSMzp6Wnp,Daily Caller,"Washington, DC",true,14,3,0,3,0,-14
Phil_Buck,Political cartoonist @AndyMarlette on the #WoundedWarriorProject [@wwp] @CBSNews investigation https://t.co/nCwzfKvXoo,2016-01-31T21:24:37.000Z,https://t.co/mXebQUh64u,Phil Buck,"Tampa/St Petersburg, FL",true,2,3,0,0,-3,-2
The_Weakonomist,Wounded Warrior Project spends 60% of its budget on vets compared to 90%+ with similar charities.  https://t.co/KoLaV9HyJM,2016-02-01T12:43:29.000Z,,Jedd Inite,Planet Statooine,false,3,3,0,0,-3,-3
senyorreporter,"ICYMI, the @nytimes and @CBSNews have been exposing excessive spending on management by the Wounded Warrior Project. https://t.co/NK2ZAuJsW5",2016-02-02T17:12:40.000Z,https://t.co/xMNPsgQgry,Tim Steller,"Tucson, AZ",true,1,3,0,0,-3,-1
bartmckinley,Wounded Warrior Project promises full review of finances as scrutiny mounts - WaPo  https://t.co/FbKiDizIOp Some 40% Overhead -  #military,2016-02-02T17:25:38.000Z,,Joe McKinley,NA,false,4,3,0,0,-3,-4
AnythingKISS,Paul Stanley Weighs In On Investigation Into 'Wounded Warrior Project': The Wounded Warrior Project is coming ... https://t.co/hc9XmzZlPx,2016-02-02T17:26:16.000Z,http://t.co/9PxIId198p,Anything KISS,USA,false,1,3,0,0,-3,-1
todd_falcone,The guy running WWP needs to be fired.... https://t.co/mHgCIlh0Rf,2016-02-03T06:04:21.000Z,https://t.co/eVCD4Q4eCb,Todd Falcone,"Bend, OR",false,1,3,0,0,-3,-1
EmployeeAtty,"Former employee and disabled vet: Wounded Warrior Project conduct ""makes me sick"" https://t.co/jptzZuueXR #emplaw #hr #employees",2016-02-04T17:56:16.000Z,http://t.co/6UBo74TvEo,Donna Ballman,"Cooper City, FL",false,3,3,0,0,-3,-3
npquarterly,A Segway for $3 million dollars!? Wounded Warriors Project is under fire for out-of-control spending: https://t.co/Jd0LH7CQDJ,2016-02-07T22:00:02.000Z,https://t.co/NtRRDyXic0,Nonprofit Quarterly,"Boston, MA",true,1,3,0,0,-3,-1
DwightBletcher,Read how someone tried to take advantage of a United State Marine Wounded Warrior Veteran - Very sad story - https://t.co/BDqwDDCQka,2016-01-24T20:53:06.000Z,https://t.co/uN7rrj2KI6,Dwight Bletcher,"North Carolina, USA",false,1,2,0,0,-2,-1
JustLibertyand,Wounded warrior project disgusts me w/ their lavish parties. Please give to the disabled Americans veterans charitable service trust instead,2016-01-26T23:49:53.000Z,,Ol' Séamas ⚓️⛵️🌊🌅🌌,SE NC,false,1,2,0,1,-1,-1
Hercscott,"An investigation by CBS News: The ""Wounded Warrior Project"" executives are using most of the funds to party...(I hope they all burn in Hell)",2016-01-26T23:51:51.000Z,https://t.co/0pjPLwaWS9,SCOTT LONGAS,MICHIGAN,false,2,2,0,1,-1,-2
MathewRhoades,"within the military community, this has been known for quite some time...this is not a worthy group, they are making…https://t.co/Yd2Czj7sdh",2016-01-30T00:14:45.000Z,,Mat Rhoades,"Las Vegas, NV",false,1,2,0,0,-2,-1
CBSTopNews,Wounded Warrior Project on Charity Navigator's watch list https://t.co/6H6DBaDTY6,2016-01-30T16:01:43.000Z,http://t.co/JEbgQWpRJS,CBS Top News,"New York, NY",false,1,2,0,0,-2,-1
VeteransFirst,Wounded Warrior Program accused of wasting millions of dollars received through donations. Details: https://t.co/UzU4hshIzc,2016-01-30T18:30:07.000Z,https://t.co/srNceEyAxw,Veterans First,United States,false,9,2,0,0,-2,-9
Ivanroberson,"Wounded Warrior Project Spending Too Much on Executives, Not Enough On Veterans - The Ring of Fire Network https://t.co/NZWJyqF04o",2016-01-31T16:03:31.000Z,,Ivan (Fla),"Sunny Again, Fl",false,5,2,0,0,-2,-5
veteranstoday,Wounded Warrior Project accused of wasting donation money (CBS Video Report) -  https://t.co/pKKffl4bml https://t.co/dKxZ919X8U,2016-01-31T16:37:04.000Z,https://t.co/vSa09jwcNn,VeteransToday,U.S.A.,false,11,2,0,0,-2,-11
JHVI1,Wounded Warrior Project under fire for reported overspending https://t.co/7jlUtGVgYG via @kvue,2016-01-31T18:23:53.000Z,,JHVI,ATX,false,1,2,0,1,-1,-1
AIVMI,Wounded Warrior Project accused of wasting donation money https://t.co/Nluj3T8r3G,2016-02-01T18:06:13.000Z,http://t.co/KSrR2jVGki,AIVMI,Hollywood Florida,false,2,2,0,1,-1,-2
alneuhauser,"Another Wounded Warriors ad on TV, another reminder of last week's eye-popping expose by @David_Philipps https://t.co/ZZkNyajroa @wwp",2016-02-01T19:48:33.000Z,https://t.co/LpwhAWJEuO,Alan Neuhauser,"Washington, DC",true,3,2,0,1,-1,-3
wjxt4,.@WWP responds to allegations of lavish spending and culture of fear (@WJXTLynnsey) - https://t.co/mPEEpqS1al https://t.co/5BXMgyx0lF,2016-02-01T23:45:08.000Z,https://t.co/jxNOTgcwdl,News4JAX,"Jacksonville, Fla.",true,3,2,0,0,-2,-3
npquarterly,#WoundedWarriors Project is under fire for out-of-control spending: https://t.co/3V9wienNpX,2016-02-02T00:40:00.000Z,https://t.co/NtRRDyXic0,Nonprofit Quarterly,"Boston, MA",true,5,2,0,0,-2,-5
LifeYouCanSave,.@nytimes coverage of #charity spending reminds us about the importance of doing research before making #donations! https://t.co/NVgglF9sa1,2016-02-05T22:52:02.000Z,https://t.co/3mwsyJx7O4,The Life You Can Save,NA,true,1,2,0,0,-2,-1
additive_agent,Additive Agent @argoldfein responds to the recent @nytimes report on the Wounded Warrior Project: https://t.co/yqF9pk47xA,2016-02-10T04:14:55.000Z,https://t.co/7rFeo1UvHs,The Additive Agency,"New York, NY",false,2,2,0,0,-2,-2
