user_username,text,created_at,user_url,user_name,user_location,user_verified,retweet_count,like_count,quote_count,reply_count,ratio_reply_like,ratio_quote_retweet
lenadunhamapols,Lena Dunham Apologizes For Getting Two Black Men Arrested While Working At Starbucks In Preparation For Her Upcoming Show 'Woke Barista',2018-04-15T05:51:35.000Z,,Lena Dunham Apologizes,"Brooklyn, NY",false,535,3511,15,8,-3503,-520
PrisonPlanet,"White guilt: Black guy walks into Starbucks, drops word ""racist,"" demands a free coffee and gets it. 😄 https://t.co/nOT1Uwiimc",2018-04-18T11:15:58.000Z,https://t.co/LRfnYsWvZZ,Paul Joseph Watson,London,true,1688,3488,375,867,-2621,-1313
sadgirlvivi,"Starbucks vai fechar 8 mil unidades por uma tarde pra fazer um treinamento contra preconceito racial

Não sei se fico satisfeita que uma atitude foi tomada ou chocada que pleno século 21 coisas desse tipo ainda tem que ser feitas",2018-04-17T21:52:24.000Z,,vit🧋,NA,false,1567,3451,41,4,-3447,-1526
KevinHart4real,Message to the @Starbucks in Philadelphia....Our city is shining bright like a diamond right now. Please make this situation right. I repeat please make this situation right!!!!!!! Once again MAKE THIS RIGHT,2018-04-15T15:46:13.000Z,https://t.co/QEAXjYK4eK,Kevin Hart,Philly/LA,true,595,3435,42,182,-3253,-553
ajplus,Remember two black men being arrested in Starbucks just for hanging out? This gym called the police on two black customers. https://t.co/s3czJZJtW1,2018-04-19T15:23:00.000Z,https://t.co/dffekhz2Zn,AJ+,NA,true,2703,3369,227,70,-3299,-2476
6abc,A witness to the Philadelphia Starbucks arrest said a manager did not ask the two men to leave before calling police. Her full account: https://t.co/850qMqLlA1 https://t.co/q9gUYIzw13,2018-04-14T23:00:19.000Z,http://t.co/7Ph31t11mK,Action News on 6abc,Philadelphia,true,2848,3313,846,605,-2708,-2002
ABC,"NEW: Two black men arrested for sitting at Philadelphia Starbucks without ordering anything settle with the city for symbolic $1 each and promise from officials to set up $200,000 program for young entrepreneurs. https://t.co/hcmypULTeq https://t.co/zHvAH7fK6D",2018-05-02T16:38:45.000Z,https://t.co/26XEt8onYo,ABC News,New York City / Worldwide,true,964,3223,193,193,-3030,-771
SheriffClarke,The Mueller investigation is a PRIME EXAMPLE of how disconnected the SWAMP is from real America. They wet their pants in excitement about the next story. We don't care about that or about the smut queen Daniels or Starbucks. 2 cops murdered today in Florida. Tell us about THAT? https://t.co/9XqkqPqwP1,2018-04-20T02:15:44.000Z,https://t.co/3uJT0CQFCs,"David A. Clarke, Jr.",NA,false,941,3139,57,162,-2977,-884
RWPUSA,"This isn't just a Starbucks issue.
Police procedures for making arrests need to be revised if a store manager's complaint about ""trespassing"" in a public space results in confrontation and arrest without officers asking necessary questions. 

https://t.co/QYeBbBoAyz via @CNNMoney",2018-04-16T15:46:49.000Z,,Richard W. Painter,"Minnesota, USA",false,1136,3124,47,176,-2948,-1089
tariqnasheed,"Me calling the police when I see white people in Starbucks who didn’t order nothing, from now on #BoycottStarbucks https://t.co/EWWwdKHeOl",2018-04-14T21:05:52.000Z,https://t.co/yAUICwSl4j,Tariq Nasheed 🇺🇸,Los Angeles,true,1213,3087,74,124,-2963,-1139
StuartGreen2018,"To @RedCross @Bounty @DIRECTV @Duracell @FedExHelp @Ford @GEICO @Hyundai @IBM @IHOP @JennyCraig @McDonalds @NissanUSA @Nutrisystem @Starbucks @StarKistCharlie @walmart:

Please pull your ads from Sean Hannity's show or we boycott. Everyone who
Retweets this agrees. #FireHannity https://t.co/FrlE8qUud7",2018-04-17T21:45:21.000Z,,Stuart #UndoOneMoreDay Green,"Austin, Texas",false,3792,3057,198,170,-2887,-3594
RagingGayCons,"Remember when a police officer wasn't allowed to use the restroom at Starbucks because they weren't a paying customer?

I don't recall Starbucks closing 8000 of their stores to train their employees how to respect police officers.",2018-04-21T15:08:54.000Z,https://t.co/dr0S2LwThn,Raging Gay Conservative,United States,false,1447,3036,126,152,-2884,-1321
MrFilmkritik,"After two innocent black men were arrested, Starbucks wants to implement more training. Tell me how the hell they're going to train the racism out of people?

A better idea: Just don’t hire racists.",2018-04-16T15:38:04.000Z,,Denizcan S.,Germany,false,502,2983,29,64,-2919,-473
RedTRaccoon,"My dad sits around Starbucks for hours and nobody says a word to him about it.

He's a 69 year old white man, so that might have something to do with it.

#BoycottStarbucks",2018-04-15T02:44:12.000Z,,Ted Corcoran (RedTRaccoon),"Garner, NC",false,870,2900,29,126,-2774,-841
ajplus,These two black men were arrested in Starbucks because they were sitting and waiting for a friend. https://t.co/SInFEvkGWT,2018-04-15T21:30:00.000Z,https://t.co/dffekhz2Zn,AJ+,NA,true,3886,2899,626,187,-2712,-3260
TheRickyDavila,Remember the two black real estate brokers who were unjustly arrested at a Starbucks in Philadelphia for sitting? They agreed to settle with Philadelphia for $1 each and a city pledge of $200K for young entrepreneurs. Amazing. ❤️,2018-05-02T18:43:14.000Z,https://t.co/whcm2VUbCq,Ricky Davila 🇺🇦,"Los Angeles, CA",false,856,2878,54,102,-2776,-802
JoyAnnReid,"Black @Starbucks customer documents store manager giving the restroom code to a white customer before they purchased food, after denying it to him (and then demanding he leave). Huh...  https://t.co/uqBMVqw6WQ",2018-04-17T05:57:39.000Z,https://t.co/xygunHjCYY,Joy-Ann (Pro-Democracy) Reid 😷,USA,true,1445,2873,97,228,-2645,-1348
Zachpiona,"Build your perfect dad:

-Yellow reflector running jacket
-Under armor sunglasses
-Air pods
-Lulu lemon leggings (for men) 
-Starbucks black coffee Grandé
-Will never take you to school cause he needs to workout",2018-04-26T16:52:54.000Z,https://t.co/tQpBFJnDfa,Zachary Piona,NA,true,239,2864,21,9,-2855,-218
eugenegu,"Starbucks closing 8,000 U.S. stores to train 175,000 employees about racial and implicit bias is an excellent first step. A good concrete action. https://t.co/Ddbu91qROo",2018-04-17T19:16:48.000Z,,"Eugene Gu, MD","New York, USA",true,733,2805,72,151,-2654,-661
HotepJesus,Starbucks is racist https://t.co/fPf3ERMlXX,2018-04-15T22:14:21.000Z,https://t.co/pA66554Xvt,Hotep Jesus,"New Jersey, USA",true,1233,2780,878,729,-2051,-355
eugenegu,"Commissioner Richard Ross, who is black, said officers ""did absolutely nothing wrong"" in the Starbucks arrest. “The officers were professional in their conduct but got the opposite back.""

This tactic of using African-American spokespeople to defend blatant racism is a travesty. https://t.co/IcsdTG2Fdj",2018-04-15T21:16:57.000Z,,"Eugene Gu, MD","New York, USA",true,787,2760,68,211,-2549,-719
larryelder,"Philadelphia Police Commish, who is black as was at least one of the cops, said his cops did nothing wrong. Apologized anyway. #Starbucks CEO confirms store policy requires a purchase. Apologized anyway. And media are treating the 2 black #victicrats like they're Rosa Parks.",2018-04-21T11:26:25.000Z,https://t.co/qYBVRK6S23,Larry Elder,"L.A., Calif.",true,804,2759,75,192,-2567,-729
AlbertMacGloan,"This @GOP asshole steals $84 THOUSAND DOLLARS from tax payers to settle sexual harassment lawsuits &amp; walks free.

Two black teens hangout at Starbucks for 2 minutes, leave in handcuffs.

The wrong people are being handcuffed, period, end of story. 

#PolitciansNEEDconsiquences https://t.co/AKZaBug8gl",2018-04-19T16:38:42.000Z,,ALBΞRT MacGloan,The Town,false,1447,2751,94,144,-2607,-1353
JamilSmith,"Where can we go? That was what I kept asking after two black men were arrested just for waiting in a Starbucks, and a black boy was nearly killed for knocking on a white neighbor’s door. I wrote about them—and @Beyonce and @kendricklamar—for @RollingStone. https://t.co/nMm7uULwVu",2018-04-19T15:01:56.000Z,https://t.co/q0K9YdDUda,Jamil Smith جميل كريم,"Nashville, TN",true,1241,2749,85,69,-2680,-1156
Liz_Wheeler,"Funny, how all white people are racist when two black men are arrested in Starbucks, but when a black man wearing a MAGA hat is harassed &amp; threatened in a Cheesecake Factory, the media is just like, ""BUT IVANKA IS A GHOUL.""",2018-05-15T16:39:15.000Z,https://t.co/HVIhfM2tmr,Liz Wheeler,NA,true,1004,2728,51,76,-2652,-953
Mikel_Jollett,"I’m white and I’ve never been arrested for hanging out at a Starbucks (or any public location for that matter).

People aren’t lying. This is real. https://t.co/7n3GX65zT5",2018-04-15T00:40:22.000Z,,Mikel Jollett,"Silver Lake, CA",true,458,2727,13,58,-2669,-445
tariqnasheed,"I just read the Starbucks CEO statement where he apologized for the “outcome” of the blatant racial discrimination of 2 innocent Black citizens, but I can’t seem to find where he said the employee who started this mess was FIRED. https://t.co/0MIBFGcp5l",2018-04-15T15:03:00.000Z,https://t.co/yAUICwSl4j,Tariq Nasheed 🇺🇸,Los Angeles,true,895,2624,52,191,-2433,-843
WerderEdESPN,Does it seem wrong to anyone else that there’s more outrage about loitering arrests at Starbucks than two police officers being assassinated while dining at a restaurant?,2018-04-20T12:57:15.000Z,,Ed Werder,NA,true,667,2551,212,337,-2214,-455
GMA,"FULL INTERVIEW: ""I personally apologize..."" Starbucks CEO Kevin Johnson one-on-one with @RobinRoberts in his first interview after two black men were handcuffed at a Philadelphia store.

FULL STORY: https://t.co/4CL5j2lPL7 https://t.co/AVnguPqAxa",2018-04-16T11:50:58.000Z,https://t.co/rshRna9QeG,Good Morning America,"New York, NY",true,1135,2493,368,787,-1706,-767
DonLemonTonight,“This is about how black people are treated in this country … this is an America issue” CNN’s @wkamaubell relates his own story of racial discrimination in light of the incident in which two black were men arrested at a Philadelphia Starbucks last week https://t.co/LmORyU8C7p https://t.co/uOngMVtaT1,2018-04-17T03:39:53.000Z,https://t.co/IaghNWqyKC,Don Lemon Tonight,"New York, NY",true,909,2468,79,227,-2241,-830
eugenegu,This movement against Starbucks for the outrageous arrest of two black men is mostly powered by Twitter citizens like you. Otherwise it would have been ignored. Keep fighting and caring. Your voice matters.,2018-04-16T15:59:57.000Z,,"Eugene Gu, MD","New York, USA",true,574,2419,18,45,-2374,-556
HelloCullen,My heart goes out to all the black Starbucks employees who they're making go to not racist class,2018-04-17T23:20:49.000Z,,cullen 'swamp trash' crawford,"Los Angeles, CA",false,136,2360,3,9,-2351,-133
ProudSocialist,My non-fat skinny vanilla latte is not more important than 2 of my fellow citizens being arrested for sitting in @Starbucks like millions of Americans do every day. Until Starbucks fires the employee for racial profiling I will not be going back. Period. End. Of. Story.,2018-04-15T16:10:56.000Z,https://t.co/HvktYk7jd3,Ryan Knight ☭,NA,false,901,2357,85,172,-2185,-816
scalzi,Watching entitled white coffee drinkers absolutely lose their shit because Starbucks is closing for one day to have their employees take racial bias training is my new jam.,2018-04-19T16:10:34.000Z,http://t.co/27Copmnrzm,John Scalzi,"Bradford, Ohio, USA",true,298,2346,16,82,-2264,-282
RobinRoberts,Coming up this Thursday morn on @GMA I sit down with the two men who were arrested last week in the Philadelphia Starbucks. They are speaking out for the first time about what they say happened that day and the changes they hope to come from this.,2018-04-19T11:18:04.000Z,https://t.co/vf2RV6U1j2,Robin Roberts,New York,true,478,2307,57,170,-2137,-421
TheDailyShow,Two black men waiting to meet someone are arrested at Starbucks: https://t.co/XZ9bizj6mb https://t.co/Jm9xhNKYRT,2018-04-17T13:55:40.000Z,https://t.co/SparsYZXFO,The Daily Show,NA,true,846,2287,60,44,-2243,-786
sexandthecici,THE CEO OF STARBUCKS SAID HE WILL MAKE TRAINING FOR IMPLICIT BIAS AT STARBUCKS. I WORK THERE AND IM JUST CONFUSED AS TO WHY WE HAVE TO TRAIN GROWN ASS PEOPLE ON HOW TO NOT BE FUCKING RACIST. ITS NOT THAT HARD. JUST FIRE THE RACIST FUCKING MANAGERS AND PROMOTE BLACK WOMEN LIKE ME.,2018-04-17T12:48:44.000Z,https://t.co/ygJwAri3oG,cici,if u dont know now u know,false,633,2256,23,50,-2206,-610
Alt_FedEmployee,"2 black men are arrested for literally sitting down in Starbucks &amp; an old white dude announces he assaults women and they still made him president

#WhitePrivilege #BoycottStarbucks",2018-04-15T00:30:20.000Z,,Alt Fed Employee,NA,false,849,2222,30,64,-2158,-819
RealMuckmaker,"Folks I know we love our coffee and for some of you , I understand completely but I am joining a #BoycottStarbucks  movement today and I am asking you Mucksters to join. Two unarmed black men were treated like dirt and arrested for being black in a white neighborhood,",2018-04-14T23:18:46.000Z,https://t.co/fZ0ztKMCpt,Muckmaker™,"Montana, USA",false,1082,2194,111,283,-1911,-971
SheriffClarke,"This is the state of POLICE EXECUTIVE LEADERSHIP today or LACK THEREOF. NO BALLS. CAPITULATE to political correctness, DON’T BACK YOUR OFFICERS, GROVEL at the feet of race provocateurs. Cops were justified in an arrest based on the complaint of Starbucks. https://t.co/tvTwbE51as",2018-04-19T18:43:53.000Z,https://t.co/3uJT0CQFCs,"David A. Clarke, Jr.",NA,false,626,2127,54,250,-1877,-572
bomani_jones,"serious question: is the manager who called the cops working today at that starbucks where people are protesting? if not, i can't imagine how mad his co-workers are at him right now. https://t.co/XvrhEtuJV4",2018-04-16T15:37:27.000Z,https://t.co/Dhbgckfp0I,bomani,NA,true,680,2116,82,109,-2007,-598
tariqnasheed,"If you want delicious gourmet coffee without the bitter aftertaste of racial oppression and civil rights violations, then #BoycottStarbucks and go get you some @TheCoffeeBean  #TheMoreYouKnow https://t.co/OOQcP4K1Yr",2018-04-14T17:53:18.000Z,https://t.co/yAUICwSl4j,Tariq Nasheed 🇺🇸,Los Angeles,true,945,2062,63,121,-1941,-882
ChuckModi1,"“The police at Starbucks were just doing their job”

Translation: “Cops are robots of the racist state and have zero power of discernment when to make an arrest when called by a white employee amidst a bout of racial emotional distress” #BoycottStarbucks",2018-04-14T21:33:43.000Z,https://t.co/2dTyK7FK2D,ChuckModi,DC/NYCNative/❤️ in #Ferguson,true,655,2018,24,79,-1939,-631
nytimes,"Rashon Nelson and Donte Robinson asked for a symbolic $1 each and $200,000 to help young student entrepreneurs in Philadelphia https://t.co/yWHrSnDW3h",2018-05-03T11:31:04.000Z,http://t.co/ahvuWqicF9,The New York Times,New York City,true,466,2015,82,59,-1956,-384
sahluwal,"Black men &amp; women should be able to go inside a store without being treated &amp; stereotyped as criminals because of the color of their skin. How far have we really come America? 

#BoycottStarbucks",2018-04-14T21:17:39.000Z,https://t.co/AR4K3C3ldb,Simar,"Los Angeles, California",false,730,1979,29,115,-1864,-701
WriterJohnKopp,"Protesters inside Starbucks call for end to racial profiling, saying the incident last week was not an isolated one. https://t.co/DRkMXYNvCy",2018-04-16T11:47:51.000Z,http://t.co/PbsJ8t304n,John Kopp,"Philadelphia, Pa.",false,503,1958,31,38,-1920,-472
TheRoot,"We need to talk about why white people call the cops on black people.

White Americans continue to use the police as an extension of their personal bigotry, yet face no consequences: https://t.co/8pmnefRWs8 https://t.co/uCL11bUHOD",2018-04-16T17:39:04.000Z,https://t.co/KLVGN9DpOP,The Root,"New York, NY",true,1113,1949,79,112,-1837,-1034
ajplus,"People protested at the Philadelphia Starbucks where 2 black men were arrested … because they were waiting for a friend.

Starbucks apologized and said it would conduct a “thorough investigation” of its practices. https://t.co/EMUlXMA8X9",2018-04-16T15:36:34.000Z,https://t.co/dffekhz2Zn,AJ+,NA,true,973,1915,59,24,-1891,-914
tonygoldmark,"You should absolutely #BoycottStarbucks if you want to, that's your right as a consumer. But please DON'T go into random Starbucks locations just to harass the baristas. Unless it's the Starbucks on 18th and Spruce in Philadelphia, they had NOTHING to do with this.",2018-04-14T22:28:45.000Z,https://t.co/RiB5E26Z1F,Guardians of the Galaxy Brain,Los Angeles,false,422,1889,27,56,-1833,-395
TeamStradley,"Sorry, but Starbucks isn’t racist just because they have a couple employees that are garbage. This country is pretty good at blaming a whole group for a couple peoples actions. #BoycottStarbucks",2018-04-14T16:24:25.000Z,,"Rush Inbot, esq",South side of Parts Unknown,false,330,1853,61,181,-1672,-269
ProudSocialist,Until 2 black men can sit in a @Starbucks and enjoy a coffee without getting arrested I won’t be going back. Do better Starbucks. #BoycottStarbucks https://t.co/xQJPug9h8b,2018-04-15T04:49:24.000Z,https://t.co/HvktYk7jd3,Ryan Knight ☭,NA,false,714,1850,64,159,-1691,-650
MrErnestOwens,".@Starbucks rep says that they will not fire the manger who made the call that led to the unjust arrest of two Black men at their Rittenhouse Square location.

I'm not a coffee drinker, but I guess I won't be a Tazo tea drinker there now either.",2018-04-15T19:36:49.000Z,https://t.co/sPW5Mxa30P,Ernest Owens,"Philadelphia, USA",true,871,1843,234,90,-1753,-637
amaditalks,"So Waffle House is standing by their racist waitress calling police on a Black women because she questioned an attempt to charge for plastic utensils, despite police violently assaulting that woman, so everyone ready to boycott Starbucks two weeks ago, where you at?",2018-04-23T21:54:44.000Z,https://t.co/vmSSDGGTg7,Mx. Amadi “unwell anyway” Lovelace,Osage/Shawandasee Tula/Shawnee Land aka Pittsburgh ,false,896,1832,55,47,-1785,-841
DearAuntCrabby,"What the FUCK @Starbucks?!?! You are now arresting black people for just sittin'? Pretty damn deplorable. I bet Dunkin', Winchells, or Krispy Kreme would love to have your business AND treat their Customers better. https://t.co/AbvJ0bsRCX",2018-04-15T00:00:46.000Z,,🖕🏻Aunt Crabby Calls Bullshit 🖕🏻,The Bowels of NE FL Redneckery,false,940,1831,67,256,-1575,-873
eugenegu,"Unlike Starbucks, Waffle House and its employees are embracing racism and police brutality. They hide behind the veneer of praising James Shaw Jr. as a “Waffle House” hero while maliciously calling the police on black patrons to brutalize them. Outrageous. https://t.co/30d7vQGAAr",2018-05-11T00:19:56.000Z,,"Eugene Gu, MD","New York, USA",true,1290,1814,178,216,-1598,-1112
StarbucksNews,.@Starbucks to close all stores nationwide for racial-bias education on May 29 https://t.co/K6YCPzFjrw https://t.co/aCzmjmnGY9,2018-04-17T17:51:59.000Z,https://t.co/z8tNkAB7Re,Starbucks News,"Seattle, WA",true,1091,1810,461,227,-1583,-630
BerniceKing,"If the @Starbucks employee who called the police is fired, then what? 

Does that eliminate or transfer the issue? 

Is a primary goal the eradication of racism?  

Does that entail individual change + systemic change? 

How can we translate the learnings into change?

Thoughts?",2018-04-15T18:23:41.000Z,https://t.co/CMbgs1HZjh,Be A King,"Atlanta, GA",true,471,1800,42,200,-1600,-429
KristenClarkeJD,"ACTION ALERT: We’re taking action. Starbucks may be running afoul of federal, state &amp; local #civilrights laws which prohibit racial discrimination by public accommodations. All stores must be equally open on the basis of race. Period. @LawyersComm https://t.co/i7U9VekgbC",2018-04-17T01:49:06.000Z,,Kristen Clarke,"Washington, DC",true,722,1787,39,56,-1731,-683
NicoleFCarr,“...Help people understand this isn’t just a Black people thing. This is a people thing.” Two Black men arrested for trespassing in @Starbucks while they awaited a friend’s arrival speak on @GMA . Now we know this all happened within 2 minutes of their arrival.  More: @wsbtv https://t.co/0fDQ18kNmr,2018-04-19T11:42:30.000Z,https://t.co/CQd87NRGSg,Nicole Carr,Atlanta,true,814,1766,115,77,-1689,-699
PrisonPlanet,Here's your racial bias training. Give people their coffee. Treat everyone the same regardless of race. End of training. https://t.co/EBBXhk3NBI,2018-04-17T19:45:45.000Z,https://t.co/LRfnYsWvZZ,Paul Joseph Watson,London,true,470,1752,61,219,-1533,-409
pamelacolloff,"If you haven't seen the full 8-minute video of the Starbucks arrest, please watch. Law enforcement clearly escalated the situation. Watch as one officer becomes increasingly agitated, while the two men remain calm. This is what bad policing looks like. https://t.co/B6z7iDt8j9",2018-04-15T01:37:52.000Z,https://t.co/P776PdjzcF,Pamela Colloff,"Austin, TX",true,847,1750,85,110,-1640,-762
MSNBC,Protests occur in Philadelphia after controversial arrest of two black men in Starbucks https://t.co/jLra9oYxwY,2018-04-15T17:38:46.000Z,https://t.co/YBwtJIhwY3,MSNBC,NA,true,745,1729,96,264,-1465,-649
steinkobbe,It's weird to me that all the focus is on Starbucks and not on the cops that did the actual arresting. So what if some random Starbucks employee acted stupidly. It shouldn't be the standard for cops to just arrest anyone some Starbucks employee tells them to,2018-04-19T12:10:52.000Z,,Wild Geerters,Ø,false,304,1727,13,36,-1691,-291
YesSirJames,"Kudos to all the people who listened to David Hogg in boycotting all of the advertisers of Laura Ingraham’s show.

David wasn’t arrested unfairly. Now it’s time to show whether you care.

Stand with us and #boycottStarbucks until this issue is resolved. Don’t sit this one out.",2018-04-14T21:17:41.000Z,https://t.co/xwByNND4Br,Sir James The Second🏳️‍🌈🇺🇸🇱🇷🍑♐️👨🏾‍🍳💪🏿,"Castleberry Hill, Atlanta",false,608,1715,32,121,-1594,-576
TheDailyShow,"Two men were arrested at Starbucks by bike cops. BIKE COPS. 

Full piece: https://t.co/nPfqSoS2CX https://t.co/6FwMY671qu",2018-04-21T17:00:02.000Z,https://t.co/SparsYZXFO,The Daily Show,NA,true,537,1696,57,41,-1655,-480
AP,"BREAKING: Philadelphia's police commissioner apologizes to 2 men arrested at Starbucks, says he `failed miserably' in messaging .",2018-04-19T16:25:07.000Z,https://t.co/0HD7A9hKKy,The Associated Press,Global,true,792,1655,153,163,-1492,-639
OhNoSheTwitnt,To recap: The people who tweeted about boycotting the NFL over black players peacefully protesting racism are mocking the people boycotting Starbucks over racism against black people. God bless America.,2018-04-15T00:53:41.000Z,https://t.co/MWi2ZboEWV,The Volatile Mermaid,I’m from N-E-W Jerz ,false,336,1641,4,23,-1618,-332
BuzzFeedNews,"The two black men arrested at a Philadelphia Starbucks settled for a symbolic $1 each and a pledge from the city to fund a $200,000 grant for young entrepreneurs https://t.co/xd0Jz5zO7i",2018-05-02T18:26:49.000Z,https://t.co/zNicBkWJ5l,BuzzFeed News,NA,true,377,1632,39,24,-1608,-338
JamilSmith,"What is most startling may be that these white folks calling cops on black people on the golf course, at a Waffle House, or at a Starbucks know that doing so could kill them. There’s too much awareness of police brutality to not know. They just don’t care. https://t.co/IYDbVGGrkD",2018-04-24T21:01:54.000Z,https://t.co/q0K9YdDUda,Jamil Smith جميل كريم,"Nashville, TN",true,812,1628,57,88,-1540,-755
anthonyvclark20,"Before Starbucks, Tyler Lumar a loving father, son, brother, was racially profiled &amp; police were called. A broken system that targets Black men failed Tyler &amp; ultimately led to his death. Tyler is an OPRF ALUM May 6th we are holding a rally calling for justice! @ShaunKing https://t.co/726pfpusOB",2018-04-27T12:31:11.000Z,https://t.co/EWaxK5r39n,Anthony V. Clark,"Illinois, USA",true,797,1624,20,24,-1600,-777
benshapiro,That Philly Starbucks Has Several Cameras. So Why Won't They Release Tape Of A Racist Incident? https://t.co/PdvklIMRlO https://t.co/kbVKOqnPKR,2018-04-19T17:28:56.000Z,https://t.co/3sF3RiV7g2,Ben Shapiro,NA,true,359,1588,71,277,-1311,-288
dreamyiis,Why didn’t the police officers ask questions. Putting us in chains is always their first priority #BoycottStarbucks,2018-04-14T13:34:03.000Z,,Stop the madness,Charlotte,false,408,1580,25,50,-1530,-383
stillgray,"Absolute genius. 

@VibeHi walked into a Starbucks to demand a free coffee for reparations (and to prove the foolishness of Starbucks' virtue signaling and white guilt) and got one. 

https://t.co/fHAGtf8VgD https://t.co/RAkkXlCBHQ",2018-04-18T13:35:23.000Z,https://t.co/zeCKyEiTgB,Ian Miles Cheong,Telegram,true,553,1578,102,179,-1399,-451
MSNBC,"JUST IN: Starbucks CEO announces company will temporarily close all stores in US on May 29 ""to conduct racial-bias education geared toward preventing discrimination in our stores.""

The move follows arrest of 2 black men at a Philadelphia store. https://t.co/3L45ZzqROl https://t.co/BU9oMLZn9F",2018-04-17T18:09:45.000Z,https://t.co/YBwtJIhwY3,MSNBC,NA,true,822,1560,298,188,-1372,-524
Fox5DCJeannette,Protests continue inside of center city @Starbucks store where two black men were arrested. @6abc https://t.co/Bv9XIAPD8Y,2018-04-16T12:09:10.000Z,https://t.co/C08ASdxqN2,Jeannette Reyes,"Washington, DC",false,521,1555,77,67,-1488,-444
Fox5DCJeannette,"Protester asks others to donate money they would’ve spent on @Starbucks coffee to a good cause, organizations that help black and brown people in Philadelphia. @6abc https://t.co/cz8i0JYDaX",2018-04-16T12:11:04.000Z,https://t.co/C08ASdxqN2,Jeannette Reyes,"Washington, DC",false,521,1533,42,30,-1503,-479
wkamaubell,"Years ago, I performed at @ColoradoStateU doing my ""Ending Racism in About an Hour"" show. Apparently they need a refresher.

One more time...

Racism is not a Starbucks problem. Or a Colorado State University problem. It's an America Problem.

https://t.co/DsOCUf9hzw",2018-05-05T14:56:54.000Z,https://t.co/UoifCf8fFB,W. Kamau Bell,On hold with New Zealand,true,379,1532,24,45,-1487,-355
