user_username,text,created_at,user_url,user_name,user_location,user_verified,retweet_count,like_count,quote_count,reply_count,ratio_reply_like,ratio_quote_retweet
freedomrideblog,".@Starbucks 
If black men sit in a Starbucks they can be arrested for sitting and minding their own business. This happened at 1801 Spruce Street in Philadelphia. Starbucks owes these men a public apology, compensation and an explanation to the public.
#BoycottStarbucks",2018-04-13T22:16:40.000Z,https://t.co/3o9tq1XEJq,Margaret Kimberley,"New York, NY",false,738,1529,48,72,-1457,-690
PrisonPlanet,"Hello @Starbucks - can you clarify whether it's official policy that anyone who walks into a store and says the word ""racist"" gets a free coffee? Thank you. https://t.co/wTHBXiIDIC",2018-04-18T12:46:54.000Z,https://t.co/LRfnYsWvZZ,Paul Joseph Watson,London,true,463,1504,60,198,-1306,-403
PauleyP,"I’ve never been to #Starbucks Too expensive (I’m very frugal) But MAN this story of the guys arrested there is MAKING ME CRAZY! Jeez, wrong!",2018-04-16T19:40:17.000Z,https://t.co/1EAGM1gj8V,Pauley Perrette,"Hollywood, CA",true,75,1498,3,93,-1405,-72
nytimes,"Starbucks will close more than 8,000 of its stores in the U.S. on May 29 to conduct racial-bias training for nearly 175,000 employees https://t.co/tqcm3naPXp",2018-04-18T03:02:03.000Z,http://t.co/ahvuWqicF9,The New York Times,New York City,true,515,1494,95,151,-1343,-420
JoyAnnReid,Two minutes... https://t.co/CKVDk2U1EI,2018-04-23T13:29:15.000Z,https://t.co/xygunHjCYY,Joy-Ann (Pro-Democracy) Reid 😷,USA,true,585,1489,27,108,-1381,-558
laurasgoldman,".@Starbucks should do more than meet with the 2 men arrested at #starbucks They should support the bipartisan Clean Slate Act, currently in the Pa legislature, which will seal the arrest records of the 2 men. Otherwise, their job search will be tainted forever. @ Kevin Johnson",2018-04-16T17:27:15.000Z,,Laura Goldman,"Philadelphia, PA",false,441,1488,22,72,-1416,-419
ABC,Starbucks CEO Kevin Johnson orders 'unconscious bias' training after 'reprehensible' arrest of two black men at Philadelphia coffee shop. https://t.co/KjZRjozvn7 https://t.co/PBH6Qbxc4L,2018-04-16T12:34:04.000Z,https://t.co/26XEt8onYo,ABC News,New York City / Worldwide,true,584,1479,209,238,-1241,-375
larryelder,"The Philadelphia Police Commish, who is black, said his cops did nothing wrong. Apologized anyway. #Starbucks CEO says store policy requires a purchase. Apologized anyway. Media treat the 2 black #victicrats like they're civil rights workers. HOW INSULTING TO REAL HEROES! https://t.co/Kf7hgWyuOg",2018-04-22T04:44:25.000Z,https://t.co/qYBVRK6S23,Larry Elder,"L.A., Calif.",true,530,1471,25,108,-1363,-505
KristenClarkeJD,Just rec'd this message from #Starbuck's CEO. Federal &amp; local public accommodations laws require that stores like Starbucks provide equal access to consumers regardless of race. This incident sends a loud message: No Blacks Allowed. #StarbucksWhileBlack https://t.co/9EDZ8sJ0tD,2018-04-15T04:44:32.000Z,,Kristen Clarke,"Washington, DC",true,588,1453,60,112,-1341,-528
dmedin11,"BREAKING: The two black males whose arrest last month at a Philadelphia Starbucks sparked a national outcry have settled with the city for $1 each, in addition to a city pledge of $200,000 for young entrepreneurs.",2018-05-02T17:26:24.000Z,https://t.co/ZRrzvZL0qK,Daniel Medina,"New York, NY",true,339,1435,32,19,-1416,-307
theappeal,A Starbucks in Philadelphia called the police to remove two Black men who hadn’t ordered anything while they were waiting for a friend. The cops arrested them for trespassing. Today people are protesting in Philly. https://t.co/ESvxZdGf26 https://t.co/Afe2VdqF1v,2018-04-14T23:32:19.000Z,https://t.co/OHtvl3FOOe,The Appeal,NA,true,506,1434,22,37,-1397,-484
KwikWarren,"If U cant go to Starbucks to wait for someone without the cops being called on U, then where the heck can U go...if you’re black? If you’re lost &amp; cant ask a local resident for directions without getting shot at, then what the heck should U do...if you’re black? Asking 4 a friend",2018-04-15T00:38:14.000Z,https://t.co/3sCpYMMjwA,Kenny BooYah! 🖖🏾,Native Texan Living In Florida,false,711,1419,33,80,-1339,-678
mic,"People will call the cops on you if you wait in a Starbucks, if you ask for silverware in a Waffle House, or if you play golf at a golf course — but only if you’re black.

@MsPackyetti wants you to share a moment when you experienced harm simply for being black. Use #whileblack. https://t.co/YOraNNmMWY",2018-04-26T23:30:00.000Z,https://t.co/RoWbUt6buj,Mic,NYC,true,901,1408,54,53,-1355,-847
PlantBasedSingh,"I just went to @Starbucks this evening to go study for finals. As always, I ordered my drink and put my book bag down in a chair. After ordering my drink and waiting for my name to be called, I gave a quick glance to the chair I set my book bag in and saw it was gone.",2018-04-28T23:30:49.000Z,,Navraj Singh,Earth,false,761,1402,76,43,-1359,-685
womensmarch,Racism is calling the police on two black men waiting for someone at a @Starbucks. This is disturbing and unacceptable. We hope these two men get justice. https://t.co/EL1Y8hvZs0,2018-04-15T23:15:00.000Z,https://t.co/8AO8aldiSf,Women's March,"Washington, D.C.",true,424,1378,25,24,-1354,-399
benshapiro,"Hey @Starbucks, release the tape from this location of the alleged racist incident in question. https://t.co/gvufeuShsk",2018-04-19T15:47:54.000Z,https://t.co/3sF3RiV7g2,Ben Shapiro,NA,true,317,1354,34,101,-1253,-283
harikondabolu,I don’t blame the 2 Black guys at Starbucks who were unfairly arrested for not ordering anything. That coffee is burnt &amp; everyone knows it.,2018-04-14T23:31:24.000Z,https://t.co/gETqGmehj7,Hari Kondabolu,"Brooklyn, NY",true,91,1349,8,32,-1317,-83
Alt_FedEmployee,"When posed with a racism issue by one employee: Starbucks will close 8000 stores for the day to provide racial-bias education

When posed with a racism issue by their president: The GOP will blame a black guy or a woman",2018-04-17T19:46:32.000Z,,Alt Fed Employee,NA,false,469,1348,10,13,-1335,-459
ACLU,"Of the pedestrians stopped by police in the first half of 2017 in the area where the Starbucks arrests happened, 67% were Black. The area's population was only 3% Black. 

The @ACLUPA is fighting for reforms to end racial profiling by Philadelphia police. https://t.co/uvQjVBTCNa",2018-04-19T13:10:20.000Z,https://t.co/AF1gbNeaRA,ACLU,"50 states, DC, & Puerto Rico",true,716,1348,38,40,-1308,-678
elonjames,"I swear, I’m reading all the white folks who say they just roll into Starbucks to use the bathroom without buying anything and thinking of all the times I’ve bought shit I didn’t even want so I could use the bathroom without a problem and sometimes still got stank looks.",2018-04-16T16:14:59.000Z,https://t.co/KZcPXUKACr,Elon James White,"Lower Merion, Pa",true,349,1319,105,64,-1255,-244
larryelder,"The two black men said they remain upset with #Starbucks because ""rules are rules, but right is right."" So...it's...morally...wrong...to...require...a...buy...before...permitting...a...customer...to...use...their...restroom?!?
Somebody call the ACLU!!!",2018-04-21T14:11:51.000Z,https://t.co/qYBVRK6S23,Larry Elder,"L.A., Calif.",true,274,1299,24,136,-1163,-250
BerniceKing,"Concerned about the two Black men arrested in @Starbucks.

Encounters with police induce extreme anxiety for many Black people because:

SEE ‘Jim Crow.’; #StephonClark; ‘A Brief History of Slavery and the Origins of American Policing’ - https://t.co/VqTf3pfFeO; @13THFilm.",2018-04-14T22:42:08.000Z,https://t.co/CMbgs1HZjh,Be A King,"Atlanta, GA",true,507,1285,15,29,-1256,-492
jymette,"Join us Monday-Friday for #workdaywordplay!  Challenge yourself with fun writing prompts, make new friends, and enter a drawing to WIN a $10 STARBUCKS eGift card! #letsgetwordy #freecoffee https://t.co/jIeFit1B6m",2018-04-29T15:06:03.000Z,https://t.co/Skpr9yXE9x,Jymette Watrous,"Seattle, WA",false,117,1260,3,4,-1256,-114
Fox5DCJeannette,"Protestors confront @Starbucks corporate employees, demand to know the name of employee who called police on two black men. They are demanding that that person be fired. @6abc https://t.co/Xqof3wmn1o",2018-04-16T12:40:29.000Z,https://t.co/C08ASdxqN2,Jeannette Reyes,"Washington, DC",false,456,1259,93,82,-1177,-363
TwitterMoments,"The two black men arrested at a Starbucks in Philadelphia have settled with the city for $1 each and a commitment to a $200,000 program for young entrepreneurs. https://t.co/LqYwt28U2S",2018-05-02T17:31:51.000Z,https://t.co/nYOx6qThjk,Twitter Moments,"New York, USA",true,319,1254,57,19,-1235,-262
ScottHech,“People are saying there must be more to this story. There’s not. This would never happen to someone who looks like me. People dont believe black people when they say this stuff happens. It does. They want to know extenuating circumstances. There are none.”https://t.co/1yLB8KWCgV,2018-04-15T02:31:28.000Z,https://t.co/1t8YAGStuY,Scott Hechinger,"Los Angeles, CA",true,677,1252,41,65,-1187,-636
USATODAY,"Black men arrested at Starbucks settle with Philadelphia for $1 each  and a promise from officials to set up a $200,000 program for young entrepreneurs.  https://t.co/eWppM1nKnn",2018-05-02T17:20:37.000Z,https://t.co/yNKGMNvztv,USA TODAY,"USA TODAY HQ, McLean, Va.",true,341,1227,75,66,-1161,-266
TheRoot,From Starbucks to Hashtags: We need to talk about why white Americans call the police on black people https://t.co/RhlhP0dOac https://t.co/7JFmwnCuh9,2018-04-17T10:08:54.000Z,https://t.co/KLVGN9DpOP,The Root,"New York, NY",true,791,1221,154,76,-1145,-637
eugenegu,"Racism is a systemic issue at Starbucks. Just because a company seems liberal and progressive, it does not mean they are immune from being flagrantly racist. #BoycottStarbucks https://t.co/YTMhJpykZ9",2018-04-16T16:53:32.000Z,,"Eugene Gu, MD","New York, USA",true,586,1218,76,146,-1072,-510
amjoyshow,".@KillerMike addresses the incident in which two black men were arrested while waiting in a Starbucks. @JoyAnnReid asks, ""Do you think that encouraging black people to carry endangers black people's lives?"" #AMJoy https://t.co/3OEQ3Dh06I",2018-04-15T15:56:17.000Z,,Formerly 'AM JOY' on @MSNBC,"New York, NY",true,494,1209,118,369,-840,-376
CBSNews,Calls to #BoycottStarbucks are growing after a video surfaced showing officers arresting two black men inside one of their coffee stores in Philadelphia. https://t.co/oqO1oRqp01 https://t.co/S0c5rqDkOd,2018-04-14T22:59:30.000Z,https://t.co/WWGo4zp06H,CBS News,"New York, NY",true,925,1204,110,268,-936,-815
AClineThomas,"@Starbucks CEO says the arrest at the 18th and Spruce store was wrong.

“Most importantly, I hope to meet personally with the two men who were arrested to offer a face-to-face apology.” @NBCPhiladelphia 

https://t.co/wLX3PhFec6",2018-04-15T05:36:27.000Z,,Aundrea Cline-Thomas,"New York, NY",true,443,1200,78,60,-1140,-365
eugenegu,"First they get a black police commissioner, Richard Ross, to justify the arrest of two black men at Starbucks. Now they get a black mayor, AJ Connors, to justify the chokehold of a black teenager at Waffle House. Same predictable playbook. Same injustice. https://t.co/ch7Ox74Ddc",2018-05-12T14:06:46.000Z,,"Eugene Gu, MD","New York, USA",true,630,1196,63,113,-1083,-567
JoyAnnReid,"The two black men who were arrested for ""standing while black"" in a Philadelphia @Starbucks will get a meeting with the CEO. https://t.co/HKzCUXPdmz",2018-04-16T19:04:04.000Z,https://t.co/xygunHjCYY,Joy-Ann (Pro-Democracy) Reid 😷,USA,true,333,1189,24,156,-1033,-309
Boogie2988,"#BoycottStarbucks 

The real victim in this controversy isn't the black people who were wrongly arrested.

It's the poor white girls who pretend to care about black people.

Where are they gonna get coffee now?  One of those bikini places?",2018-04-15T01:23:31.000Z,https://t.co/09pBHdKwx1,boogie2988 top .01% of Cringe,the internet,true,82,1188,11,65,-1123,-71
cnnbrk,"The two black men arrested at a Starbucks have reached agreements with the coffee chain and Philadelphia, settling with the city for $1 each https://t.co/5atWgW6fvW https://t.co/sAncqI8typ",2018-05-02T20:24:01.000Z,https://t.co/ojQgQKzKzX,CNN Breaking News,Everywhere,true,290,1166,86,96,-1070,-204
guardian,"Black men arrested in Starbucks settle for $1 each and $200,000 program for young people https://t.co/aEVCBrieeE",2018-05-02T18:43:16.000Z,https://t.co/c53pnmnuIT,The Guardian,London,true,375,1158,77,17,-1141,-298
ElizLanders,"Wow: @Starbucks to close its more than 8,000 company-owned stores in the US on the afternoon of May 29 to educate employees about racial bias.
 
The training will be given to 175,000 workers.",2018-04-17T17:54:10.000Z,https://t.co/xaD8YJsFye,Elizabeth Landers,"Washington, DC",true,373,1157,99,37,-1120,-274
losangelista,How about all of America does racial bias training on May 29 cos the problem ain't just Starbucks...,2018-04-17T20:58:22.000Z,,Liz Dwyer,Down by Old Man Johnson's farm,true,396,1156,34,32,-1124,-362
rudepundit,The cops in the Starbucks arrest video need to face consequences. They fucked up. They knew the men weren’t breaking the law. They abused their position.,2018-04-15T03:31:52.000Z,https://t.co/dFY5ErVr1J,The Rude Pundit,Lee Papa's place,false,231,1155,9,44,-1111,-222
KevinNoahRiley2,"#BoycottStarbucks what gets me is how did the barrista word it for the police to come?  Did he/she just mention the word black?  Because I would need more than ""I got 2 potential customers in our Starbucks not ordering anything """,2018-04-14T14:20:57.000Z,,"Kevin No, Uh Really","Minnesota, USA",false,339,1146,14,41,-1105,-325
TheMichaelaB,"Thank you to the CEO of @Starbucks for acknowledging a wrongdoing, apologizing, and moving forward. Bravo  https://t.co/W4RD7lV4oj",2018-04-15T14:51:40.000Z,https://t.co/an2uoEOf0l,Michaela Bradshaw,NA,false,173,1140,14,23,-1117,-159
MichaelSSpeaks,"Well done interview with the gentlemen arrested at the Philly Starbucks.  @RobinRoberts and @GMA, great interview!  To have these two men experience something like that and be able to speak and act with such calm and grace is so inspiring.  That is class!",2018-04-19T11:47:17.000Z,https://t.co/ObSgBTK6VJ,Michael Sherlock,"Philadelphia, PA",false,215,1137,22,30,-1107,-193
AprilDRyan,"Starbucks will close 8,000 US stores May 29 for racial-bias training
https://t.co/0vrtoAF7DH",2018-04-17T19:24:51.000Z,https://t.co/gpSEaWXRvy,AprilDRyan,"Washington, D.C.",true,256,1136,44,110,-1026,-212
DaShaunLH,"In agreement with other leftists who have already posted this point: boycotting Starbucks is not enough. A call for people to stop calling the police is the answer.

Last summer, ATL organizers ran an entire campaign around this very thing. Stop calling the police. https://t.co/VrGtWah5H9",2018-04-15T12:47:29.000Z,https://t.co/lso6PRspal,Da’Shaun | they/them,the site unseen,false,435,1125,13,5,-1120,-422
