user_username,text,created_at,user_url,user_name,user_location,user_verified,retweet_count,like_count,quote_count,reply_count,ratio_reply_like,ratio_quote_retweet
leilabilling,Boom! I wanna hear far far more voices from the global south on the #oxfamscandal and #aidtoo. Great stuff here #globaldev https://t.co/Odxfg27oQz,2018-02-27T07:00:59.000Z,https://t.co/myGCjS8fna,Leila Billing,"Cambridge, England",false,1,5,3,0,-5,2
Independent,Mary Beard posts tearful picture of herself after defence of Oxfam aid workers provokes backlash https://t.co/I11WDqf8GG,2018-02-18T19:52:00.000Z,https://t.co/gZeS7qlNx6,The Independent,"London, England",true,6,16,7,14,-2,1
LondonLovesProp,All about #SaveTheChildren charity scandal. Read here: https://t.co/VjtayrBsAR #UKNews #charity #Scandal #oxfamscandal https://t.co/z9JpCVUMVh,2018-02-21T11:19:25.000Z,https://t.co/yGhpJmty1m,LondonLovesProperty,"London, England",false,1,1,2,0,-1,1
TimesONeill,"Oxfam GB banned from work in Haiti 

https://t.co/1ywTiy2Ip1",2018-02-23T08:15:08.000Z,https://t.co/b8Zu01yBP4,Sean O'Neill,London,true,1,2,2,0,-2,1
Independent,'The overreaction to Oxfam's failings is part of a deeper and more damaging malaise' https://t.co/eFOJeeEf5I,2018-02-23T15:15:26.000Z,https://t.co/gZeS7qlNx6,The Independent,"London, England",true,2,10,3,3,-7,1
newint,"When disasters strike, put women in charge: https://t.co/XE9h8y9O2Q",2018-02-25T18:05:10.000Z,https://t.co/W7KywjGE3j,New Internationalist,Worldwide,true,1,4,2,0,-4,1
intldogooder,"[New] I've been reticent to offer up my perspective on the #AidToo #OxfamScandal, until now: https://t.co/stSepMOMxo #globaldev #NGOs #aid https://t.co/SAwmOOwYrM",2018-03-01T19:44:14.000Z,https://t.co/g2yyxwlKCr,Jennifer Lentfer,"Omaha, Nebraska, U.S.A.",false,6,10,7,0,-10,1
LauraRound,"In Bright Blue's latest podcast I am joined by @GillianKeegan, @lucycthomas &amp; @CapurrodDaniel to discuss Brexit, the review of higher education and the Oxfam scandal. Listen here: https://t.co/x3jx3qixSw https://t.co/MygnYPtGPx",2018-03-02T10:36:10.000Z,https://t.co/vYIsAB6vJK,Laura Round,London,true,1,5,2,0,-5,1
STVNews,Annie Lennox will 'stay loyal' to Oxfam after sex scandal  https://t.co/tHUtmS4JDW,2018-03-04T13:13:50.000Z,https://t.co/Jon1aMuyLO,STV News,Scotland,true,2,14,3,5,-9,1
SolentJou,"Following the Oxfam scandal, the list of accused charities is growing. @chelseymutter has been looking into the story. Do you think there should be more clarity from charities about the work they do? Leave your comments below. https://t.co/MsxbIiXnff https://t.co/FoZB9BXNJo",2018-03-07T11:54:17.000Z,https://t.co/5xvvbsVkRn,Solent Journalism,"Southampton, England",false,1,1,2,0,-1,1
TRVSTworld,"""We need to re-imagine how we think of #internationaldevelopment. We are in a moment now in which we have a choice."" @maryannmhina offers a #roadmap for change following the #oxfamscandal and #Aidtoo &gt;&gt; https://t.co/iP5i7Gb9Bu https://t.co/T7Bb9qrV3p",2018-03-07T16:30:59.000Z,https://t.co/RersZTtjhL,TRVST,Global,false,2,10,3,0,-10,1
SocietyGuardian,The Oxfam scandal has taught us that there is no reward for honest charities | Angela Crack https://t.co/w2LftFI3c8,2018-03-16T07:25:04.000Z,http://t.co/P34IEpI2xB,Society Guardian,London,true,1,3,2,0,-3,1
stevemayman,"Before commenting on Mary Beard's TLS piece or her Tweets on Oxfam in Haiti, reading what she actually wrote would be appropriate &amp; appreciated. There are no simple solutions to complex issues such as natural disasters. Oxfam bosses remain culpable though. https://t.co/4Iuv28fNqi",2018-02-18T01:22:27.000Z,http://t.co/PoWnqy8VBf,Stephen Elliott,Northern Ireland,false,1,5,1,0,-5,0
tempodotco,"Skandal Seks Oxfam, Presiden Haiti: Harga Diri Kami Terinjak https://t.co/EbDZMiqHUE",2018-02-18T01:43:07.000Z,,TEMPO.CO,Indonesia,true,1,1,1,0,-1,0
DrMeaganTyler,Never miss an @oliverburkeman column in my Guardian Weekly. Glad I can add yet another thing I admire about his way of thinking things through. #oxfamscandal #EndVAWG #EndDemand https://t.co/bEoe0Fbyka,2018-02-18T06:01:13.000Z,https://t.co/CLYS6e1VVm,Meagan Tyler,Australia,false,1,2,1,1,-1,0
JustMeBeingMe4,"Also #BendanCox allegations were widely known.... I knew....MANY KNEW &amp; questioned it.... but Brendan was useful for #WhiteHelmets promotion &amp; 2 secure UK Gov funding in #Syria war........no?

https://t.co/QQVidhgQEO

#CSAInquiry
#oxfamscandal
#marr
@UKLabour
@BBCNews
@SkyNews",2018-02-18T09:06:49.000Z,https://t.co/6XfYR0btrl,💙Catherine A Higgins (Kamara-Taylor),"Manchester, England",false,2,5,2,1,-4,0
bisialimi,"Yesterday I got into a conversation with @wmarybeard about her position on the #Oxfam scandal in Haiti. It was based on her use of ""civilised"" and presenting context to abuse. She wrote this piece to explain and I she will do me the honour to respond; https://t.co/y0pLeUlgfA",2018-02-18T10:30:47.000Z,https://t.co/0dswec9xiD,Lucifer (HE/HIM),"London, England",true,1,3,1,2,-1,0
RosieMKane,"Just to be clear this ""leftie"" is raging and sickened by the abuse of power which has led to the abuse of women.Whether it's Oxfam man in Haiti or saint Brendan Cox. My friends and I have a history of condemning and calling to account men within our ranks who abuse.",2018-02-18T12:55:53.000Z,https://t.co/NvVQ5hS1Pu,Rosie Three Jags Kane,Glasgow,false,1,29,1,1,-28,0
itvnews,"Oxfam scandal has made defending UK aid budget harder, and alleged abusers 'occupy lowest circle of Hell', @RuthDavidsonMSP tells @Peston on @pestononsunday
#Peston
https://t.co/1ObsM1wbwz https://t.co/BlyX84higI",2018-02-18T14:24:33.000Z,https://t.co/a6E93qvfJx,ITV News,United Kingdom,true,5,10,5,10,0,0
robinHEG,Oxfam must change. But the reasons to support it will not. And why I will continue to do so. https://t.co/upQvfpWxRQ,2018-02-18T18:57:58.000Z,,Robin Ireland,Glasgow and Liverpool,false,1,4,1,0,-4,0
Nigel_Chapman_,Andrew Rawnsley writing a lot of sense at the end of a difficult week for the international aid sector. We must not let some bad apples and some poor judgement destroy organisations which do a lot of good in the poorest countries. https://t.co/HsQfTwHCkt,2018-02-18T20:12:11.000Z,,Nigel Chapman,Oxford England ,false,1,1,1,0,-1,0
LinaAbiRafeh,"It’s not just an #Oxfam scandal, not just an aid scandal - it’s everywhere all the time - #colonialism is alive and well, yes, thanks to the bloated sense of entitlement and ease with which white men abuse power, from the presidency all the way down... https://t.co/zzinsnolik",2018-02-21T05:03:00.000Z,https://t.co/J0NzjNrd1h,Lina AbiRafeh,Lebanon + NYC,false,1,1,1,0,-1,0
LBC,"Thousands have canceled donations to Oxfam, and ex-Save The Children boss, Justin Forsyth, has ""apologised unreservedly"" to the three workers - are you surprised this scandal has hit the charity sector? https://t.co/di55SGxKRJ",2018-02-21T07:05:23.000Z,https://t.co/fI8exPioWw,LBC,United Kingdom,true,8,13,8,58,45,0
KimAtiWagner,https://t.co/iVQSbn7kB2,2018-02-21T07:45:47.000Z,https://t.co/gYj1dXG4p0,Kim A. Wagner,London,false,1,3,1,1,-2,0
newhumanitarian,"Despite being dismissed by a British NGO from his job in Liberia for paying for sex in the charity's houses, within two years he had been recruited by Oxfam, first in Chad then in Haiti https://t.co/p79gOepXuY",2018-02-21T10:38:00.000Z,https://t.co/2hi4n3Y6an,The New Humanitarian,NA,true,1,2,1,0,-2,0
institutoahorro,"Oxfam
“tres de los cooperantes destinados en Haití llegaron a amenazar físicamente a un testigo en el curso de la investigación sobre Oxfam“ reseña hoy @elpais_espana 
“Allí... a  sus víctimas...las golpeaban“ reveló @Posicionpe antes que la propia Oxfam.
https://t.co/ubIUvfIxcy https://t.co/lOhjNLBEN1",2018-02-21T16:36:39.000Z,https://t.co/Ujr4hZnOxN,Instituto del Ahorro,"Lima, Perú",false,1,1,1,3,2,0
KMPatriot8421,"If we want to talk about saving &amp; protecting the lives of children, we should start here.  #qanon #LockThemUp #HumanTrafficking  https://t.co/b8TKC04iop",2018-02-21T18:30:12.000Z,,KM8421,NA,false,2,4,2,1,-3,0
lecorvb,"Oxfam Novib artsen zonder grenzen allemaal linkse clubjes.
Dolf Jansen is te laf om te vertrekken bij deze dikbetaalde en op sex beluste instellingen.
#dwdd",2018-02-21T18:40:17.000Z,,Rosch van Bosenthal,Rotterdam ,false,1,5,1,5,0,0
AidSoulSearch,Oxfam sexual abuse scandal is built on the aid industry’s white saviour mentality | Afua Hirsch https://t.co/MBvL7MTuFV,2018-02-21T19:05:37.000Z,http://t.co/kKEsHOgo4g,Dr. Gemma Houldey,NA,false,1,1,1,0,-1,0
zeitonline,"Die NGO #Oxfam muss ihre #Haiti-Projekte für mindestens zwei Monate unterbrechen, weil die Regierung ihr nach Missbrauchsvorwürfen die Arbeit verbietet. https://t.co/u0QD8yEb9k",2018-02-23T04:49:18.000Z,http://t.co/zzdcZCBgYn,ZEIT ONLINE,"Berlin und Hamburg, Germany",true,2,4,2,0,-4,0
VicHancockFell,Being interviewed this morning by @mmgeissler for @itn news at 10 re. small international development charities and their place in the sector! You can read the gist of my feelings on this here: https://t.co/5nH0KeabvW,2018-02-23T09:50:28.000Z,https://t.co/d5slCV6GnY,Vic Hancock Fell (she/her),"Sheffield, England",false,1,6,1,1,-5,0
DianaBardsley,Oxfam sex scandal: Haiti suspends charity's operations - BBC News https://t.co/RvAzGkhxVc,2018-02-23T13:57:32.000Z,,Diana L Bardsley,NA,false,1,1,1,0,-1,0
PopulusPolls,#TTMN | What the public noticed this week.. Florida school shooting (27%) was the top most noticed news story followed by #Brexit (10%) and #oxfamscandal (8%) https://t.co/7DGaKBItnl,2018-02-23T16:39:14.000Z,https://t.co/bYAwqvJ9n0,Populus,London,true,1,1,1,0,-1,0
StopEndWarsNOW,"Trading sex for aid happens at #RedCross as well as #Oxfam.
Do we really know what these ""aid"" organizations are doing with our donations?
#HumanTrafficking #ChildSexTrafficking #OrganHarvesting #Pedophilia
#PedoGate #PedoWood #PedoRoyals #USAID #ClintonFoundation #UraniumOne https://t.co/oetypqQsZM",2018-02-24T20:23:07.000Z,,StopEndlessWar,"Ashland, Oregon",false,1,1,1,1,0,0
npquarterly,"""Nonprofits have scandals because, like for-profits, they are constituted by people""  https://t.co/IMUEuHkaNs",2018-02-24T21:00:00.000Z,https://t.co/NtRRDyXic0,Nonprofit Quarterly,"Boston, MA",true,3,3,3,0,-3,0
HansdeGruijter,Hier maakt @bertwagendorp een terecht punt; “Het is absurd wanneer een Syrisch kind dat is getroffen door een granaatscherf sterft vanwege onze verontwaardiging over een seksfeest op Haïti.” #oxfam https://t.co/m9aQ6rHKRo,2018-02-25T16:44:08.000Z,https://t.co/9wlt6cwS4r,Hans de Gruijter,Breda,false,1,4,1,0,-4,0
TinaTinde,The #OxfamScandal: How to keep predators away from the most vulnerable? #livedebate @F24Debate w great host @FrancoisF24 &amp; panel sharing insight on #genderdiscrimination #MeToo #AidToo #MeTooUN #globaldev #emergencyaid #PSEA #staffsafety #sexualharassment  https://t.co/7hGrHCe6pc,2018-02-25T17:05:29.000Z,https://t.co/Kcuwq1cpOe,Inclusion Rider,"Geneva, Switzerland",false,1,4,1,0,-4,0
newhumanitarian,"Roland van Hauwermeiren’s former colleague tells IRIN how she blew the whistle, not once but twice—in 2004 and 2008 https://t.co/p79gOepXuY",2018-02-25T17:33:00.000Z,https://t.co/2hi4n3Y6an,The New Humanitarian,NA,true,1,3,1,0,-3,0
TheGoldWaterUS,"After Oxfam and Red Cross, Now UN Staff Are Accused of Paying for Prostitutes
 #MAGA #UNPeacekeepers #SouthSudan #BuildThatWall #QAnon #SexualMisconduct #OxFam #Prostit
https://t.co/euhItNyiZr",2018-02-26T14:20:56.000Z,https://t.co/OPYLnHKVkn,The Goldwater,NA,false,2,5,2,0,-5,0
ObserverNotes,"In the context of International Development and Aid on #Dominica following #HurricaneMaria and in light of the #OxfamScandal, is the Dominica Government @SkerritR, including the police MONITORING how aid groups 'on the ground' are conducting themselves? CC @lennox001 @UN @DFID_UK",2018-02-27T03:16:33.000Z,https://t.co/SgPJLKoiCL,Nester Phillip,International,false,1,1,1,1,0,0
newhumanitarian,In case you missed it: Whistleblower tells @BenParker140 how her initial complaints way back in 2004 led to van Hauwermeiren being pushed out of his job as Liberia country director of another British NGO https://t.co/p79gOepXuY,2018-02-27T12:08:01.000Z,https://t.co/2hi4n3Y6an,The New Humanitarian,NA,true,1,5,1,0,-5,0
ginnybraun,"“to this day our understanding of countries that receive humanitarian assistance is still deeply grounded in the same colonial thinking” 
https://t.co/FMje4TD4yA",2018-02-27T23:45:44.000Z,https://t.co/WxjvG4bewr,#KeepMasking prof virginia braun 💉💉💉,The University of Auckland,false,1,1,1,0,-1,0
billycobbett,Former International Development Secretary Clare Short attacks 'hysterical' media coverage of Oxfam https://t.co/M1auaotv6g,2018-02-28T08:04:18.000Z,,William Cobbett,"Cirencester, England",false,1,4,1,1,-3,0
DutchNewsNL,Dutch foreign ministry knew about Oxfam scandal in 2012: minister https://t.co/x0mdxSxXTe,2018-02-28T13:05:19.000Z,https://t.co/JwurczWnoe,DutchNews.NL,The Netherlands,true,2,3,2,0,-3,0
iAfricans,Oxfam sex scandal: Baaba Maal stands down as ambassador https://t.co/3BxOV9QWyS https://t.co/lpfmSz2Pr4,2018-02-28T13:41:05.000Z,,Interact Africans,Africa,false,1,2,1,0,-2,0
NexoJornal,Quais denúncias pesam contra a atuação de membros da Oxfam no Haiti https://t.co/WjudL0Gx29 https://t.co/0LCGmuchtT,2018-02-28T19:55:05.000Z,https://t.co/jXeNmMwxl2,Nexo Jornal,"São Paulo, Brasil",true,1,3,1,0,-3,0
newsdigest,【英国】小林恭子の英国メディアを読み解く「オックスファムと買春疑惑広がる波紋 - 慈善活動のこれまで」- チャリイティ団体Oxfamのスキャンダルをタイムズ紙が暴露報道。イギリスの慈善組織とは何かを振り返ってみます。 https://t.co/Ki1fv5tMt9,2018-03-01T14:58:50.000Z,http://t.co/hNcoA8AoMD,ニュースダイジェスト,London/Düsseldorf,false,1,4,1,0,-4,0
BakshiAsuman,Oxfam employee who was sexually assaulted 'constructively dismissed' https://t.co/DrKVWlIEog,2018-03-01T18:08:10.000Z,https://t.co/HsAMFXhCiE,Bakshi Asuman Khan,Uganda,false,1,1,1,0,-1,0
Dzennypha,Oxfam has lost over 7000 donors since their scandal got into public light.,2018-03-04T11:56:21.000Z,https://t.co/JEDfiNQu2t,Jennifer Olachi Uchendu,Lagos/London,false,1,2,1,2,0,0
Amor_y_Rabia,"CUIDADO CON LAS ONGs: El 52% de los donativos que recibe Oxfam (más de 160 millones $ en 2017) se dedica a sueldos y gastos suntuosos, el escándalo del que nadie habla https://t.co/1meie4ElKC https://t.co/6YqwhgxogP",2018-03-04T12:38:50.000Z,http://t.co/nqXz8NKJpA,Amor y Rabia News,Valladolid,false,1,1,1,0,-1,0
