user_username,text,created_at,user_url,user_name,user_location,user_verified,retweet_count,like_count,quote_count,reply_count,ratio_reply_like,ratio_quote_retweet
bobmca1,"David Lammy criticised as Comic Relief hit by drop in donations

https://t.co/yU94cAIkOv",2019-03-16T22:10:58.000Z,,Bob M 💙🇬🇧💫,"Scotland, UK",false,197,347,45,109,-238,-152
CorbynistaEdith,"Every year I go to my mum's and we watch Comic Relief together. I always donate what I can, usually around £20. This year I've decided not to watch or donate as I don't want to perpetuate the ""white saviour"" image. Best of luck to everyone involved this year ❤️",2019-03-08T11:08:13.000Z,,Corbynista Edith #WeAreCorbyn,"Canterbury, England",false,204,750,38,173,-577,-166
DaveAtherton20,"Mr @davidlammy I'm pleased to say I not only didn't pledge any money to Comic Relief, I didn't even watch the show. Your praise for me would be welcome.",2019-03-16T12:30:51.000Z,https://t.co/HFzFHDA2ER,David Atherton,London,false,378,1495,35,153,-1342,-343
thetimes,"Comic Relief suffered an £8m fall in donations for its Red Nose Day appeal, prompting a backlash against David Lammy, the Labour MP who sparked a debate about the charity’s role in perpetuating a “white saviour” complex https://t.co/BN6NmRJeXV",2019-03-16T23:25:07.000Z,http://t.co/GAsNZkMcoP,The Times,London,true,20,39,23,72,33,3
nowhitesaviors,"The @StaceyDooley story with @comicrelief is far worse than any of us thought. The celebrity and the charity lied about the context of the photo. Just as we had assumed based on the child’s expression and well...white saviourism is quite predictable

https://t.co/BWaifuQlQ7",2019-03-09T07:51:41.000Z,https://t.co/Xsxyta4waL,No White Saviors,"Kampala, Uganda",false,102,140,21,5,-135,-81
BritishComedy,"Free tickets to be in the studio audience for @ComicRelief 2019 on 15 March: https://t.co/OF4tWWkvO6 

Confirmed presenters: Sir @LennyHenry, @EmmaWillis, @PaddyMcGuinness, @RomeshRanga, @AleshaOfficial, @ZoeTheBall, David Tennant, @ClaraAmfo, @RobBeckettComic and @Joe_Sugg https://t.co/Hin5EQ8Vwb",2019-02-25T20:27:01.000Z,https://t.co/ErCAozcIO4,British Comedy Guide,London,true,91,994,19,31,-963,-72
boblister_poole,"Family of Ugandan boy Stacey Dooley posed with in Uganda speak out
I thought Foreign Aid was supposed to help? But of course it goes to dictators to build palaces &amp; buy jets! https://t.co/mByC80MMOF",2019-03-09T08:27:17.000Z,,Bob For A Full Brexit,"South West, England",false,66,103,14,22,-81,-52
RomeshRanga,Guardian article about Comic Relief mate : https://t.co/kXiNpLpZjT,2019-03-16T12:07:19.000Z,https://t.co/3U1ZwjwkPR,Romesh Ranganathan,NA,true,136,1058,14,48,-1010,-122
rodbishop15,I don’t think the NZ PM is right to call for an end to right wing extremism. She should call for an end to ALL extremism. Remember ALL lives matter and David Lammy criticising white saviours? We don’t need more division we need balance in approach.,2019-03-20T18:18:41.000Z,,Rod Bishop 💎,NA,false,166,711,11,51,-660,-155
kazmc39,"I wouldn’t want to be thought of as a do gooder “White Saviour”, as @DavidLammy has said we are, instead I’ll be sending additional money to a local charity @StChrisHospice who were amazing looking after my dad and giving him so much dignity in his final weeks. https://t.co/AzrOzOe3bA",2019-03-10T13:05:54.000Z,,KazMc 🇬🇧🇬🇧🇬🇧,NA,false,53,132,10,23,-109,-43
EdwardAdoo,"My latest @HuffPost piece ...
“Demonising The Likes Of @StaceyDooley Will Only Deter People From Contributing To Charities Like Comic Relief” 
https://t.co/1Ej2ULyh0m",2019-03-04T00:21:27.000Z,https://t.co/VlZEeZplWj,Edward Adoo,London,true,2,4,9,10,6,7
Kalimeralynn,Comic Relief.   At Mr Lammy's request your donations are not appreciated as classed as 'White Saviours Donations.' Instead give your money to more worthwhile causes eg Veterans Societies or local animal charities who will be very grateful for your donations https://t.co/soymHbhIQI,2019-03-11T16:35:32.000Z,,Lynn English: I am Immune to Mind Control,East Anglia,false,102,183,9,23,-160,-93
LiveUpdateSyria,"""I am not a part of any terrorist org the government has said that via their own admission. So why am I being punished and my citizenship being revoked?"" @ttoxsharif #AreWeBritish @sajidjavid @SalmaYaqoob @DavidLammy @ShirazMaher @MaajidNawaz @adamdeen @SadiqKhan @StaceyDooley https://t.co/JFx93JYm2p",2019-03-05T00:49:35.000Z,,Live Updates Family,Syria,false,65,75,8,16,-59,-57
theipaper,"David Lammy is a truly remarkable politician, but his Stacey Dooley takedown was out of order. | @y_alibhai

https://t.co/tqxI2tLssC",2019-03-05T12:35:00.000Z,https://t.co/s9Rj8uSJsl,i newspaper,NA,true,3,21,8,16,-5,5
aidnography,The #whitesaviour debate is an excellent opportunity to look at core elements of ritual communication; I'm suggesting 10 easy steps to keep circular #globaldev debates going without too much painful learning &amp; change...  https://t.co/0WZIkC1glb https://t.co/iTPY3gnpTW,2019-03-05T12:38:14.000Z,https://t.co/NWeniklaJq,Tobias Denskus,Malmö,false,24,50,8,1,-49,-16
kazmc39,"So this year instead of donating to @comicrelief as our money is obviously not wanted according to @DavidLammy why don’t you donate instead to this amazing cause. Minds at War run by @mcguigan_norman helping our veterans suffering with PTSD

https://t.co/zG1WnuV9EB",2019-03-11T06:51:13.000Z,,KazMc 🇬🇧🇬🇧🇬🇧,NA,false,157,233,8,19,-214,-149
Transgendertrd,"BBC Comic Relief awarded £190,000 to Allsorts which runs transgender groups for 5-11 year-olds. ""Given the rising numbers of younger people identifying as transgender over the past few years, it’s easy to see what the strategy is here."" https://t.co/W2fhRdkoEM",2019-03-19T15:44:11.000Z,https://t.co/teOFz74U9H,TransgenderTrend,NA,false,58,100,8,8,-92,-50
dailyyonder,Last week’s New York Times columns by Paul Krugman and David Brooks offer textbook examples of the unhelpful frames that define our conversation about rural America. https://t.co/wnqaAZL7pR,2019-03-25T12:04:47.000Z,http://t.co/zQITdSDD5U,The Daily Yonder,Rural America,false,29,50,8,3,-47,-21
marcusryder,"Whatever you think of the current argument around @comicrelief @DavidLammy &amp; @StaceyDooley there is only ONE way to solve ""white saviour"" images on our TV screens (or any type of bad representation) EMPLOY MORE DIVERSITY BEHIND THE CAMERA! New blog post https://t.co/n7R57A50wW https://t.co/nhORBjAGFX",2019-03-04T04:18:58.000Z,https://t.co/cOVxuYgfrg,Marcus Ryder MBE,UK,true,11,31,7,1,-30,-4
BBCR1,"Very cheeky, David Beckham! 😉 

@Scott_Mills and @Chris_Stark are 20 hours into Radio 1's #LOLathon and even Golden Balls is getting involved! 🔴 

To donate to @comicrelief &amp; for T&amp;Cs please visit https://t.co/48RuyzVNDg https://t.co/2dgNg9zwHE",2019-03-07T09:08:00.000Z,https://t.co/meTBaIOsf1,BBC Radio 1,UK,true,24,195,7,4,-191,-17
chootchyface,"Comic Relief suffered an £8m fall in donations for its Red Nose Day appeal, prompting a backlash against @DavidLammy , the LABOUR MP who sparked a debate about the charity’s role in perpetuating a “WHITE SAVIOUR” complex.

 https://t.co/VXDa4RSnoK",2019-03-16T22:23:28.000Z,,Chootchy Face,"London, England",false,47,62,7,16,-46,-40
thetimes,"Comic Relief suffered an £8m fall in donations for its Red Nose Day appeal, prompting a backlash against David Lammy, the Labour MP who sparked a debate about the charity’s role in perpetuating a “white saviour” complex https://t.co/dwmAbIfN99",2019-03-16T23:05:25.000Z,http://t.co/GAsNZkMcoP,The Times,London,true,11,14,7,17,3,-4
CiroDeSiena,"Jeez I was a full-on stereotype this morning. Drove a Golf R into work, fitted with a custom titanium exhaust and a huge sound system, and to help wake up I was listening to David Guetta. All I needed was a protein shaker and I could've just gone ahead and changed my name to Jono",2019-03-26T13:16:39.000Z,https://t.co/D7Zn0TwpcX,Ciro De Siena💉🇿🇦💉,South Africa,false,4,73,7,12,-61,3
MoodySlayerUK,I'm guessing David Lammy thought Stacey Dooley was just a Strictly dancer and not a serious documentary maker. As usual he's made himself look like a complete knob.,2019-02-27T20:05:26.000Z,,Европейский комиссар,"Владивосток, Приморский край",false,78,400,5,22,-378,-73
qzafrica,"British charities have a White Savior Complex when it comes to Africa but are in denial 

https://t.co/ONavauoZgO via @qzafrica",2019-03-06T09:26:11.000Z,https://t.co/IzpNx81nxK,Quartz Africa,NA,true,30,25,5,2,-23,-25
marcusjdl,"So instead of being a “personal shot at the request of the family” as @comicrelief said, Stacey Dooley grabbed a child she did not know for a photo opportunity. https://t.co/AgBlvw6y7A",2019-03-10T14:01:35.000Z,https://t.co/FQepfmP7GF,marcus 🇧🇧,London,false,59,104,5,5,-99,-54
Independent,Opinion: David Lammy didn’t cost Comic Relief £8m – its refusal to drop colonial stereotypes did https://t.co/yg7kxZ2fi7,2019-03-19T08:40:47.000Z,https://t.co/gZeS7qlNx6,The Independent,"London, England",true,15,36,5,8,-28,-10
davidtennantcom,David Tennant To Co-Host Red Nose Day Live Show On BBC One https://t.co/OSa5FIeCy0 @comicrelief https://t.co/N2jjpZwvN5,2019-02-25T22:24:42.000Z,https://t.co/giFILzyVGH,David-Tennant.com 💙,UK,false,21,66,4,0,-66,-17
IamTobiOredein,"I don’t even understand why comic relief still runs.

It does more harm than good. The money is a short term fix but the stereotypes it perpetuates are long lasting. 

It’s a shame white celebs aren’t willing to listen but comic relief is about the ego of white celebs... so? 🤷🏾‍♀️",2019-02-27T23:01:10.000Z,https://t.co/Uo06BMzxB7,Tobi Oredein is on mat leave (no work DMs),LDN,false,24,122,4,8,-114,-20
B49Ian,I think the white population of the UK should take note of the racist MP David Lammy and boycott donating to Comic Relief. #davidlammy #ComicRelief,2019-03-07T08:13:26.000Z,,Ian ♀️♂️,"England, United Kingdom",false,23,53,4,13,-40,-19
reubenturner,https://t.co/p5TBmLieUr No more white saviours. Thanks @DavidLammy for inspiring the conversation.,2019-03-12T14:42:56.000Z,https://t.co/vqdDH5Yrqt,reuben turner,"Brighton, England",false,3,14,4,1,-13,1
DailyMailUK,Stacey Dooley receives outpouring of support from Comic Relief viewers as 'white saviour' trip to Africa airs https://t.co/WHkt8FeTUI,2019-03-16T20:05:03.000Z,https://t.co/ek8b6Uh75Q,Daily Mail U.K.,"London, UK",true,9,37,4,12,-25,-5
TravelLeisure,You and a friend can have breakfast and a private museum tour with Sir David Attenborough https://t.co/pP4k86BpZ8 https://t.co/rJV0cM31Ht,2019-02-21T19:45:46.000Z,http://t.co/vmvNyo6nXZ,Travel + Leisure,"New York, NY",true,3,8,3,0,-8,0
MaltesersUK,"We challenge you to take an EPIC #FunnyFace selfie as a family. Upload your image using #FunnyFace, tag us @MaltesersUK and we'll donate £10 to @comicrelief Relief on your behalf PLUS you could win a Maltesers Hamper and we’ll donate a further £100 on behalf of the winner! https://t.co/wh1GwXkTvh",2019-03-04T11:06:22.000Z,https://t.co/JEcf1h5wZ1,Maltesers UK,United Kingdom,true,20,28,3,17,-11,-17
campbellclaret,Fan/friend of @DavidLammy but really hope his attack on @comicrelief does not deter donors. In addition to their great work overseas they are one of the biggest supporters of mental health campaigns at home @TimetoChange @MindCharity @Rethink_ we would do a lot worse without them,2019-03-04T15:51:03.000Z,https://t.co/9Hm6oKvJe6,ALASTAIR CAMPBELL,London,true,32,203,3,39,-164,-29
y_alibhai,"#ComicRelief  Attacking decent white campaigners compromises anti-racist values and discourages these vital allies. We need to fight real Nazis and racists whose power is growing, My column.
https://t.co/nKg6XVxkPC",2019-03-04T21:08:38.000Z,http://t.co/yZxe32XLao,Yasmin alibhai-brown,NA,false,7,63,3,21,-42,-4
LeslieH24367191,"Labour have a serious problem with racism, I think their slogan should be for the many, not the Jew, David Lammy refers to ""white saviours"" when talking about people giving up their time for charity &amp; his twin below says the problem in Britain is white people https://t.co/OnwhPxKcI5",2019-03-06T09:41:15.000Z,,Leslie Harrington,"Birmingham, England",false,8,25,3,4,-21,-5
JasonManford,"It's an epic battle... Manford vs Freeman! 

Don't forget to tune in to this celebrity version of University Challenge hosted by David Baddiel on March 15th on BBC 2 for Comic Relief! 

Vicky 😃 https://t.co/oFv0h2dxd4",2019-03-06T18:00:42.000Z,https://t.co/6qzqNj8Mbr,Jason Manford,Manchester,true,15,70,3,3,-67,-12
folsforever,"2hrs + tuck into that NEW #OFFTHECUFFPOD ft @Miss_K_Vang 

💢 David Lammy vs Comic relief 
💢 Jordyn Woods #FREETRISTAN 
💢 Wiley Skepta response 
💢 Being the richest in your family 

https://t.co/EgNSn3CwR1

https://t.co/dWHyFLfSwx

https://t.co/y04Plk4Kho

 RT 🤙🏾 https://t.co/SBNktnKJAr",2019-03-07T08:09:40.000Z,https://t.co/ipzParWVFN,FOLS,"London, England",false,11,6,3,1,-5,-8
qzafrica,"British charities have a White Savior Complex when it comes to Africa but remain in denial 

https://t.co/RH2Yo5lo4s via @qzafrica https://t.co/ToGL80gVst",2019-03-07T15:17:25.000Z,https://t.co/IzpNx81nxK,Quartz Africa,NA,true,8,18,3,6,-12,-5
SileER,"'Lammy’s behaviour, once again, has been beyond appalling. Just who in Africa appointed him as the continent’s representative? He appears to have issues with white people which have now cost the poorest in Africa millions.'
https://t.co/lsSSMppAlF",2019-03-16T21:43:50.000Z,,SileER,"London, England",false,4,5,3,3,-2,-1
riki_rikidance,"Walked past the Sainsbury’s comic relief stand earlier. An old granny got asked for a donation, she said “no, fuck David Lammy” and everyone cheered. A really beautiful moment",2019-03-16T22:04:49.000Z,,RIKI,NA,false,17,91,3,2,-89,-14
RuralAssembly,Last week’s New York Times columns by Paul Krugman and David Brooks offer textbook examples of the unhelpful frames that define our conversation about rural America. https://t.co/H67RQS6D8U,2019-03-25T12:04:47.000Z,https://t.co/OLNcSsFwgP,Rural Assembly,United States,false,15,34,3,0,-34,-12
ajcdeane,Got around to reading some of the responses to my tweet about the Times article on David Lammy and Comic Relief. You can't dispute the conclusion that with rapier-like wit these guys just destroyed all before them. https://t.co/zrX4nthEq0,2019-03-26T16:44:42.000Z,https://t.co/tXlbqoCNSr,Alex Deane,London,false,7,32,3,20,-12,-4
TravelLeisure,You and a friend can have breakfast and a private museum tour with Sir David Attenborough https://t.co/QFHW7aGYQH https://t.co/5y02yhjEv4,2019-02-21T06:45:41.000Z,http://t.co/vmvNyo6nXZ,Travel + Leisure,"New York, NY",true,1,9,2,3,-6,1
VintageVibesEd,"Tomorrow is the day! Watch VIPs Piera, Norma, Shel and David enjoy the fabulous cooking of Michelin Star Chef @TomKitchin on tomorrow's BBC @SaturdayKitchen from 10am for @comicrelief

Let us know if you're going to watch! https://t.co/crL9JhWD4r",2019-02-22T17:33:18.000Z,https://t.co/KR8a1zSYc6,Vintage Vibes,"Edinburgh, Scotland",false,1,5,2,1,-4,1
otidanai,"And that's just 2 and a bit months, she is coming for the pro tour, possibly hosting The One Show for a while AND winning Strictly, among the projects we don't even know yet, like maybe hosting Comic Relief with Joe and that show she filmed with Stacey. https://t.co/EvDhjff47d",2019-02-23T20:48:04.000Z,,n⁷ is on a break 💜,NA,false,1,6,2,0,-6,1
TravelLeisure,You and a friend can have breakfast and a private museum tour with Sir David Attenborough https://t.co/FHHIt5xFNH https://t.co/r6Sdrpmx7s,2019-02-25T13:46:01.000Z,http://t.co/vmvNyo6nXZ,Travel + Leisure,"New York, NY",true,1,10,2,0,-10,1
TravelLeisure,You and a friend can have breakfast and a private museum tour with Sir David Attenborough https://t.co/0MsWGMLBaQ https://t.co/HTTz1qdu2B,2019-02-26T10:45:57.000Z,http://t.co/vmvNyo6nXZ,Travel + Leisure,"New York, NY",true,3,13,2,0,-13,-1
tmsruge,"I can distill this entire disaster of a #comicrelief #whitesavior defense by Barbara Ellen into one sentence: 

Why won’t you just let well-meaning white people do as they please?

Checking white privilege really ruffles some people’s feathers.
@idahorner 
https://t.co/PgHxlOM36u https://t.co/02Q6nm8HJx",2019-03-04T07:50:17.000Z,https://t.co/xBrZPDL5LG,TMS Ruge,Uganda,true,6,20,2,5,-15,-4
