user_username,text,created_at,user_url,user_name,user_location,user_verified,retweet_count,like_count,quote_count,reply_count,ratio_reply_like,ratio_quote_retweet
NBCNews,"BREAKING: Jury rules Monsanto 'Roundup' weed killer product was ""substantial factor"" in causing harm to groundskeeper Dewayne Johnson, who has terminal cancer; awards more than $250,000,000 in damages.",2018-08-10T22:23:59.000Z,https://t.co/Z73is4fJ3x,NBC News,"New York, NY",true,2878,6133,385,212,-5921,-2493
jennirsl,Boris Johnson's resignation was an act of desperation.  He knows the verdict of history is about to come down on him - and bury him.  My column for @nytimes. Boris Johnson Has Ruined Britain https://t.co/WDuiEENndy,2018-07-10T12:11:40.000Z,https://t.co/zzjnowhSdL,Jenni Russell,London,true,2994,5516,389,311,-5205,-2605
Eleisegui,"HISTÓRICO: El tribunal de San Francisco acaba de hallar culpable a la multinacional #Monsanto de contaminar y enfermar de cáncer al jardinero Dewayne Johnson. El glifosato produce esa enfermedad, estableció la Justicia estadounidense. Adiós al discurso corporativo. @MonsantoCo https://t.co/uHnGI1QWcW",2018-08-10T22:19:02.000Z,https://t.co/hqVZZGuMcl,Patricio Eleisegui,Ciudad de Buenos Aires,false,4183,5140,276,79,-5061,-3907
MSNBC,"BREAKING: Jury rules Monsanto 'Roundup' weed killer product was ""substantial factor"" in causing harm to groundskeeper Dewayne Johnson, who has terminal cancer; awards more than $250,000,000 in damages.",2018-08-10T22:30:01.000Z,https://t.co/YBwtJIhwY3,MSNBC,NA,true,1866,4166,166,131,-4035,-1700
cnnbrk,"In a groundbreaking case, a jury awards $289 million in damages to a man who said he got terminal cancer from Monsanto's popular weedkiller Roundup https://t.co/ub7wY2NMYZ https://t.co/ePMcxpHMGi",2018-08-10T22:37:29.000Z,https://t.co/ojQgQKzKzX,CNN Breaking News,Everywhere,true,2018,4038,388,287,-3751,-1630
HuffPost,"A California jury found Monsanto liable in a lawsuit filed by school groundskeeper Dewayne Johnson, who alleged the company’s glyphosate-based weed-killers caused his cancer. Johnson’s doctors said he is unlikely to live past 2020. https://t.co/nYK7okWQhE",2018-08-10T23:40:44.000Z,https://t.co/DLXRSufyhx,HuffPost,NA,true,2393,3853,421,192,-3661,-1972
SKinnock,"Boris Johnson was without doubt the worst Foreign Secretary that our country has ever had. Others have certainly made mistakes and errors of judgement, but they were not self-obsessed idiotic buffoons, intent on turning our country into a laughing stock. Good riddance.",2018-07-10T05:42:06.000Z,https://t.co/Tvm1WJaOXI,Stephen Kinnock,Port Talbot,true,807,3591,68,186,-3405,-739
stephanecel,UN HÉROS . Le courage de cet homme merveilleux. Etre en phase terminale d'un cancer et mener une bataille judiciaire contre #Monsanto. Et gagner. Merci Mr Dewayne Johnson. Tellement bouleversant. https://t.co/a1EG9VEECM,2018-08-11T15:40:59.000Z,https://t.co/gNd6ekUlwb,Stephane Celerier,Paris - NYC- LA,true,767,2657,15,34,-2623,-752
greenpeacefr,"#Monsanto condamné ! 
Ce verdict est historique et sonnerait peut-être enfin la fin du droit à polluer impunément pour le géant américain. 

Bravo à Dewayne Johnson pour sa persévérance et son courage. 
#glyphosate #MonsantoTrial 
https://t.co/r6nYWTcIm2",2018-08-11T09:20:35.000Z,https://t.co/MOUI21QsqO,Greenpeace France,Paris,true,1108,2055,71,49,-2006,-1037
joerogan,Jurors give $289 million to a man they say got cancer from Monsanto's Roundup weedkiller - CNN https://t.co/UVWL5c5IQ5,2018-08-11T04:23:14.000Z,https://t.co/UoPqZeUr22,Joe Rogan,NA,true,421,2009,65,202,-1807,-356
patriciajaniot,"En un caso sin precedentes, un jardinero le gana a Monsanto una demanda de 289 millones de dólares  por daños y perjuicios tras contraer cancer al usar durante años un herbicida cuyo principal ingrediente es el glifosato.

https://t.co/fjtecXydcN",2018-08-10T23:08:03.000Z,https://t.co/yKUyhh4GjN,Patricia Janiot,"Miami, FL",true,1698,1788,129,79,-1709,-1569
michaelpollan,Monsanto ordered to pay $289m as jury rules weedkiller caused man's cancer | Business | The Guardian https://t.co/S6zKzM3kEh,2018-08-11T01:19:52.000Z,https://t.co/PkOsbcsbBM,Michael Pollan,"Berkeley, CA",true,646,1732,89,39,-1693,-557
CarolineLucas,"Good news! EU must urgently ban Roundup, &amp; if UK Govt serious about safeguarding protections for health &amp; environment after possible Brexit, it must commit to a ban now.

Huge vindication for campaigners &amp; tells corporations they will be held accountable. https://t.co/6Y6qNRD4wM",2018-08-11T14:22:11.000Z,https://t.co/ewcgZ2enbv,Caroline Lucas,Brighton,true,936,1626,39,67,-1559,-897
guardian,Monsanto ordered to pay $289m as jury rules weedkiller caused man's cancer https://t.co/H8Dat0CjZQ,2018-08-10T22:50:47.000Z,https://t.co/c53pnmnuIT,The Guardian,London,true,966,1592,181,60,-1532,-785
Alyssa_Milano,Jury awards $289 million after man says he got terminal cancer from Monsanto's Roundup - CNN https://t.co/63ibKCUEQm,2018-08-10T23:26:52.000Z,https://t.co/XmPG6hQLsQ,Alyssa Milano,Los Angeles,true,377,1536,17,81,-1455,-360
CNN,A jury has awarded $289 million in damages to a man who said he got terminal cancer from Monsanto's popular weedkiller Roundup https://t.co/boukiOoJ5M https://t.co/ddGH7KJ3Ri,2018-08-10T22:48:31.000Z,https://t.co/imGp4Ieixi,CNN,NA,true,535,1172,89,77,-1095,-446
GeorgeMonbiot,"This has big implications: jury determines that Roundup herbicide caused DeWayne Johnson's cancer, and that Monsanto sought to suppress knowledge of its hazards: https://t.co/SjMra6ICk1",2018-08-11T06:33:20.000Z,http://t.co/DWv0C2B9q5,George Monbiot,NA,true,879,1172,66,39,-1133,-813
chizubunny,"Talc itself tak bahaya.
Talc is used in almost all powder based cosmetics eg. face powder &amp; eyeshadows.

Tapi SANGAT bahaya kalau talc ni hadir brsama satu setan dipanggil asbestos (&amp; setan ni ada dlm J&amp;J talcum powder).

Take care &amp; pls jgn apply benda merepek kt private part 🙁 https://t.co/NaWTF7Li0J",2018-07-14T03:49:04.000Z,,Bunny 🐰,NA,false,2784,1128,56,15,-1113,-2728
ARTEfr,"C'est un jugement historique, #Monsanto vient d'être condamné pour le cancer de Dewayne Johnson  ☢&gt; https://t.co/ee2oOTna2s #Glyphosate https://t.co/RvsygwzegP",2018-08-11T15:00:46.000Z,https://t.co/PxVJ5CSsdC,ARTE,"Paris, Strasbourg, Baden-Baden",true,832,1064,40,34,-1030,-792
DavidJHarrisJr,"Another powerful black American shares why he walked away from the Democrat plantation! 

There’s a massive black exodus taking place! 
 @UniteAmerica1st @usminority 
https://t.co/28C7gQyxKi",2018-07-14T02:08:49.000Z,https://t.co/ZdXptT1dYH,David J Harris Jr,"Texas, USA",false,393,918,71,92,-826,-322
careygillam,"And jury says @MonsantoCo loses,,, $250 million awarded in punitive damages to Johnson for his claims Roundup caused his cancer and Monsanto knew and failed to warn. #Rounduptrial",2018-08-10T22:06:28.000Z,https://t.co/q5Rbj8j5qW,carey gillam ✍️ 📓,NA,true,374,710,94,33,-677,-280
BreakingNews,"Jury rules Monsanto 'Roundup' weed killer product was ""substantial factor"" in causing harm to groundskeeper Dewayne Johnson, who has terminal cancer; awards more than $250,000,000 in damages. https://t.co/JsIT5Tj4uQ - @NBCNews",2018-08-10T22:38:25.000Z,https://t.co/yjD4mOeepa,Breaking News,"NYC, LA, London",true,423,702,95,31,-671,-328
RobertKennedyJr,"Great news gets even better! #MonsantoTrial

https://t.co/UJYByVzsKl",2018-08-13T21:02:50.000Z,https://t.co/Xi24MTmhj6,Robert F. Kennedy Jr,"Los Angles, California",true,294,626,38,22,-604,-256
CivilEats,"BREAKING: In a groundbreaking case against Monsanto, a jury has awarded $250 million in punitive damages and nearly $40 million in compensatory damages to a former school groundskeeper who said he got terminal cancer from the weedkiller Roundup.
https://t.co/463Oeuupz4",2018-08-10T23:20:41.000Z,https://t.co/j1B7jb0zYk,Civil Eats,USA,true,293,564,30,14,-550,-263
CNN,A jury has awarded $4.62 billion to 22 women who sued pharmaceutical giant Johnson &amp; Johnson alleging their ovarian cancer was caused by using its powder https://t.co/XKpl8srxo9 https://t.co/Lu4ySDsIJV,2018-07-14T04:46:08.000Z,https://t.co/imGp4Ieixi,CNN,NA,true,362,562,57,68,-494,-305
TIME,Women claimed Johnson &amp; Johnson's talc powder gave them ovarian cancer. They just won $4.7 billion in damages https://t.co/ACFB0LSacT,2018-07-13T02:25:03.000Z,https://t.co/vl89LXOvyB,TIME,NA,true,638,493,144,40,-453,-494
CNN,A jury has awarded $4.62 billion to 22 women who sued pharmaceutical giant Johnson &amp; Johnson alleging their ovarian cancer was caused by using its powder https://t.co/50fYrUM7ko https://t.co/mUsjzG3osT,2018-07-13T10:46:32.000Z,https://t.co/imGp4Ieixi,CNN,NA,true,445,479,87,48,-431,-358
Portes_Thomas,"#Monsanto condamné à verser 289 millions de $ de dommages pour ne pas avoir informé de la dangerosité du Roundup, son herbicide à base de #glyphosate, à l’origine du cancer de D.Johnson. Une première victoire qui en appelle d’autre. Il faut une interdiction totale et immédiate. https://t.co/ylgqGMCQJc",2018-08-10T23:15:48.000Z,https://t.co/PKEAVRdkar,Thomas Portes,"Montreuil, France",false,292,430,17,11,-419,-275
CNN,A jury has awarded $4.62 billion to 22 women who sued pharmaceutical giant Johnson &amp; Johnson alleging their ovarian cancer was caused by using its powder https://t.co/uDSbF2m2oB https://t.co/o8v7XiPvdZ,2018-07-16T04:00:19.000Z,https://t.co/imGp4Ieixi,CNN,NA,true,262,419,26,34,-385,-236
DMRegister,"The Superior Court jury deliberated for two and a half days before finding that Dewayne Johnson's non-Hodgkins lymphoma was at least partly due to using glyphosate, the primary ingredient in Roundup.  https://t.co/U93kvP0sCm",2018-08-10T23:01:06.000Z,https://t.co/l1zKlTUG8R,Des Moines Register,"Des Moines, Iowa, USA",true,232,418,44,16,-402,-188
ajplus,"A jury awarded $4.7 billion in damages to 22 women who say they developed ovarian cancer after using Johnson &amp; Johnson’s talc-based products, including its baby powder. https://t.co/W2mE2yGpKi",2018-07-13T13:47:41.000Z,https://t.co/dffekhz2Zn,AJ+,NA,true,808,403,131,17,-386,-677
MaryanneDemasi,"For years, Monsanto fought the science &amp; targeted academics who spoke out about possible health risks of its herbicide, Round Up. In a landmark legal battle, #Monsanto is ordered to pay $289-million after a jury ruled the weedkiller caused a man's cancer.  https://t.co/o20CD7hxs9",2018-08-10T23:04:11.000Z,https://t.co/Xiz6KhMFS8,"Maryanne Demasi, PhD",Sydney,false,231,391,33,13,-378,-198
g1,Câncer provocado por talco obriga Johnson &amp; Johnson a pagar R$ 18 bilhões em indenização https://t.co/VZQ1aIAnO4 #G1 https://t.co/E44nK4PXdC,2018-07-13T22:00:02.000Z,https://t.co/aU1rfIKpvv,g1,Brasil,true,103,380,45,23,-357,-58
g1,Câncer provocado por talco obriga Johnson &amp; Johnson a pagar R$ 18 bilhões em indenização https://t.co/VZQ1aIAnO4 #G1 https://t.co/z1P50BoTUb,2018-07-13T18:45:00.000Z,https://t.co/aU1rfIKpvv,g1,Brasil,true,124,372,47,23,-349,-77
CNN,A jury has awarded $4.62 billion to 22 women who sued pharmaceutical giant Johnson &amp; Johnson alleging their ovarian cancer was caused by using its powder https://t.co/4bVUkRGtyK https://t.co/nKknuXmvsB,2018-07-13T14:30:09.000Z,https://t.co/imGp4Ieixi,CNN,NA,true,247,367,70,36,-331,-177
libe,Round up: Monsanto condamné pour le cancer de Dewayne Johnson https://t.co/YaPz7HydAT https://t.co/DvOlHqqBie,2018-08-10T23:21:05.000Z,https://t.co/SlsdqdrCBm,Libération,"Paris, France",true,187,361,27,7,-354,-160
NPR,"Johnson &amp; Johnson has been ordered to pay $4.7 billion to 22 women and their families who say asbestos in the company's talcum powder contributed to their ovarian cancer.
https://t.co/VGiFxf6C0w",2018-07-13T18:05:00.000Z,https://t.co/NacrixPEkp,NPR,NA,true,309,357,74,26,-331,-235
CNN,"In a groundbreaking case, a jury awards $289 million in damages to a man who said he got terminal cancer from Monsanto's popular weedkiller Roundup https://t.co/rxeJ1Qk6eD https://t.co/O2AWRaXUkv",2018-08-11T02:46:05.000Z,https://t.co/imGp4Ieixi,CNN,NA,true,215,347,31,35,-312,-184
jornal_cultura,A empresa Johnson &amp; Johnson foi condenada a pagar cerca de US$ 5 bilhões por ser acusada de utilizar amianto em talcos nos Estados Unidos. 22 mulheres afirmam que a substância causou câncer nos ovários. A companhia nega a presença do elemento. #JornaldaCultura,2018-07-14T01:00:31.000Z,https://t.co/mKNx0OvBAF,Jornalismo TV Cultura,NA,true,151,322,54,10,-312,-97
sopitas,"En un juicio histórico, un jardinero con cáncer terminal le ganó una demanda a Monsanto y deja el antecedente para próximos casos, chequen esta historia https://t.co/q3C0h3vYAl https://t.co/BJEZkPyn4Z",2018-08-13T16:12:36.000Z,https://t.co/fCwfsZUiYt,Sopitas,Mexico,true,146,317,2,4,-313,-144
euronewsar,"#جونسون_أند_جونسون تدفع #تعويضات بقيمة 4.7 مليار دولار لمصابات بـ #السرطان بسبب منتجاتها من بينها #بودرة_أطفال
للمزيد:https://t.co/l9mWcxkWu2 https://t.co/CUUF1A8BK7",2018-07-13T16:00:39.000Z,http://t.co/QUX276wyYg,euronews عــربي,europe,true,389,303,132,56,-247,-257
RedTRaccoon,Jury awards $289 million after man says he got terminal cancer from Monsanto's Roundup - CNN https://t.co/MHzLrdSVlM,2018-08-10T22:46:12.000Z,,Ted Corcoran (RedTRaccoon),"Garner, NC",false,139,299,11,15,-284,-128
Quicktake,Johnson &amp; Johnson was ordered to pay $4.69 billion to 22 women who claimed its baby powder was linked to their ovarian cancer https://t.co/9z8pbOJyAW #tictocnews https://t.co/wAZvxlZDw1,2018-07-13T14:02:30.000Z,https://t.co/VtjZNinDYb,Bloomberg Quicktake,NA,true,271,291,83,24,-267,-188
AFP,VIDEO: California jury orders agrochemical giant #Monsanto to pay nearly $290 mn for failing to warn dying groundskeeper Dewayne Johnson that its weed killer Roundup might cause cancer #Rounduptrial https://t.co/XlD9onxn8K,2018-08-11T12:15:00.000Z,https://t.co/nr2Pv8O51K,AFP News Agency,France,true,131,291,17,6,-285,-114
TIME,Women claimed Johnson &amp; Johnson's talc powder gave them ovarian cancer. They just won $4.7 billion in damages https://t.co/KnGrFwVtTd,2018-07-13T11:00:17.000Z,https://t.co/vl89LXOvyB,TIME,NA,true,279,284,46,14,-270,-233
WSJ,A jury found that Johnson &amp; Johnson should pay $4.69 billion in damages to 22 women and their families who blamed ovarian-cancer cases on asbestos in its iconic baby powder https://t.co/7qDItnrCwq,2018-07-12T23:47:05.000Z,https://t.co/9rMrYLEXTt,The Wall Street Journal,"New York, NY",true,277,263,45,24,-239,-232
501Awani,#AWANInews #AWANIpagi Produk mengandungi asbestos: Johnson &amp; Johnson diarah bayar ASD4.7 bilion https://t.co/dHeKuSHNob https://t.co/ukJuugExmN,2018-07-14T01:19:29.000Z,https://t.co/OPvKEvHWjZ,🇲🇾Astro AWANI🇲🇾,Malaysia,true,487,253,53,9,-244,-434
ScottAgness,Pacers second-round pick Alize Johnson shares a photo of him signing his first NBA contract. https://t.co/xd8mIlsDDI,2018-07-16T17:47:21.000Z,https://t.co/emSeYMgSoy,Scott Agness,Indianapolis,true,34,252,4,5,-247,-30
AmorDakotaJamie,"“The most important thing was the sense of trust. The trust of Dakota in Jamie, he would take care of her, and the trust of Jamie in Dakota, that she would take care of him”❤️ -Sam Taylor Johnson on #DakotaJohnson and #JamieDornan https://t.co/Tp3f964xTI",2018-07-10T17:47:24.000Z,,DakotaJJamieDUniverse❤️,"Melbourne, Australia",false,71,245,3,5,-240,-68
zoeharcombe,"I wonder which other toiletries are carcinogenic? 
I wonder how many babies have been harmed by talc, not just women? 
I wonder how much more Johnson &amp; Johnson earned from talc than they were fined...
https://t.co/CJRuLdtm3a",2018-07-13T11:29:37.000Z,https://t.co/va3kOSEPQh,"Dr Zoe Harcombe, PhD","Newport, Wales",true,119,242,14,34,-208,-105
