user_username,text,created_at,user_url,user_name,user_location,user_verified,retweet_count,like_count,quote_count,reply_count,ratio_reply_like,ratio_quote_retweet
JordanChariton,BREAKING: @WellsFargo CEO John Out Effective Immediately https://t.co/YEnCaXouXh,2016-10-12T22:27:53.000Z,https://t.co/aGgIuPczjj,Jordan,"New York, NY",true,183,299,46,24,-275,-137
VanityFair,Wells Fargo C.E.O. is forfeiting $41 million after Elizabeth Warren publicly shamed him https://t.co/jx6vkh0LPd,2016-10-03T01:07:04.000Z,https://t.co/psgyGKS7M7,VANITY FAIR,"New York, NY",true,119,290,21,15,-275,-98
lhfang,"Prosecute Wells Fargo? Guess who they have on retainer as lobbyists? Covington &amp; Burling, Eric Holder's law firm https://t.co/jD6YvaPsu2",2016-09-20T23:01:10.000Z,https://t.co/K3pNd6dpGD,Lee Fang,San Francisco,true,316,289,24,18,-271,-292
CBCAlerts,"Wells Fargo fined $185M for bank scam. Employees created 2M fake accounts to hit sales targets, charged consumers fees. 5,300 workers fired.",2016-09-08T19:48:25.000Z,http://t.co/vAXH6cjeS8,CBC News Alerts,Toronto,true,675,285,370,25,-260,-305
CNBCnow,"Sen. Warren slams Wells Fargo CEO for ""pushing blame"" on lower level employees, says ""it's gutless leadership"". https://t.co/CUaeJAyc3W",2016-09-20T15:33:53.000Z,https://t.co/xNSucapdhO,CNBC Now,NA,true,205,285,103,30,-255,-102
CNN,"""This was a staggering fraud"": Elizabeth Warren calls on Wells Fargo CEO to testify on fake bank account scandal https://t.co/jOVC6U4JJe",2016-09-12T16:28:00.000Z,https://t.co/imGp4Ieixi,CNN,NA,true,222,278,39,61,-217,-183
TulsiGabbard,"Sign my petition urging the DOJ to investigate &amp; prosecute Wells Fargo for fraud and abuse →
https://t.co/1jBlP5lRX6",2016-09-16T00:01:52.000Z,https://t.co/XjrWPEt95H,Tulsi Gabbard 🌺,Hawai'i,true,196,276,16,19,-257,-180
ajplus,"Wells Fargo CEO is (finally) stepping down over a massive fraud scandal.

A look back at when he got roasted by Senator Elizabeth Warren. https://t.co/j0kQKnnZYA",2016-10-13T10:57:11.000Z,https://t.co/dffekhz2Zn,AJ+,NA,true,213,276,22,9,-267,-191
CNN,"Wells Fargo fired 5,300 employees for creating millions of phony accounts over past 5 years https://t.co/dT7Bsrp3sc https://t.co/uSMjWzRq6B",2016-09-08T19:41:56.000Z,https://t.co/imGp4Ieixi,CNN,NA,true,400,269,184,64,-205,-216
CNNPolitics,"Elizabeth Warren to Wells Fargo CEO: ""You should resign"" and be ""criminally investigated"" https://t.co/rY7XCPyjRK https://t.co/yK3D6g6u1f",2016-09-21T11:04:10.000Z,https://t.co/KWFMkrEjdY,CNN Politics,"Washington, DC",true,152,267,21,40,-227,-131
VanityFair,Elizabeth Warren eviscerated a major bank C.E.O. on national television https://t.co/cNSgBPgGeY https://t.co/TggqHufsIc,2016-09-21T00:00:13.000Z,https://t.co/psgyGKS7M7,VANITY FAIR,"New York, NY",true,131,266,65,11,-255,-66
nomiprins,"If Wells Fargo CEO John Stumpf was a car thief, it'd be like he stole 5 cars &amp; had to give 1 back but could still profit selling the other 4",2016-09-28T16:56:26.000Z,https://t.co/Igg8a7xU3A,Nomi Prins,NA,true,250,265,11,22,-243,-239
ajplus,"Should Wells Fargo's CEO face jail time for the illegal “ghost” accounts?

Elizabeth Warren thinks so. https://t.co/CRmHIuMVl3",2016-10-03T20:41:01.000Z,https://t.co/dffekhz2Zn,AJ+,NA,true,228,264,28,17,-247,-200
TwitterMoments,"""You should resign,"" @SenWarren tells @WellsFargo CEO. https://t.co/RFbc3T3bNh",2016-09-20T17:39:28.000Z,https://t.co/nYOx6qThjk,Twitter Moments,"New York, USA",true,98,263,16,4,-259,-82
USATODAY,On today's #frontpage: Teachers try to take #9/11 beyond the textbooks; #WellsFargo fined $185 over bogus accounts https://t.co/wQoG9qLK9u,2016-09-09T10:30:34.000Z,https://t.co/yNKGMNvztv,USA TODAY,"USA TODAY HQ, McLean, Va.",true,121,262,21,13,-249,-100
CNN,Wells Fargo workers: I called the ethics line and was fired https://t.co/OBmWGE9VyU https://t.co/5kXh38etNg,2016-09-22T01:32:54.000Z,https://t.co/imGp4Ieixi,CNN,NA,true,227,262,40,21,-241,-187
ajplus,Wells Fargo is in serious trouble for a massive fraud scandal. Should bank executives face jail time? https://t.co/CNnILEOHLS,2016-10-01T01:06:02.000Z,https://t.co/dffekhz2Zn,AJ+,NA,true,239,259,49,22,-237,-190
TwitterMoments,"Wells Fargo says their ""culture is centered on doing what's right for customers,"" after fraudulent account charges.
https://t.co/RgaEycmEMA",2016-09-08T22:01:58.000Z,https://t.co/nYOx6qThjk,Twitter Moments,"New York, USA",true,215,257,61,17,-240,-154
gogreen18,NO MORE PROTECTIONS for white collar criminals! Stumpf &amp; wells fargo crooks should be in PRISON for stealing from millions of us. @cspan,2016-09-30T01:43:46.000Z,https://t.co/NFAjN9QjaY,Laci Green,"Los Angeles, CA",true,36,253,3,9,-244,-33
mattcutts,".@matt_levine on Wells Fargo is delish: https://t.co/Z0qQrRTc4F

1. You get what you measure. 2. The thing that you measure will be gamed.",2016-09-10T00:00:52.000Z,http://t.co/jy7N1nog89,Matt Cutts,"Washington, DC",true,228,252,36,7,-245,-192
chrislhayes,This whole thing is like a caricature of bad bank behavior https://t.co/QU6AKFmtfR,2016-09-08T20:31:38.000Z,http://t.co/1Wz5MmBtpw,Chris Hayes,Brooklyn,true,150,251,18,61,-190,-132
MarkRuffalo,Warren Skewers Wells Fargo CEO for Greed and 'Gutless Leadership' - https://t.co/gydkbh5kjl,2016-09-20T21:15:19.000Z,https://t.co/8TX3ewrd3v,Mark Ruffalo,NYS,true,45,248,8,12,-236,-37
nytimes,"Citing Wells Fargo’s “venal abuse of its customers,” California’s treasurer suspended many of its ties with the bank https://t.co/ChHayr1ZCj",2016-09-29T02:36:20.000Z,http://t.co/ahvuWqicF9,The New York Times,New York City,true,165,247,25,15,-232,-140
GunnelsWarren,Stop the insanity. It's time for the CEO of Wells Fargo to be fired &amp; prosecuted to the fullest extent of the law. https://t.co/rywAupvdbc,2016-10-01T17:52:04.000Z,https://t.co/62CyQuHdSt,Warren Gunnels,NA,false,64,243,6,11,-232,-58
CNN,Wells Fargo workers: I called the ethics line and was fired https://t.co/ysvj3obJuE https://t.co/sPkUCw4Unk,2016-09-21T13:28:00.000Z,https://t.co/imGp4Ieixi,CNN,NA,true,201,242,31,30,-212,-170
IngrahamAngle,"How Reassuring: Wells Fargo to pay $185 million, fire 5,300 workers over allegations employees opened fake accounts https://t.co/9WTVdi96v9",2016-09-08T23:01:04.000Z,https://t.co/TTlV8AcUb2,Laura Ingraham,DC,true,206,240,21,46,-194,-185
CNN,Wells Fargo CEO forfeits $41 million in stock awards as bank launches probe into phony accounts scandal https://t.co/yVU41d3dh4 https://t.co/TMa4q9c94I,2016-09-27T23:33:27.000Z,https://t.co/imGp4Ieixi,CNN,NA,true,184,239,34,48,-191,-150
jmorganteen,Sen. Warren to Wells Fargo CEO Stumpf: 'You should be criminally investigated' https://t.co/gzcRIB226Q https://t.co/vgY0GGbuDb,2016-09-20T16:18:31.000Z,http://t.co/usU5VK8LWA,Jeff Morganteen,New York City,true,100,238,16,8,-230,-84
MarkRuffalo,Wells Fargo just made the case for Elizabeth Warren’s bank agency ➡️ @EmilyRPeck &amp; @BenDWalsh https://t.co/W6DhJyUnPj # via @HuffPostBiz,2016-09-09T19:41:11.000Z,https://t.co/8TX3ewrd3v,Mark Ruffalo,NYS,true,74,237,4,6,-231,-70
nytimes,Wells Fargo’s chief will forfeit $41 million in stock awards and lose other compensation over  sham accounts scandal https://t.co/5T5KqFs8tK,2016-09-28T11:40:04.000Z,http://t.co/ahvuWqicF9,The New York Times,New York City,true,217,237,72,34,-203,-145
SuzeOrmanShow,This is why Elizabeth Warren's is my hero.    The world needs more people like this. Watch this video.  Wow  https://t.co/jrUOVRE9mF,2016-09-20T18:58:21.000Z,https://t.co/nDrbmnlecO,suzeormanshow,The Bahamas,true,91,234,8,8,-226,-83
MotherJones,Elizabeth Warren eviscerated the Wells Fargo CEO https://t.co/O57MvdGFow,2016-09-21T01:15:07.000Z,https://t.co/1eLkGuGPwF,Mother Jones,NA,true,130,233,26,9,-224,-104
BruceBartlett,Republican senators outraged by Wells Fargo’s fraud want to eliminate the agency that uncovered it https://t.co/QxnWv8xIez,2016-09-21T01:29:06.000Z,https://t.co/fs0sNZ0Vsh,Bruce Bartlett,"Virginia, USA",false,291,233,28,13,-220,-263
washingtonpost,"""You should resign"": Elizabeth Warren excoriates Wells Fargo CEO John Stumpf https://t.co/ENG0MAaekA",2016-09-20T20:45:00.000Z,https://t.co/1KN78z0bbe,The Washington Post,"Washington, DC",true,117,232,21,24,-208,-96
FoxNews,Wells Fargo CEO John Stumpf resigns effective immediately  https://t.co/6mpIZuU7Ji https://t.co/mJ7p8BVKwJ,2016-10-12T21:32:57.000Z,https://t.co/s4jEId5Aef,Fox News,U.S.A.,true,118,232,19,58,-174,-99
HuffPostPol,Wells Fargo just made the case for Elizabeth Warren's bank agency https://t.co/inwwH2OtOA https://t.co/W3rfgPGeFZ,2016-09-09T18:41:05.000Z,https://t.co/tn6MKaH6mv,HuffPost Politics,"Washington, D.C.",true,201,230,16,4,-226,-185
nytimes,"5,300 Wells Fargo employees have been fired in the sham-account scandal. Now 3 U.S. attorneys have sent subpoenas. https://t.co/cz6d8B1Gxw",2016-09-15T04:17:03.000Z,http://t.co/ahvuWqicF9,The New York Times,New York City,true,209,229,37,34,-195,-172
BBCWorld,Elizabeth Warren mauls 'gutless' Wells Fargo boss https://t.co/K8JaenuvHV,2016-09-21T00:08:40.000Z,https://t.co/7NEgoMwJy3,BBC News (World),"London, UK",true,133,228,28,33,-195,-105
TulsiGabbard,"Wells Fargo CEO John Stumpf finally announced his resignation from Wells Fargo, effectively immediately. https://t.co/6il8jQT9ss",2016-10-12T21:55:47.000Z,https://t.co/XjrWPEt95H,Tulsi Gabbard 🌺,Hawai'i,true,83,227,11,17,-210,-72
CNN,Wells Fargo workers: I called the ethics line and was fired https://t.co/gz0l2VRwCI https://t.co/zsM4RgM8gS,2016-09-21T21:43:02.000Z,https://t.co/imGp4Ieixi,CNN,NA,true,221,225,39,27,-198,-182
VICENews,Elizabeth Warren tears into Wells Fargo CEO: 'You should resign' https://t.co/1Cvvkg7Icl https://t.co/xJaPcdxWD9,2016-09-20T20:33:57.000Z,,VICE News,Worldwide,true,96,224,16,10,-214,-80
HuffPostPol,"Wells Fargo's CEO is actually getting punished, thanks to Elizabeth Warren https://t.co/LBkuA8Avzl https://t.co/RfpscNqp70",2016-09-28T23:41:03.000Z,https://t.co/tn6MKaH6mv,HuffPost Politics,"Washington, D.C.",true,145,224,7,15,-209,-138
democracynow,"Former Wall Street executive @nomiprins: @WellsFargo CEO John Stumpf ""let 5,300 people take the fall for his criminal behavior” https://t.co/jCwenTVS8t",2016-09-23T13:01:45.000Z,https://t.co/McGBFQZwkq,Democracy Now!,New York,true,356,223,12,16,-207,-344
ericschiffer,No one wants to hear slick moral preening from a Wells Fargo CEO who turned a blind eye to an aggressive ripoff scam https://t.co/XGokYAJtFx,2016-09-21T14:26:38.000Z,https://t.co/4p4o1mgq50,Eric Schiffer,"Beverly Hills, CA",true,251,221,2,0,-221,-249
washingtonpost,Breaking: Wells Fargo CEO John Stumpf resigns in wake of scandal over bank's sales practices https://t.co/iPQu2wDjy3,2016-10-12T21:21:33.000Z,https://t.co/1KN78z0bbe,The Washington Post,"Washington, DC",true,188,221,60,25,-196,-128
midnight,"Wells Fargo CEO John Stumpf stepped down today, but is expected to walk away with nearly $200 million. That's $100 for every fake account.",2016-10-13T00:13:51.000Z,https://t.co/aK5fyDjOy8,@midnight,Home of the #HashtagWars,true,141,221,20,25,-196,-121
BostonGlobe,Elizabeth Warren had some harsh words for the CEO of Wells Fargo today. https://t.co/CtAOMb6taG,2016-09-20T20:04:08.000Z,https://t.co/6S0BAXe9dO,The Boston Globe,"Boston, MA",true,168,220,46,26,-194,-122
BusinessInsider,Watch Elizabeth Warren rip Wells Fargo CEO: 'You should resign' https://t.co/f0CJMiDTlR,2016-09-21T00:04:02.000Z,https://t.co/qJiLYVC7Jx,Business Insider,"New York, NY",true,185,220,57,14,-206,-128
paleofuture,Wells Fargo fired employees who called its own ethics hotline to report on the fake accounts being created https://t.co/X9UCKg2o1B,2016-09-22T14:50:57.000Z,https://t.co/zXE5quou2r,Matt Novak,Western Australia,false,378,219,59,9,-210,-319
KTLA,"5,300 Wells Fargo employees fired for creating over 2 million phony accounts that customers paid fees on https://t.co/9oUpizyWV4",2016-09-08T20:27:02.000Z,http://t.co/ZgOP41jU0Y,KTLA,"Los Angeles, CA",true,258,218,110,34,-184,-148
CNN,US opens investigation into Wells Fargo over opening of millions of fake accounts at bank https://t.co/zTtMhXx94V https://t.co/qFqPxVIUKP,2016-09-14T23:23:29.000Z,https://t.co/imGp4Ieixi,CNN,NA,true,179,214,25,31,-183,-154
People4Bernie,"""I'm not an expert in compensation"" Wells Fargo CEO John Stumpf https://t.co/C9g8mHXsWl",2016-09-20T14:34:49.000Z,https://t.co/dzsJsLMvqT,People for Bernie,United States,true,115,214,8,9,-205,-107
CNN,Wells Fargo workers: I called the ethics line and was fired https://t.co/S11gpJIAGh https://t.co/sfGxqYeBp7,2016-09-21T17:35:01.000Z,https://t.co/imGp4Ieixi,CNN,NA,true,170,212,36,27,-185,-134
Forbes,This former Wells Fargo employee is launching a campaign to get customers to close their accounts https://t.co/cxSlIkVXzM https://t.co/ZL48Q3RqMk,2016-09-30T14:31:01.000Z,https://t.co/6qjZ8PCpvM,Forbes,"New York, NY",true,176,209,29,9,-200,-147
India_Policy,#MustWatch: Elizabeth Warren's epic takedown of Wells Fargo CEO over fake accounts https://t.co/jPNfSNiUrV,2016-09-21T04:19:28.000Z,,हम भारत के लोग,"Kashmir, India",false,193,208,45,10,-198,-148
GDLA,Eric Schiffer discusses the Wells Fargo banking scandal. https://t.co/aXz59csxsv https://t.co/vLIvZAUN9K,2016-09-16T16:41:23.000Z,https://t.co/XqSYfxkJRb,Good Day LA,Los Angeles,true,174,207,0,3,-204,-174
WSJ,Wells Fargo to pay $185 million fine over account openings https://t.co/xcwu2FeLUA 🔓 https://t.co/kS0mSWaW9S,2016-09-08T19:22:57.000Z,https://t.co/9rMrYLEXTt,The Wall Street Journal,"New York, NY",true,269,206,77,9,-197,-192
LouDobbs,"Wells Fargo under fire – CEO Stumpf berated, called to resign. @SteveForbesCEO joins me #FoxLDT 7pm",2016-09-30T21:23:09.000Z,https://t.co/vYm0CcvB1k,Lou Dobbs,"New York, NY",true,83,206,9,46,-160,-74
TheOnion,Wells Fargo Fined For Opening 2 Million Fake Accounts https://t.co/gcWLawi0ME #WhatDoYouThink? https://t.co/NAp3hcgdF3,2016-09-09T21:27:07.000Z,https://t.co/McSMshhidB,The Onion,NA,true,64,204,9,7,-197,-55
BuzzFeedNews,Wells Fargo CEO Quits After Getting Brutally Owned By Elizabeth Warren https://t.co/jqey8fRAA1 https://t.co/P1iAdap7tL,2016-10-12T21:44:19.000Z,https://t.co/zNicBkWJ5l,BuzzFeed News,NA,true,60,204,15,4,-200,-45
lhfang,Wells Fargo stole from customers by fraudulently opening fake accounts w/fees. Hillary response is incredibly tepid https://t.co/b8QJnRCV7S,2016-09-20T15:44:45.000Z,https://t.co/K3pNd6dpGD,Lee Fang,San Francisco,true,164,203,17,20,-183,-147
NPR,"Ex-Wells Fargo workers who say they were fired for following the law are suing the bank, seeking $2.6B in damages. 
https://t.co/OA3YDGQsBj https://t.co/osSAGxx7jl",2016-09-26T15:30:29.000Z,https://t.co/NacrixPEkp,NPR,NA,true,147,203,26,6,-197,-121
TheLastWord,Wells Fargo CEO to forfeit $41 million amid investigation pushed for by Sen. Elizabeth Warren. https://t.co/ze1c77RYNs https://t.co/aEyHRbmQnH,2016-09-29T01:00:36.000Z,https://t.co/h5WAvwZhzw,The Last Word,📺 10PM ET on MSNBC,true,93,203,13,27,-176,-80
RBReich,Wells Fargo is the tip of a giant Wall Street iceberg scandal of cross-selling to bank customers financial... https://t.co/5WtXK8ZPyk,2016-09-20T23:17:44.000Z,https://t.co/NkWzjq1yYU,Robert Reich,"Berkeley, CA",true,170,200,10,17,-183,-160
NPR,California Imposes Sweeping Sanctions On Wells Fargo Amid Scandal https://t.co/7Kasc0xMnq,2016-09-28T23:13:36.000Z,https://t.co/NacrixPEkp,NPR,NA,true,118,200,19,15,-185,-99
RealMuckmaker,"Thanks to Elizabeth Warren's Consumer Financial Protection Bureau, Wells Fargo Fined for Fraud via @politicususa https://t.co/ZGsOCbWfGz",2016-09-09T22:19:34.000Z,https://t.co/fZ0ztKMCpt,Muckmaker™,"Montana, USA",false,200,199,9,12,-187,-191
CNN,Wells Fargo employees are fighting back. Two former workers have filed a class action suit https://t.co/KLQZc4JRY9 https://t.co/YzCzIoxZa3,2016-09-26T15:16:57.000Z,https://t.co/imGp4Ieixi,CNN,NA,true,120,196,26,17,-179,-94
ABC,Former Wells Fargo employees file lawsuit against bank seeking $2.6B in damages amid unauthorized accounts scandal. https://t.co/xK4UBJrTIf https://t.co/1p9Ki326yc,2016-09-26T22:04:10.000Z,https://t.co/26XEt8onYo,ABC News,New York City / Worldwide,true,191,195,26,15,-180,-165
NPR,Wells Fargo CEO John Stumpf Resigns Amid Scandal https://t.co/ZekRG492Tq,2016-10-12T21:46:09.000Z,https://t.co/NacrixPEkp,NPR,NA,true,100,195,51,21,-174,-49
paulapoundstone,I'm hoping Wells Fargo is secretly saving money for me in my secret account.,2016-09-10T12:43:32.000Z,https://t.co/wlrWXhRsEP,Paula Poundstone,United States,true,38,194,2,8,-186,-36
ericschiffer,Stumpf thinks Congress and the American people are chumps and won't see him as a total liar on a cheap money grab for Wells Fargo.,2016-09-20T16:16:57.000Z,https://t.co/4p4o1mgq50,Eric Schiffer,"Beverly Hills, CA",true,358,190,2,0,-190,-356
NewYorker,.@SenWarren's evisceration of the Wells Fargo C.E.O. is a reminder that very little has changed in banking culture. https://t.co/GbxTJo1dpd,2016-09-22T00:00:17.000Z,https://t.co/RLTwD4X3RQ,The New Yorker,"New York, NY",true,136,190,14,11,-179,-122
Forbes,This former Wells Fargo employee is launching a campaign to get customers to close their accounts https://t.co/Dgnhc1Bb8E https://t.co/rTv4tB0bMT,2016-10-01T22:31:01.000Z,https://t.co/6qjZ8PCpvM,Forbes,"New York, NY",true,187,190,20,21,-169,-167
mtaibbi,The breadth of the long-undetected Wells Fargo scam hammers home how easy it was for banks to mismark subprime loans https://t.co/YMU4cZaSj1,2016-09-20T20:21:42.000Z,https://t.co/I7ld6ZiRTz,Matt Taibbi,"New Jersey, USA",true,149,189,14,27,-162,-135
RealBankReform,".@SenatorMenendez: You said $30,000-60,000 is good money [for workers]. How much did you make last year?

Stumpf: 19.3 million

#WellsFargo",2016-09-20T15:05:59.000Z,https://t.co/17C2Tei1y2,AFR,Washington DC,true,101,187,8,10,-177,-93
NewYorker,Any doubts about @SenWarren’s feelings toward the Wells Fargo C.E.O. were cleared when she verbally eviscerated him. https://t.co/wezrIVpV2W,2016-09-23T12:00:18.000Z,https://t.co/RLTwD4X3RQ,The New Yorker,"New York, NY",true,101,187,18,12,-175,-83
TulsiGabbard,"We need to break Wells Fargo up and end this reckless pattern of fraud and theft. 
https://t.co/AV6zmpaPz6",2016-10-09T03:11:00.000Z,https://t.co/XjrWPEt95H,Tulsi Gabbard 🌺,Hawai'i,true,64,187,5,12,-175,-59
CNN,"Lawmakers: Wells Fargo CEO John Stumpf is running ""a criminal enterprise"" that evokes the Enron scandal https://t.co/pZqh9rTJ6b https://t.co/v0ZgwpE8yK",2016-09-29T22:26:01.000Z,https://t.co/imGp4Ieixi,CNN,NA,true,152,186,27,45,-141,-125
HuffPost,Wells Fargo CEO resigns in wake of bank scandal https://t.co/hX1xTiuhRb https://t.co/ZssWBdL5oo,2016-10-12T21:18:35.000Z,https://t.co/DLXRSufyhx,HuffPost,NA,true,93,186,29,24,-162,-64
karenbates,"Sen Warren demanded, and it was done:  Wells Fargo Chairman and CEO John Stumpf is retiring immediately https://t.co/P0dcPLM9u4",2016-10-12T21:36:53.000Z,https://t.co/szucveJtwM,"Not THAT Karen, thank you",Los Angeles,true,38,185,3,2,-183,-35
CNN,"More than 5,000 Wells Fargo employees were fired in its phony bank accounts scandal. What about the CEO? https://t.co/l64P0Hd0OC",2016-09-09T16:25:00.000Z,https://t.co/imGp4Ieixi,CNN,NA,true,177,184,35,49,-135,-142
SuzeOrmanShow,If I had an account @WellsFargo given what was discovered yesterday I sure would change banks now.  Although it's hard to find a good one.,2016-09-09T21:00:08.000Z,https://t.co/nDrbmnlecO,suzeormanshow,The Bahamas,true,76,184,12,29,-155,-64
ABCPolitics,".@elizabethforma to Wells Fargo CEO: ""You should be criminally investigated"" https://t.co/XOpfeDoZG9 https://t.co/4hEH6kpO2p",2016-09-20T15:50:18.000Z,https://t.co/SO3M0qceOH,ABC News Politics,"Washington, DC",true,143,183,17,18,-165,-126
mikiebarb,Hard to see how this would have happened without Sen Elizabeth Warren's blistering interrogation: https://t.co/EcWg3Sn6U1,2016-09-28T10:39:06.000Z,https://t.co/8JpN3gLjgE,Michael Barbaro,"New York, NY",true,107,183,12,7,-176,-95
CNN,"Lawmakers: Wells Fargo CEO John Stumpf is running ""a criminal enterprise"" that evokes the Enron scandal https://t.co/FxTuzAEhMX https://t.co/79Yfs0RJ4d",2016-09-30T02:06:36.000Z,https://t.co/imGp4Ieixi,CNN,NA,true,184,181,18,41,-140,-166
WSJ,"Breaking: Wells Fargo CEO John Stumpf to retire as chairman and chief executive, effective immediately  https://t.co/FUXQtnpaXx",2016-10-12T21:00:32.000Z,https://t.co/9rMrYLEXTt,The Wall Street Journal,"New York, NY",true,259,181,83,32,-149,-176
CNN,Wells Fargo CEO John Stumpf steps down in wake of scandal over opening of millions of phony accounts https://t.co/LBNXykZTY1 https://t.co/zdOgjaZmEQ,2016-10-13T21:33:56.000Z,https://t.co/imGp4Ieixi,CNN,NA,true,131,181,20,42,-139,-111
CharlesPPierce,I went to D.C. to watch Elizabeth Warren stand up for our country today https://t.co/fv9XU8s4UA https://t.co/zdG7bL8e1z,2016-09-20T20:52:18.000Z,https://t.co/aDSrJ4UuCQ,Charles P. Pierce,Earth,true,79,180,14,8,-172,-65
Forbes,Cartoon of the day: https://t.co/ZH3YWpyVs0 https://t.co/qIIOT4DdIc,2016-09-22T17:16:01.000Z,https://t.co/6qjZ8PCpvM,Forbes,"New York, NY",true,145,179,19,11,-168,-126
CNN,Wells Fargo workers say fake bank accounts began years ago https://t.co/jXyXcxsfpo https://t.co/w23jTNxdmc,2016-09-26T17:28:01.000Z,https://t.co/imGp4Ieixi,CNN,NA,true,175,179,27,27,-152,-148
splinter_news,"Daaaaaaaamn.

Elizabeth Warren just put Wells Fargo's CEO on blast, calling him a greedy, gutless criminal: https://t.co/MogJyp3MqA",2016-09-20T21:42:31.000Z,https://t.co/PX2jtaAWNp,Splinter,NA,true,152,178,25,7,-171,-127
ajplus,"Wells Fargo bank executive steps down after the fake accounts scandal. 

A look back at what happened:
https://t.co/4uNxvsdvTL",2016-10-12T21:20:11.000Z,https://t.co/dffekhz2Zn,AJ+,NA,true,145,178,22,2,-176,-123
CNN,"More than 5,000 Wells Fargo employees were fired in its phony bank accounts scandal. What about the CEO? https://t.co/MD61qKNcgS",2016-09-09T19:13:00.000Z,https://t.co/imGp4Ieixi,CNN,NA,true,154,176,42,60,-116,-112
RBReich,"Don’t cry for John Stumpf, who today resigned as CEO of Wells Fargo. Even after the claw-back of his last year’s... https://t.co/sXE34kNKbv",2016-10-12T21:49:07.000Z,https://t.co/NkWzjq1yYU,Robert Reich,"Berkeley, CA",true,71,176,12,26,-150,-59
