user_username,text,created_at,user_url,user_name,user_location,user_verified,retweet_count,like_count,quote_count,reply_count,ratio_reply_like,ratio_quote_retweet
SenSanders,"How many people at Wells Fargo are going to jail? Zero. But if you smoke marijuana in this country, you get a criminal record.",2016-09-20T13:56:19.000Z,https://t.co/8AS4FHJNoG,Bernie Sanders,Vermont/DC,true,9022,14503,642,267,-14236,-8380
SenSanders,"How many people at Wells Fargo are going to go to jail? Zero. But if you smoke marijuana in this country, you get a criminal record.",2016-09-16T13:22:01.000Z,https://t.co/8AS4FHJNoG,Bernie Sanders,Vermont/DC,true,7855,13837,525,233,-13604,-7330
SenSanders,"Wells Fargo has shown that 7 years after the crash, fraud still appears to be the business model on Wall Street. https://t.co/gNGdZbq94X",2016-09-16T20:41:06.000Z,https://t.co/8AS4FHJNoG,Bernie Sanders,Vermont/DC,true,3496,5641,307,206,-5435,-3189
SenSanders,I have a very simple question for the regulators who fined Wells Fargo: https://t.co/IQVCGGWxUp,2016-09-19T20:36:01.000Z,https://t.co/8AS4FHJNoG,Bernie Sanders,Vermont/DC,true,2625,5380,195,189,-5191,-2430
cspan,".@SenWarren #WellsFargo CEO: ""You should resign. You should give back the money that you took..."" https://t.co/aPZViWGJIN",2016-09-20T16:14:39.000Z,https://t.co/L3A4afzX6T,CSPAN,"Washington, D.C.",true,3610,5025,1516,227,-4798,-2094
SenWarren,"As I said: @WellsFargo CEO Stumpf should resign, return every nickel he made during the scam, &amp; face DOJ/SEC investigation. He’s 1 for 3.",2016-10-12T23:08:54.000Z,http://t.co/wsbNrrUt,Elizabeth Warren,NA,true,1519,4485,135,250,-4235,-1384
SenWarren,"If you missed my questions for @WellsFargo CEO John Stumpf on his gutless leadership earlier today, take a look. https://t.co/5brb1ARRqC",2016-09-21T00:37:16.000Z,http://t.co/wsbNrrUt,Elizabeth Warren,NA,true,1782,4145,527,572,-3573,-1255
HillaryClinton,Appalling behavior from Wells Fargo. This is exactly why we need a strong @CFPB—and can't let Trump dismantle it. https://t.co/tTA2jz7unf,2016-09-09T21:10:47.000Z,https://t.co/99DVW9q1yt,Hillary Clinton,"New York, NY",true,1531,3963,156,565,-3398,-1375
SenWarren,".@WellsFargo CEO John Stumpf should resign, give back the money he took while the scam was going on, &amp; be criminally investigated.",2016-09-20T19:03:38.000Z,http://t.co/wsbNrrUt,Elizabeth Warren,NA,true,1468,3739,145,280,-3459,-1323
SenSanders,"Fraud at big banks:
✅ Bank of America 
✅ Wells Fargo
✅ Goldman Sachs

It's about time to break up these big banks.",2016-10-06T16:31:00.000Z,https://t.co/8AS4FHJNoG,Bernie Sanders,Vermont/DC,true,1412,3695,266,303,-3392,-1146
SenSanders,"It's a disgrace that while Americans were defrauded by Wells Fargo, the executive in charge received $124 million. https://t.co/QKwO5ZTuu3",2016-09-12T15:47:22.000Z,https://t.co/8AS4FHJNoG,Bernie Sanders,Vermont/DC,true,2406,3220,228,245,-2975,-2178
SenWarren,"If @WellsFargo’s John Stumpf is leaving with all of his ill-gotten millions, that's still not real accountability.",2016-10-12T23:10:59.000Z,http://t.co/wsbNrrUt,Elizabeth Warren,NA,true,1124,3107,55,191,-2916,-1069
SenWarren,".@WellsFargo’s Stumpf will be accountable only if he resigns, returns every nickel he got during the scam, &amp; faces DOJ &amp; SEC investigation.",2016-09-26T16:52:06.000Z,http://t.co/wsbNrrUt,Elizabeth Warren,NA,true,730,2606,58,136,-2470,-672
SenWarren,Watch my questioning of @WellsFargo CEO John Stumpf &amp; his gutless leadership at today’s @SenateBanking hearing: https://t.co/5brb1AAgz4,2016-09-20T19:05:02.000Z,http://t.co/wsbNrrUt,Elizabeth Warren,NA,true,977,2367,307,348,-2019,-670
kylegriffin1,Wow— Elizabeth Warren destroyed the CEO of Wells Fargo this AM. Full clip here: https://t.co/yJMSY4CYEH https://t.co/AtpOIqBMnk,2016-09-20T20:06:48.000Z,https://t.co/1vRL91g006,Kyle Griffin,"Los Angeles, CA",true,1891,2347,558,60,-2287,-1333
SenWarren,"If John Stumpf can oversee a massive fraud &amp; walk away w/ $100M+, why should we expect any CEO to follow the law? https://t.co/wixnesLKGh",2016-09-26T16:51:04.000Z,http://t.co/wsbNrrUt,Elizabeth Warren,NA,true,1195,2301,103,191,-2110,-1092
CNBC,"Sen. Warren slams Wells Fargo CEO for ""pushing blame"" on lower level employees, says ""it's gutless leadership"". https://t.co/3p2kebseDb",2016-09-20T15:34:06.000Z,https://t.co/OhV9V1EIa6,CNBC,"Englewood Cliffs, NJ",true,1622,2170,394,132,-2038,-1228
SenWarren,.@WellsFargo’s definition of “accountable” is to push blame on low-level employees who don’t have money or PR firms to defend themselves.,2016-09-20T18:58:30.000Z,http://t.co/wsbNrrUt,Elizabeth Warren,NA,true,783,1998,42,85,-1913,-741
CNN,"Elizabeth Warren to Wells Fargo CEO: ""You should resign"" and be ""criminally investigated"" https://t.co/K2mdkNfhhm https://t.co/1tTXUhXSm3",2016-09-21T01:36:49.000Z,https://t.co/imGp4Ieixi,CNN,NA,true,994,1845,209,208,-1637,-785
SenWarren,.@WellsFargo employees who tried to sound the alarm about the creation of fake accounts were fired. Their lives turned upside down.,2016-09-28T14:09:18.000Z,http://t.co/wsbNrrUt,Elizabeth Warren,NA,true,678,1497,27,95,-1402,-651
CNN,"Elizabeth Warren to Wells Fargo CEO: ""You should resign"" and be ""criminally investigated"" https://t.co/M4m1ztMRc8 https://t.co/vOTNZS0rTM",2016-09-20T21:10:00.000Z,https://t.co/imGp4Ieixi,CNN,NA,true,900,1458,158,179,-1279,-742
SenWarren,Tonight I'll be talking to Rachel @Maddow about today's @SenateBanking hearing with @WellsFargo CEO John Stumpf. Tune in at 9PM ET!,2016-09-21T00:27:19.000Z,http://t.co/wsbNrrUt,Elizabeth Warren,NA,true,271,1428,36,119,-1309,-235
Aspiration,"If your money is with #WellsFargo, it's time to move to a financial partner you can trust:

https://t.co/E6sPT7XQgb https://t.co/7ZfimGezZr",2016-09-16T02:09:35.000Z,https://t.co/EHxz6XD10x,Aspiration,🌎,true,546,1403,121,117,-1286,-425
SenWarren,.@WellsFargo CEO Stumpf will be just fine: he keeps his job &amp; most of the money he made while massive fraud went on under his nose.,2016-09-28T14:10:33.000Z,http://t.co/wsbNrrUt,Elizabeth Warren,NA,true,562,1375,50,159,-1216,-512
keithellison,"Mr Stumpf is the CEO of @WellsFargo and his most common answer to my questions about how his bank is run: “I don’t know.""",2016-09-29T16:32:12.000Z,https://t.co/o40dRcrJRI,Keith Ellison,"Minnesota, USA",true,726,1290,75,96,-1194,-651
SenSanders,What does Wells Fargo CEO John Stumpf get for overseeing a massive fraud of the American people? $134 million. https://t.co/82xxMMoBkl,2016-10-13T16:52:30.000Z,https://t.co/8AS4FHJNoG,Bernie Sanders,Vermont/DC,true,864,1269,125,159,-1110,-739
SenWarren,"The @CFPB caught @WellsFargo in a massive, years-long scam. CEO John Stumpf hasn’t resigned. He hasn’t fired 1 senior executive.",2016-09-20T18:56:10.000Z,http://t.co/wsbNrrUt,Elizabeth Warren,NA,true,553,1257,48,137,-1120,-505
CNN,Wells Fargo is catching heat from Senators Bernie Sanders and Elizabeth Warren over its treatment of the military https://t.co/Ic5KyFPCu7 https://t.co/JpZ9BQJcy4,2016-10-07T15:48:01.000Z,https://t.co/imGp4Ieixi,CNN,NA,true,534,1248,35,69,-1179,-499
TulsiGabbard,"It’s very clear:
-John Stumpf should resign as CEO of Wells Fargo
-There should be a criminal investigation
-Wells Fargo should be broken up",2016-10-06T21:46:00.000Z,https://t.co/XjrWPEt95H,Tulsi Gabbard 🌺,Hawai'i,true,546,1218,28,43,-1175,-518
SenWarren,".@WellsFargo CEO John Stumpf blamed his bank’s massive fraud on 5300 low-level bank tellers, branch managers &amp; customer service reps.",2016-09-23T15:08:51.000Z,http://t.co/wsbNrrUt,Elizabeth Warren,NA,true,485,1195,77,171,-1024,-408
SenSanders,To @TheJusticeDept I say: Wall Street won’t change until we make it clear that no CEO is too big to jail. https://t.co/xwgt4uHqDi,2016-10-05T17:17:36.000Z,https://t.co/8AS4FHJNoG,Bernie Sanders,Vermont/DC,true,574,1184,38,88,-1096,-536
SenSanders,Wells Fargo’s Business Model is Fraud https://t.co/4jKihtJqhl https://t.co/R4Lein6ekM,2016-09-20T21:10:50.000Z,https://t.co/8AS4FHJNoG,Bernie Sanders,Vermont/DC,true,535,1171,42,69,-1102,-493
CNN,"Elizabeth Warren to Wells Fargo CEO: ""You should resign"" and be ""criminally investigated"" https://t.co/FVqAeJFEw2 https://t.co/1sOLpGywBA",2016-09-21T11:03:19.000Z,https://t.co/imGp4Ieixi,CNN,NA,true,627,1154,106,126,-1028,-521
SierraDallas,Lmao Brent just got a call from Wells Fargo asking if he was at Popeyes Bc there was a $100 charge lmao he's in his pajamas in bed 😹 fraud,2016-10-05T05:22:40.000Z,https://t.co/gy6p4oeJvh,Sierra Dallas,NA,true,178,1104,0,8,-1096,-178
CNN,"Elizabeth Warren to Wells Fargo CEO: ""You should resign"" and be ""criminally investigated"" https://t.co/mw4bCPAX55 https://t.co/fG0eaQlpqF",2016-09-21T18:38:20.000Z,https://t.co/imGp4Ieixi,CNN,NA,true,618,1093,123,115,-978,-495
AP,"BREAKING: Wells Fargo CEO John Stumpf to resign, effective immediately, in wake of scandal over bank's sales practices.",2016-10-12T21:10:43.000Z,https://t.co/0HD7A9hKKy,The Associated Press,Global,true,979,1047,241,98,-949,-738
awealthofcs,"For his retirement package Wells Fargo CEO John Stumpf will receive 17 new checking accounts, 13 new credit cards &amp; 10,000 bank pens",2016-10-12T21:56:30.000Z,https://t.co/Md4o8cTyjS,Ben Carlson,"Grand Rapids, MI",true,377,1026,39,34,-992,-338
paulkrugman,"And this might never have come to light without Dodd-Frank, which Republicans want to kill https://t.co/LUyT3eIY8A",2016-09-08T21:43:30.000Z,https://t.co/eyXDbYebpR,Paul Krugman,New York City,true,822,1006,54,60,-946,-768
matthewstoller,So 5300 low-level Wells Fargo employees independently came up with the same scam. Ok.,2016-09-08T23:30:04.000Z,https://t.co/8NgpF8Bovm,Matt Stoller,"Washington, DC",true,547,928,51,48,-880,-496
SenWarren,The @CFPB’s investigation of @WellsFargo uncovered staggering workplace conditions imposed on employees to meet sales quotas.,2016-09-23T15:09:44.000Z,http://t.co/wsbNrrUt,Elizabeth Warren,NA,true,319,906,32,87,-819,-287
janeosanders,"Need to take back US Senate! Bernie in NY, PA, OH 4 congressional candidates, pushed criminal charges 4 Wells Fargo scandal. #OurRevolution",2016-09-21T01:20:18.000Z,https://t.co/TZ2pndR0eG,Jane O'Meara Sanders,"Burlington, VT",true,394,901,21,29,-872,-373
NPR,'You Should Resign': Watch Sen. Elizabeth Warren Grill Wells Fargo CEO John Stumpf https://t.co/G5TtKyXx8g,2016-09-20T18:12:31.000Z,https://t.co/NacrixPEkp,NPR,NA,true,518,882,146,51,-831,-372
ChrisJZullo,Elizabeth Warren nails Wells Fargo. Government regulation protects against corporate greed https://t.co/Gfq4kbv8J5 #cnn #msnbc #foxnews,2016-09-20T22:40:25.000Z,https://t.co/NaYY3VGXj4,💉😷♻️🇺🇸 Christopher Zullo,United States,false,748,857,130,52,-805,-618
SenWarren,Yesterday I led a letter to @USDOL to investigate if @WellsFargo misclassified workers &amp; failed to pay overtime: https://t.co/JdsIupLhmQ,2016-09-23T15:10:44.000Z,http://t.co/wsbNrrUt,Elizabeth Warren,NA,true,222,830,21,69,-761,-201
SenWarren,"I'm glad @USDOL announced today that it will conduct a prompt &amp; thorough ""top-to-bottom review"" of @WellsFargo. https://t.co/IJN1XVDmF6",2016-09-27T18:30:51.000Z,http://t.co/wsbNrrUt,Elizabeth Warren,NA,true,205,806,14,26,-780,-191
NBCNightlyNews,"WATCH: Sen. Warren excoriates Wells Fargo CEO over abusive account openings scandal: ""You should be criminally investigated"". https://t.co/8K4I26K8uS",2016-09-20T22:15:07.000Z,https://t.co/siVgviWIA1,NBC Nightly News with Lester Holt,New York,true,491,801,112,85,-716,-379
SenWarren,Today at 10am @SenateBanking will question @WellsFargo CEO John Stumpf about its years-long scam. Watch: https://t.co/EG5ZjTAP7j,2016-09-20T14:00:15.000Z,http://t.co/wsbNrrUt,Elizabeth Warren,NA,true,259,757,47,171,-586,-212
AP,BREAKING: Wells Fargo CEO and former consumer banking executive to forfeit millions in stock awards amid sales practices scandal.,2016-09-27T23:15:14.000Z,https://t.co/0HD7A9hKKy,The Associated Press,Global,true,704,748,136,67,-681,-568
CNN,"Elizabeth Warren blasts Wells Fargo CEO: ""You should resign"" https://t.co/tuRlBT7eVa https://t.co/NHDVLtwIsw",2016-09-20T17:09:00.000Z,https://t.co/imGp4Ieixi,CNN,NA,true,461,744,68,102,-642,-393
SenWarren,"We know @WellsFargo’s Board knew of exec Carrie Tolstedt’s misconduct, but she’ll still retire with a huge payout: https://t.co/leTA3jL4we",2016-09-20T19:01:27.000Z,http://t.co/wsbNrrUt,Elizabeth Warren,NA,true,308,730,32,65,-665,-276
SenSanders,Wells Fargo’s abuse of its customers is not an aberration. https://t.co/hGQI4RWeUT,2016-09-22T17:30:17.000Z,https://t.co/8AS4FHJNoG,Bernie Sanders,Vermont/DC,true,297,710,18,38,-672,-279
SenWarren,.@WellsFargo employees who failed to meet management's outrageous sales goals were fired.,2016-09-28T14:08:10.000Z,http://t.co/wsbNrrUt,Elizabeth Warren,NA,true,247,698,14,45,-653,-233
RudyHavenstein,The main thing people at Wells Fargo did wrong was to commit fraud so simple that even someone in Congress could understand it. $WFC,2016-09-24T14:54:32.000Z,https://t.co/4ehh2IbrnR,Rudy Havenstein. I don't think so.,From Madrid to Calabasas.,false,287,689,22,30,-659,-265
CNBCnow,JUST IN: Wells Fargo chairman &amp; CEO has resigned as the representative of the 12th district to the Federal Reserve Advisory Council https://t.co/x61bLRtZht,2016-09-22T21:19:48.000Z,https://t.co/xNSucapdhO,CNBC Now,NA,true,629,686,171,82,-604,-458
JordanChariton,Imagine if @SenWarren was brave enough to use that same fervor she neutered Wells Fargo CEO w/ 2 fight on the stump for @BernieSanders?,2016-09-21T13:02:30.000Z,https://t.co/aGgIuPczjj,Jordan,"New York, NY",true,298,681,34,56,-625,-264
DrJillStein,"Wells Fargo CEO Stumpf is forfeiting $41M for fraudulent business practices. Wealthy banksters should not get ""get out of jail free"" cards.",2016-09-28T00:21:50.000Z,https://t.co/BjrJwJvI6R,Dr. Jill Stein🌻,Massachusetts,true,383,657,33,38,-619,-350
MaddowBlog,"Senator Warren... what's the expression?... ""leaves marks on people.""
(In this case, the Wells Fargo CEO.)
#Maddow https://t.co/3elCbWhaPS",2016-09-21T01:22:20.000Z,http://t.co/S4bi1oCj3l,Maddow Blog,New York City,true,333,641,65,72,-569,-268
deray,Senator Warren's grilling of the Wells Fargo CEO was incredible.,2016-09-23T00:26:45.000Z,https://t.co/xXkdEPyxGQ,deray,Wakanda,true,128,614,10,24,-590,-118
CronkiteSays,"BREAKING NEWS
Elizabeth Warren let Wells Fargo off the hook with a scolding to show Wall Street banks how helpful paying Hillary can be.",2016-09-20T22:45:09.000Z,,Walter Cronkite,Heaven,false,522,607,48,42,-565,-474
cnnbrk,"CEO John Stumpf retires, Wells Fargo says, a stunning downfall for one of industry's most powerful banking figures. https://t.co/mqEeElijx9 https://t.co/17FpKBPt5y",2016-10-12T21:29:22.000Z,https://t.co/ojQgQKzKzX,CNN Breaking News,Everywhere,true,397,606,112,134,-472,-285
_SPACEBAR,""" So when you get your FAFSA, deposit it in your Wells Fargo Account, I'll flip it in 2 weeks and I'll even give you a rack "" https://t.co/e3wAfu9ACS",2016-09-27T08:47:02.000Z,https://t.co/xRAb1JrpHm,winniga the pooh,THANKS,false,438,604,50,3,-601,-388
SilERabbit,Sen. Warren scolding #WellsFargo couldn't impress me less. Talk to me when you jail people. Warren had a choice and she backed Wall Street. https://t.co/Bqvrn4tB1J,2016-09-20T17:36:31.000Z,https://t.co/UK48vDRUfe,Nate's Liver - Commentary,NA,false,482,595,53,55,-540,-429
greta,"Where is A/G Lynch? Where are indictments? 5,300 Wells Fargo employees fired 2million phony accounts https://t.co/WowyUKetCo via @CNNMoney",2016-09-08T23:01:59.000Z,https://t.co/7oguweQgdo,Greta Van Susteren,"Washington, DC",true,470,589,90,153,-436,-380
thehill,Bernie Sanders has one question about the scandal at Wells Fargo: https://t.co/WM0gmoQjVA https://t.co/DrmZMzfmzi,2016-09-19T21:35:05.000Z,http://t.co/t414UtTRv4,The Hill,"Washington, DC",true,239,577,21,31,-546,-218
SenWarren,We know @WellsFargo is proud of cross-selling - getting customers to open more accounts. See the earnings calls: https://t.co/gPflL7JtkL,2016-09-20T18:59:35.000Z,http://t.co/wsbNrrUt,Elizabeth Warren,NA,true,182,563,4,33,-530,-178
cnnbrk,Wells Fargo CEO forfeits stock awards worth $41 million as bank launches probe into phony accounts. https://t.co/NU9bGOSB6U https://t.co/FsfW9G1UJg,2016-09-27T23:39:17.000Z,https://t.co/ojQgQKzKzX,CNN Breaking News,Everywhere,true,343,560,79,87,-473,-264
cnnbrk,"US opens investigation into Wells Fargo fake accounts scandal, US official says. https://t.co/4eDYPFa1AP https://t.co/4OaGBPwAsp",2016-09-14T21:55:29.000Z,https://t.co/ojQgQKzKzX,CNN Breaking News,Everywhere,true,332,553,50,54,-499,-282
keithellison,We have to clean up the banking industry. Let’s start with Wells Fargo. My op-ed in The Daily Beast: https://t.co/vpy1m07lZX,2016-09-28T19:54:10.000Z,https://t.co/o40dRcrJRI,Keith Ellison,"Minnesota, USA",true,245,541,14,31,-510,-231
DrJillStein,#WellsFargo's fraud is the kind of gangsterism that caused the 2008 financial meltdown. Vote for a new way of doing business. #VoteGreen,2016-09-20T17:15:12.000Z,https://t.co/BjrJwJvI6R,Dr. Jill Stein🌻,Massachusetts,true,340,540,11,24,-516,-329
Aspiration,"How to close your @WellsFargo bank account in 6 steps:

https://t.co/GlqBt1YQmE #WellsFargo $WFC https://t.co/Xx2KheeM4M",2016-09-26T19:22:10.000Z,https://t.co/EHxz6XD10x,Aspiration,🌎,true,447,483,40,32,-451,-407
cspan,".@SenWarren to #WellsFargo CEO after second round of questions: ""Wall Street won't change until we make it change."" https://t.co/tcdM3JLF5V",2016-09-20T17:29:06.000Z,https://t.co/L3A4afzX6T,CSPAN,"Washington, D.C.",true,335,478,134,33,-445,-201
KenJennings,"I'm not calling the Wells Fargo guy ""John Stumpf,"" what was his real name before John Oliver weighed in",2016-10-12T23:39:19.000Z,https://t.co/ptEHtl7hhi,Ken Jennings,Rainy Seattle,true,48,471,6,3,-468,-42
NPR,"#Breaking: Wells Fargo CEO John Stumpf is retiring from the company, effective immediately, according to a press release.",2016-10-12T21:16:11.000Z,https://t.co/NacrixPEkp,NPR,NA,true,268,458,119,48,-410,-149
ThisWeekABC,Sen. Warren tells Wells Fargo CEO John Stumpf to resign over accounts scandal  https://t.co/kRgyxZEis5 https://t.co/k1RzbQeZgq,2016-09-20T21:57:07.000Z,https://t.co/QXc3XEXzSJ,This Week,NA,true,240,454,21,30,-424,-219
splinter_news,Sen. Elizabeth Warren demanded Wells Fargo CEO John Stumpf step down amid scandal—and she just got her wish: https://t.co/MogJyp3MqA,2016-10-12T21:48:57.000Z,https://t.co/PX2jtaAWNp,Splinter,NA,true,324,451,52,35,-416,-272
ericschiffer,Stumpf should be fired for the Wells Fargo horror show. It led to bullets piercing Wells like a suicidal wild west gunslinger in action.,2016-09-08T22:49:36.000Z,https://t.co/4p4o1mgq50,Eric Schiffer,"Beverly Hills, CA",true,416,418,5,11,-407,-411
nytimes,"5,300 people were fired because of the Wells Fargo scandal. Why wasn't their boss? https://t.co/RLxNzDDQEY via @NYTOpinion",2016-09-15T23:37:06.000Z,http://t.co/ahvuWqicF9,The New York Times,New York City,true,372,416,58,55,-361,-314
SenWarren,Last week we asked @USDOL to investigate whether @WellsFargo violated the Fair Labor Standards Act. https://t.co/uLSbc4A4mX,2016-09-27T18:29:40.000Z,http://t.co/wsbNrrUt,Elizabeth Warren,NA,true,110,414,4,15,-399,-106
CNN,Wells Fargo CEO John Stumpf steps down in wake of scandal over opening of millions of phony accounts https://t.co/jCZGvluppU https://t.co/SYiSY4Vytr,2016-10-13T11:53:46.000Z,https://t.co/imGp4Ieixi,CNN,NA,true,290,403,63,70,-333,-227
nytimes,"""Your definition of accountability is to push this on your low-level employees. This is gutless leadership."" https://t.co/lMQD4rmhSF",2016-09-20T18:10:04.000Z,http://t.co/ahvuWqicF9,The New York Times,New York City,true,211,398,33,50,-348,-178
NBCNews,Elizabeth Warren goes on Twitter tirade after Wells Fargo CEO retires https://t.co/ec7XPFw6wY https://t.co/jLeHxI8B8n,2016-10-13T00:50:08.000Z,https://t.co/Z73is4fJ3x,NBC News,"New York, NY",true,187,397,11,57,-340,-176
ericschiffer,"""Stumpf should be fired for the Wells Fargo horror show."" https://t.co/h5KEykzt7a @LaMonicaBuzz",2016-09-09T23:16:25.000Z,https://t.co/4p4o1mgq50,Eric Schiffer,"Beverly Hills, CA",true,386,392,4,1,-391,-382
nytimes,Breaking News: Wells Fargo fined $185 million for widespread and pervasive illegal banking practices https://t.co/Z5INT0M1MB,2016-09-08T19:26:06.000Z,http://t.co/ahvuWqicF9,The New York Times,New York City,true,468,385,192,60,-325,-276
MotherJones,Elizabeth Warren Just Eviscerated the Wells Fargo CEO https://t.co/MSlszIqvnd,2016-09-20T17:43:50.000Z,https://t.co/1eLkGuGPwF,Mother Jones,NA,true,258,384,53,36,-348,-205
ericschiffer,"Wells Fargo blaming employees is ""biggest lie in the history of banking in the last several years” https://t.co/TGT6xUBo1n @RobertDonachie3",2016-09-09T23:25:18.000Z,https://t.co/4p4o1mgq50,Eric Schiffer,"Beverly Hills, CA",true,399,383,5,2,-381,-394
ThomCollinsWS,"The CEO of Wells Fargo created 2 million fake accounts, got 5,300 people fired &amp; is about to walk away with 200 million in stock amassed. ☺",2016-09-23T15:04:58.000Z,,Maze ft. Frankie Beverly - Reasons,NA,false,605,382,234,12,-370,-371
nytimes,Wells Fargo’s chief will forfeit $41 million in stock awards and lose other compensation over  sham accounts scandal https://t.co/mFn5bIe69W,2016-09-28T00:56:29.000Z,http://t.co/ahvuWqicF9,The New York Times,New York City,true,228,375,70,52,-323,-158
CNNBusiness,Elizabeth Warren's epic takedown of Wells Fargo CEO https://t.co/a9BfVK8Idl https://t.co/cqouiSeNs1,2016-09-20T16:23:27.000Z,https://t.co/ZLgYiheZkS,CNN Business,Global,true,237,370,54,20,-350,-183
Complex,Wells Fargo fined $185M after employees open millions of fake accounts: https://t.co/x84wc0oIJh https://t.co/9yxBA9Tzeh,2016-09-09T02:17:58.000Z,https://t.co/5hVNTuKmVa,Complex,New York,true,258,360,93,12,-348,-165
CNN,Wells Fargo CEO John Stumpf steps down in wake of scandal over opening of millions of phony accounts https://t.co/hNd66TV8p2 https://t.co/70eVljs4Bj,2016-10-13T14:37:16.000Z,https://t.co/imGp4Ieixi,CNN,NA,true,239,358,51,77,-281,-188
the_ironsheik,WELLS FARGO CEO JOHN STUMPF GO FUCK YOURSELF,2016-10-12T23:46:25.000Z,https://t.co/NCh260L7ix,The Iron Sheik,USA Bubba,true,129,351,11,7,-344,-118
CNN,"Elizabeth Warren blasts Wells Fargo CEO: ""You should resign"" https://t.co/TReaamm3oP https://t.co/z9Bxh3rjlV",2016-09-20T16:29:38.000Z,https://t.co/imGp4Ieixi,CNN,NA,true,141,347,23,75,-272,-118
PDChina,"‘@WellsFargo fires 5,300 employees over unapproved accounts; the bank was fined $185m to settle allegations https://t.co/gzvQGSG4Z0",2016-09-08T19:48:08.000Z,https://t.co/rWsij70zc8,"People's Daily, China","Beijing, China",true,429,342,159,11,-331,-270
donnabrazile,Wells Fargo Just Made The Case For Elizabeth Warren’s Bank Agency https://t.co/3v3G0MzpHw,2016-09-09T20:34:42.000Z,https://t.co/dlPG0YcxKo,Donna Brazile,USA,true,232,340,5,11,-329,-227
ericschiffer,Stumpf blaming low-level employees is like blaming a passenger in the backseat when a car’s been carjacked. Asinine. https://t.co/aTSsjzNABe,2016-09-14T23:17:51.000Z,https://t.co/4p4o1mgq50,Eric Schiffer,"Beverly Hills, CA",true,398,336,2,8,-328,-396
CNN,JUST IN: Wells Fargo CEO John Stumpf stepping down in the wake of scandal over opening of millions of phony accounts https://t.co/KdJ8wvr2Ti https://t.co/u2os50cSOZ,2016-10-12T21:27:01.000Z,https://t.co/imGp4Ieixi,CNN,NA,true,279,333,82,75,-258,-197
UberFacts,"Since 2011, Wells Fargo has fired 5,300 employees for creating unauthorized accounts for unwitting customers—all to up sales figures.",2016-09-12T05:17:00.000Z,https://t.co/uVFxvFrYJP,UberFacts,🌎,true,129,332,8,8,-324,-121
TheDailyShow,".@AdamLowitt delves into Wells Fargo’s fake-account scam in his new segment, ""Where Do You Get The Balls?"" https://t.co/MjyZsYYaRt https://t.co/AD2N38kEfq",2016-09-22T19:10:18.000Z,https://t.co/SparsYZXFO,The Daily Show,NA,true,116,332,9,8,-324,-107
jamieleecurtis,#dunpstumpf bye bye Mr. Stumpf!!!!Senator Elizabeth Warren questions Wells Fargo CEO John Stumpf at Bankin... https://t.co/HqoyCskiVU,2016-10-13T13:54:51.000Z,,Jamie Lee Curtis,Near enough to hear the ocean,true,47,326,5,19,-307,-42
RBReich,"It’s a start. Now, fire him. 

What do you think? https://t.co/cA40ZyXTJu",2016-09-28T06:25:52.000Z,https://t.co/NkWzjq1yYU,Robert Reich,"Berkeley, CA",true,192,325,32,64,-261,-160
latimes,Elizabeth Warren slams Wells Fargo CEO over the company's fake accounts scandal https://t.co/M6S0BVWRYa https://t.co/PuRHpslWt7,2016-09-20T16:05:11.000Z,https://t.co/WeffKZ2O0l,Los Angeles Times,"El Segundo, CA",true,132,314,10,29,-285,-122
CNN,Elizabeth Warren wants Wells Fargo firings investigated https://t.co/MO3qpUuDpl https://t.co/UhZz3IJZCj,2016-09-22T19:41:01.000Z,https://t.co/imGp4Ieixi,CNN,NA,true,146,312,24,52,-260,-122
HuffPost,"Elizabeth Warren hammers Wells Fargo CEO: ""You should be criminally investigated"" https://t.co/TVG4qawm2W https://t.co/PzekC3Tr0Y",2016-09-20T22:05:56.000Z,https://t.co/DLXRSufyhx,HuffPost,NA,true,140,306,20,24,-282,-120
RichardAngwin,"KABOOM!!!! Senator Elizabeth Warren takes a flamethrower to John Stumpf, CEO of Wells Fargo.
#ows #mapoli #tcot #1u https://t.co/WyO26lMdj8",2016-09-29T09:45:22.000Z,,Richard Angwin,United States,false,250,306,22,17,-289,-228
CNN,"Calls getting louder for Wells Fargo CEO to step down; He'd leave with $200M, analysis shows https://t.co/8pYIdC5PTm https://t.co/M2kAGjNmXQ",2016-09-22T22:36:33.000Z,https://t.co/imGp4Ieixi,CNN,NA,true,256,301,104,100,-201,-152
keithellison,A quick cut of @WellsFargo CEO John Stumpf answering my questions. He doesn't seem to know a lot about how his company is run. https://t.co/Oaf6AGAjtM,2016-09-29T17:25:57.000Z,https://t.co/o40dRcrJRI,Keith Ellison,"Minnesota, USA",true,246,300,41,41,-259,-205
