user_username,text,created_at,user_url,user_name,user_location,user_verified,retweet_count,like_count,quote_count,reply_count,ratio_reply_like,ratio_quote_retweet
jimcramer,"I need to know your views on Wells Fargo.. $WFC so I can ask John Stumpf, the ceo, what you would like to know...",2016-09-13T02:40:56.000Z,https://t.co/GnLAn0PlX8,Jim Cramer,New York City,true,6,35,7,162,127,1
WellsFargo,"Wells Fargo Chairman, CEO John Stumpf retires; Board of Directors elects Tim Sloan CEO, Director: https://t.co/RgDNYmm1U5",2016-10-12T21:42:53.000Z,https://t.co/m7vc8i3MJ9,Wells Fargo,"San Francisco, CA",true,99,85,60,125,40,-39
CNNBusiness,"Wells Fargo CEO to tell Congress: The bank will end controversial sales goals October 1, earlier than planned. https://t.co/A9OlUXl3FI",2016-09-28T13:19:09.000Z,https://t.co/ZLgYiheZkS,CNN Business,Global,true,64,50,8,79,29,-56
FoxBusiness,".@SenWarren on @WellsFargo: ""Is this a case of a bank that is so giant that you really can't manage it?"" https://t.co/QU913OqqkY",2016-09-15T17:45:07.000Z,https://t.co/ytWMvJlUP9,FOX Business,"New York, NY",true,8,12,11,35,23,3
theblaze,"Elizabeth Warren tells Wells Fargo CEO to resign, says he should be criminally investigated https://t.co/L6RBnBN9uc https://t.co/WFkO78x5DO",2016-09-20T19:37:37.000Z,https://t.co/fzW2udWeEx,TheBlaze,"Dallas, TX",true,25,30,13,51,21,-12
KKPDoc,"#MKTG360FA16 Research cross-selling and ethics in sales, and discuss accordingly https://t.co/WuegVrP93y via @WSJ",2016-09-08T21:29:56.000Z,https://t.co/rmJTOzCxGy,Dr. Kimberly K. Powell,NA,false,3,3,0,20,17,-3
CNBC,Op-Ed: Stop beating up on Wells Fargo and John Stumpf https://t.co/oWVtfcqrPJ via @cnbcopinion,2016-09-22T14:39:53.000Z,https://t.co/OhV9V1EIa6,CNBC,"Englewood Cliffs, NJ",true,9,9,6,23,14,-3
USATODAY,Wells Fargo's CEO is expected to apologize for the bank's opening of secret accounts without permission: https://t.co/y1vh2ShNkL (Photo: AP) https://t.co/NFgS0VngKy,2016-09-20T13:22:38.000Z,https://t.co/yNKGMNvztv,USA TODAY,"USA TODAY HQ, McLean, Va.",true,23,16,5,27,11,-18
CNNPolitics,"A top economic adviser to Donald Trump calls the Wells Fargo scandal ""just stupid, greedy behavior"" https://t.co/QopYPUFoXC via @CNNMoney https://t.co/KQSUd2v55y",2016-10-02T22:30:01.000Z,https://t.co/KWFMkrEjdY,CNN Politics,"Washington, DC",true,19,24,5,35,11,-14
BoSnerdley,Elizabeth Warren goes on Twitter tirade after Wells Fargo CEO retires https://t.co/LSPz0ZWktX via @nbcnews,2016-10-13T00:50:47.000Z,https://t.co/WbE2ELbKd1,Bo Snerdley,Southern Command,false,2,1,2,12,11,0
CNBC,Exclusive: Wells Fargo CEO John Stumpf on alleged abusive account practices: 'I am accountable' https://t.co/oblXndO6hW,2016-09-13T22:40:24.000Z,https://t.co/OhV9V1EIa6,CNBC,"Englewood Cliffs, NJ",true,7,7,6,17,10,-1
FoxBusiness,Dick Bove: Taking @WellsFargo scam to Congress is 'extreme reaction' https://t.co/396izUMnN5,2016-09-19T15:48:19.000Z,https://t.co/ytWMvJlUP9,FOX Business,"New York, NY",true,7,2,2,12,10,-5
6abc,Wells Fargo Hit With Potential Class-Action Lawsuit After Accounts Scandal  https://t.co/pOfPTOUYCb https://t.co/hk2jDDHE2J,2016-09-20T03:15:49.000Z,http://t.co/7Ph31t11mK,Action News on 6abc,Philadelphia,true,3,8,0,17,9,-3
YahooNews,Wells Fargo community banking exec gets $125M exit after scandal that cost firm $190M https://t.co/Xx7MlVcfGL https://t.co/YR7CyyvP7I,2016-09-13T16:20:14.000Z,https://t.co/Wi4rjphABy,Yahoo News,New York City,true,14,2,2,10,8,-12
SeanDuffyWI,On @WellsFargo: @FinancialCmte is going to investigate this and hold those responsible to account. @Varneyco https://t.co/DKfqrQE7hY,2016-09-19T14:43:02.000Z,,Sean Duffy,NA,false,1,1,0,9,8,-1
CNBC,Here's the story behind the Wells Fargo CEO's wounded hand https://t.co/kjjpjWJNb8,2016-09-20T18:21:59.000Z,https://t.co/OhV9V1EIa6,CNBC,"Englewood Cliffs, NJ",true,11,3,2,11,8,-9
CNBC,Wells Fargo CEO: We're ending the sales goals that caused all the trouble https://t.co/UH2c9uuL9x,2016-09-29T15:05:32.000Z,https://t.co/OhV9V1EIa6,CNBC,"Englewood Cliffs, NJ",true,5,8,5,16,8,0
foxandfriends,Wells Fargo exec who headed unit involved in scandal due $125 million in retirement https://t.co/jf3Bc8gIdS https://t.co/Ntohi5C4x1,2016-09-13T23:40:07.000Z,https://t.co/xg790NQUNl,FOX & friends,New York City,true,25,19,7,26,7,-18
dcexaminer,Elizabeth Warren tells Wells Fargo CEO he should resign and be prosecuted https://t.co/w5EGr2DuDW https://t.co/MKma36feiP,2016-09-20T16:35:29.000Z,https://t.co/rUG6hFZCFo,Washington Examiner,"Washington, DC",true,3,5,10,12,7,7
usatodayopinion,"After the #WellsFargo scandal, do you feel like you trust your bank? How’s your relationship with it? May publish replies. #tellusatoday",2016-09-21T13:37:11.000Z,https://t.co/0ND1nmfrd6,USA TODAY Opinion,"USA TODAY HQ, McLean, Va.",true,15,13,0,19,6,-15
WilfredFrost,Clinton vs Dimon - who has it right? Has the bashing of Wells Fargo and John Stumpf gone too far?,2016-10-04T08:56:58.000Z,https://t.co/oG2x8l6jYh,Wilfred Frost,NA,true,7,7,3,13,6,-4
davidenrich,Wells Fargo CEO is latest bank chief to lose his job amid scandals/losses in past decade. (Who am I missing?) https://t.co/WAv4onmW1C https://t.co/rWrzo9zKIQ,2016-10-12T21:14:06.000Z,https://t.co/osc1VRWD7t,David Enrich,"New York, USA",true,4,1,0,7,6,-4
DailyMail,Wells Fargo CEO to walk away with $134MILLION in wake of scandal https://t.co/759xlld4ks,2016-10-14T16:33:06.000Z,http://t.co/fT7KB2wyqg,Daily Mail US,New York,true,20,5,10,11,6,-10
CNBC,Exclusive: Wells Fargo CEO says he will not resign amid public scrutiny over alleged abusive account practices https://t.co/1wPaaJqCZr,2016-09-13T22:39:05.000Z,https://t.co/OhV9V1EIa6,CNBC,"Englewood Cliffs, NJ",true,17,9,6,14,5,-11
MadMoneyOnCNBC,.@WellsFargo CEO John Stumpf on alleged abuses: 'I am accountable' https://t.co/Xtb2wgDeHV https://t.co/AQElLV580E,2016-09-13T22:48:12.000Z,https://t.co/wSGxpfgAlT,Mad Money On CNBC,NA,true,6,7,1,12,5,-5
CNBC,Wells Fargo CEO John Stumpf gets $123.6 million if he walks https://t.co/PrtmzIjQAk,2016-09-26T12:12:12.000Z,https://t.co/OhV9V1EIa6,CNBC,"Englewood Cliffs, NJ",true,26,12,10,17,5,-16
NYDailyNews,Wells Fargo CEO John Stumpf could get up to $200M for walking away from the job https://t.co/nwEDqYhTD8 https://t.co/dQfDRHGxmy,2016-09-26T14:50:30.000Z,https://t.co/0UlNdSH0rW,New York Daily News,New York / fb.com/nydailynews,true,13,4,10,9,5,-3
EdMorrissey,"5,300 Wells Fargo Employees Fired for Creating Millions of Phony Accounts https://t.co/qlLBujZNn0 via @FOX40",2016-09-08T19:36:43.000Z,http://t.co/SyA1ckiPdD,Ed Morrissey,Deep in the heart of ...,true,11,1,7,5,4,-4
JoeHubbardLaw,.@WellsFargo created millions of fake accounts to charge fake fees. Get them back @JoeHubbardLaw. #resultsmatter https://t.co/WpNkiUQgDT,2016-09-09T13:26:22.000Z,https://t.co/pW8oPBJ2xH,Joe Hubbard Law Firm,"Montgomery, AL",false,3,2,0,6,4,-3
CNBC,Wells Fargo CFO blames unauthorized accounts on under-performers https://t.co/y7NtHYi0Up,2016-09-13T14:23:36.000Z,https://t.co/OhV9V1EIa6,CNBC,"Englewood Cliffs, NJ",true,7,7,10,11,4,3
EmilyGlazer,"Wells Fargo CEO Stumpf defends bank's culture, talks sales goals changes &amp; 9/20 senate hearing in first intverview: https://t.co/deV4GGCHdc",2016-09-13T16:48:20.000Z,https://t.co/Smlhmnw57X,Emily Glazer,NY,true,3,1,1,5,4,-2
Kevin_Meyer,"BS. The leader sets goals, creates culture,and is accountable. - Wells Fargo Boss Says Staff at Fault for Scams https://t.co/Kp0tRd6fBf",2016-09-14T12:16:42.000Z,https://t.co/qOBBIe89gA,Kevin Meyer,"Central Coast, California",false,3,1,2,5,4,-1
YahooFinance,"LIVE: Wells Fargo is blaming scandal on employees, not culture https://t.co/vnSnTPfGz6 https://t.co/wDX3EDe8iA",2016-09-14T12:38:29.000Z,https://t.co/LrB4M4iv6B,Yahoo Finance,"New York, NY",true,12,3,5,7,4,-7
Benzinga,Wells Fargo Blasted On Social Media Following Fraud Settlement https://t.co/Bj0umVhQEx $WFC https://t.co/3gKu3x5usM,2016-09-14T14:30:34.000Z,https://t.co/PMgIZhzR2F,Benzinga,"Downtown Detroit, MI & NYC",true,2,3,0,7,4,-2
FortuneMagazine,Wells Fargo CEO says the scandal in no way reflects company culture. 🤔 Watch #FortuneLIVE  https://t.co/A0YMDsYXTK https://t.co/KIFZIu50W5,2016-09-15T15:03:04.000Z,https://t.co/lCONu6h82G,FORTUNE,New York,true,9,6,8,10,4,-1
byHeatherLong,Big day for #WellsFargo ... CEO John Stumpf goes before US senate. He plans half apology: https://t.co/frdjZw3LDH via @MattMEgan5 https://t.co/d31qUyDHzZ,2016-09-20T12:15:13.000Z,https://t.co/mufRh00QY1,Heather Long,"Washington, DC",true,2,2,0,6,4,-2
thehill,Wells Fargo head apologizes for bank's illegal practices https://t.co/tRQHCz4AbC https://t.co/dblT9iZ1yV,2016-09-20T21:04:04.000Z,http://t.co/t414UtTRv4,The Hill,"Washington, DC",true,14,11,11,15,4,-3
VeronicaDLCruz,"Should the #CEO of @WellsFargo resign amid the #fakeaccount scandal?
Your comments @NightbeatTV 10p @KBCWtv 44/12 https://t.co/CL31Z3n4yW",2016-09-21T01:20:43.000Z,https://t.co/Dgz2m3dRwB,Veronica De La Cruz is celebrating #AAPI Month 🎉,Global ,false,5,2,2,6,4,-3
LizClaman,Do u believe Wells Fargo CEO John Stumpf didn't know his people were setting up 2m fake bank accts? 3pET I have the $WFC whistleblower.,2016-09-23T18:39:25.000Z,https://t.co/ueMXcEVuwR,Liz Claman,"New York, NY",true,12,17,1,21,4,-11
SeanDuffyWI,"Finally, a brief moment of plain truth from @WellsFargo CEO. https://t.co/u2O2ZC9Zc4",2016-10-01T17:11:49.000Z,,Sean Duffy,NA,false,2,4,1,8,4,-1
CNBC,Wells Fargo CEO Stumpf retires effective immediately; Tim Sloan to take over https://t.co/WTfcQ9sYPM https://t.co/lEYG842LdE,2016-10-12T21:58:48.000Z,https://t.co/OhV9V1EIa6,CNBC,"Englewood Cliffs, NJ",true,12,3,5,7,4,-7
CNBC,New Wells Fargo CEO Sloan: Stumpf felt his presence had become a 'distraction' https://t.co/4zJb5vNH6u https://t.co/I9QK7ljlbw,2016-10-12T23:24:18.000Z,https://t.co/OhV9V1EIa6,CNBC,"Englewood Cliffs, NJ",true,3,5,3,9,4,0
LaMonicaBuzz,$WFC down another 2% today. Still waiting for a response from Warren Buffett about $BRK.B stake in Wells Fargo. https://t.co/8jMTkSa3U1,2016-09-15T14:36:34.000Z,https://t.co/ZLgYiheZkS,Paul R. La Monica,"New York, NY",true,4,1,0,4,3,-4
SenShelby,"Tune In: The Senate Banking Committee, which I chair, is holding a hearing on Wells Fargo’s unauthorized accounts: https://t.co/98JiVnvH5v",2016-09-20T14:29:45.000Z,https://t.co/1iULT8X6Vz,Richard Shelby,"Tuscaloosa, Alabama",true,2,4,1,7,3,-1
PJMedia_com,WATCH: Sen. Elizabeth Warren Demands Wells Fargo CEO Resign https://t.co/HSaWYAydgn #video,2016-09-21T12:52:32.000Z,https://t.co/ZIWNSjbv9A,PJ Media,NA,false,1,1,0,4,3,-1
Zachary,The House Financial Services Committee has invited Wells Fargo's Chairman and CEO John Stumpf to testify at a Sept. 29 hearing,2016-09-21T16:09:10.000Z,,Zach Warmbrodt,"Washington, DC",true,4,1,0,4,3,-4
dcexaminer,Wells Fargo CEO gives back $41 million made in equity scandal https://t.co/INREsNyLXm https://t.co/8rOCMli5y8,2016-09-28T06:41:27.000Z,https://t.co/rUG6hFZCFo,Washington Examiner,"Washington, DC",true,6,1,2,4,3,-4
RanaForoohar,Wells Fargo is the latest indicator that the financial system is still broken: https://t.co/mG63wtH0P5,2016-09-28T19:07:53.000Z,https://t.co/JbTcRgDGZx,Rana Foroohar,"New York, USA",true,3,3,0,6,3,-3
jilevin,"#NYT: Wells Fargo Chief Blames Employees, Not Company Culture, for Scandal https://t.co/yIVJ60Kmaq #p2 #topprog",2016-09-29T20:39:53.000Z,https://t.co/QozhrhAU8I,Jeffrey Levin 🇺🇦,"San Jose, CA",false,4,3,3,6,3,-1
chicagotribune,Wells Fargo customers won't be able to sue the bank over fake accounts https://t.co/tCOkbXQwkv https://t.co/WMkR028bD9,2016-09-30T14:24:09.000Z,https://t.co/DekZkEnIYp,Chicago Tribune,"Chicago, IL",true,11,7,3,10,3,-8
DailyCaller,Warren Buffett Pleads With The Fed To Take Over 10 Percent Of Wells Fargo https://t.co/OCYaBOv6nO https://t.co/GihMQGVPy9,2016-10-01T01:40:12.000Z,https://t.co/ePSMzp6Wnp,Daily Caller,"Washington, DC",true,8,4,3,7,3,-5
CGasparino,what i reported yesterday about the future for Wells Fargo’s John Stumpf (not gonna be around long) | https://t.co/Fyaw1EJIGY,2016-10-12T22:17:17.000Z,https://t.co/wH85swMzMt,Charles Gasparino,NA,true,2,2,0,5,3,-2
MoiraBridget,If this is a scam jokes on you I use Wells Fargo. If legit I feel bad for whoever this was meant for @BankofAmerica https://t.co/v3IBUHaDTX,2016-09-06T22:50:08.000Z,https://t.co/BLve7EPTNv,two geese in a trenchcoat,"Portland, Oregon",false,1,1,0,3,2,-1
nytimesbusiness,Wells Fargo Fined for Years of Harm to Customers https://t.co/PDaJBNx5yW,2016-09-08T19:20:23.000Z,http://t.co/OKrfdBy4ch,NYT Business,"New York, NY",true,6,1,3,3,2,-3
LaMonicaBuzz,Wells Fargo employees set up fake bank and credit card accounts to hit sales targets. I'll discuss with @richardquest on @cnni at 4:10 ET.,2016-09-08T19:46:30.000Z,https://t.co/ZLgYiheZkS,Paul R. La Monica,"New York, NY",true,4,1,2,3,2,-2
PIX11News,"5,300 Wells Fargo employees fired for creating over 2 million phony accounts https://t.co/pIdc57H9Kr https://t.co/vLoYSw0oVb",2016-09-08T20:14:16.000Z,https://t.co/SKtwrg0uvu,PIX11 News,"New York, NY",true,4,1,0,3,2,-4
globeandmail,Wells Fargo will pay $190-million to settle customer fraud case https://t.co/TDaXZONKZw from @GlobeBusiness https://t.co/T985peFpMt,2016-09-08T20:26:12.000Z,https://t.co/et2oIjDfo5,The Globe and Mail,Canada,true,3,1,0,3,2,-3
Karoli,"Yes, I munged the CFPB acronym. I blame the qwerty keyboard. Still a BFD. (got it right!) https://t.co/7SvMrgrL6c",2016-09-08T21:26:22.000Z,https://t.co/tNJp34XPcS,Karoli 🇺🇦,"Camarillo, CA",true,3,1,0,3,2,-3
IndyUSA,Wells Fargo fined for phantom customers scam https://t.co/SPm88iju7m https://t.co/RguOgqyjeB,2016-09-09T13:28:00.000Z,https://t.co/pjX8N8cRFy,Independent US,"New York, NY",false,5,1,3,3,2,-2
tylerrooney,"#WTF Wells Fargo fired ""5,300 employees over the last few years"" for creating ~2M fake accounts and credit cards https://t.co/nTKZSo2Wl0",2016-09-09T13:37:14.000Z,https://t.co/9nnVF2oIFy,Tyler Rooney,"Toronto, Ontario",false,1,1,1,3,2,0
DavidSchantz,Wells Fargo exec will receive $125m retirement package https://t.co/oAqfrNalW2 via https://t.co/QpGihgocXx Pathetic!,2016-09-12T22:48:54.000Z,,David Schantz,NYC ,false,4,1,2,3,2,-2
JonMarino,"Wells Fargo says under-performing staff, not culture, drove unauthorized accounts &gt; https://t.co/JlRFxqBzZ0",2016-09-13T14:12:50.000Z,,Jon Marino,New York City,true,9,4,4,6,2,-5
MarketWatch,"Wells Fargo's CEO says that at the bank, “There was no incentive to do bad things.” https://t.co/2RrAmF4Op4",2016-09-13T18:21:03.000Z,https://t.co/Z9DRUcnQ8M,MarketWatch,"New York, NY",true,15,5,3,7,2,-12
MadMoneyOnCNBC,.@WellsFargo CEO tells @JimCramer that he will not resign https://t.co/EJRPA6BbZv https://t.co/yiGSG6LWye,2016-09-13T22:48:57.000Z,https://t.co/wSGxpfgAlT,Mad Money On CNBC,NA,true,10,13,7,15,2,-3
BringtheFlag,$124 million payday for top Wells Fargo exec https://t.co/SvqouaiO2t,2016-09-14T14:39:06.000Z,,BringtheFlag,outside Nashville,false,2,2,0,4,2,-2
insomniousdream,Reality Check: How Does Nobody Go To Jail In Wells Fargo Fraud Case? https://t.co/QPY1ZzteyA via @BenSwann_ #WellsFargo #Fraud #Government,2016-09-14T15:12:53.000Z,https://t.co/VHNq3pcjBa,david bechtel,"Bradenton, FL",false,3,1,1,3,2,-2
TruNews,Phantom Account Scandal Haunts @WellsFargo  https://t.co/ZZZLDqu5Q2 https://t.co/NSExGkQHUX,2016-09-16T21:49:04.000Z,https://t.co/jS6CWKtHAL,TruNews™,"Vero Beach, FL",false,3,2,1,4,2,-2
BetterMarkets,10 Things the Senate Banking Committee Must Ask Wells Fargo Chief John Stumpf: https://t.co/Rl8nTzrRER by @AaronLucchetti @EmilyGlazerWSJ,2016-09-19T20:56:04.000Z,https://t.co/VmaYksbJie,Better Markets,"Washington, DC",true,1,1,0,3,2,-1
nprpolitics,Wells Fargo CEO To Address Accounts Scandal Before Senate Panel https://t.co/OOWBdupDke,2016-09-20T09:30:07.000Z,https://t.co/t1RZssFTs6,NPR Politics,"Washington, DC",true,3,6,4,8,2,1
SenBobCorker,TUNE IN at 10:00 a.m. ET: Sen. Corker questions #WellsFargo CEO Stumpf at a Senate Banking Committee hearing. Watch: https://t.co/WZltpA4sMo,2016-09-20T13:12:09.000Z,https://t.co/VmjkHGcALo,Senator Bob Corker,Tennessee,true,4,3,1,5,2,-3
dcexaminer,"NEW: Wells Fargo CEO ""deeply sorry"" for fake accounts scandal https://t.co/cc07PPY1ZD https://t.co/HjoIQJupPv",2016-09-20T14:48:28.000Z,https://t.co/rUG6hFZCFo,Washington Examiner,"Washington, DC",true,3,1,3,3,2,0
rickrothacker,Wells Fargo CEO Stumpf facing Senate panel – with injured hand https://t.co/De8TPol4Ge #WFC @wellsfargonews,2016-09-20T15:13:09.000Z,,Rick Rothacker,"Charlotte, NC",false,1,2,0,4,2,-1
CGasparino,will @WellsFargo CEO Stumpf resign? and why is Dodd Frank at the heart of the bank's scandal we discuss NOW @FoxBusiness @TeamCavuto,2016-09-20T15:53:45.000Z,https://t.co/wH85swMzMt,Charles Gasparino,NA,true,9,9,4,11,2,-5
MadMoneyOnCNBC,We're glued to the TV watching $WFC CEO testify. What do you think? Here's what he told @jimcramer last week: https://t.co/iVZMu4q2m2 https://t.co/8k72QpVUpf,2016-09-20T16:03:27.000Z,https://t.co/wSGxpfgAlT,Mad Money On CNBC,NA,true,2,6,2,8,2,0
Mitch_Goldberg,"-My latest post on @CNBC
Why every financial advisor should be calling for the head of John Stumpf https://t.co/ztjxw2TzQ6",2016-09-21T18:27:19.000Z,https://t.co/bIT2BGLonM,Mitchell O. Goldberg,"Melville, NY",false,3,1,0,3,2,-3
ExpEconomia,VIDEO: John Stumpf fue fustigado en una audiencia con senadores de varios estados en la que pidió disculpas https://t.co/wsixcDpFJr,2016-09-21T20:55:05.000Z,https://t.co/bqU7P8ADRw,Expansión Economía,México,false,1,1,0,3,2,-1
KenSilverstein1,Go to jail. Go directly to jail. What Elizabeth Warren should have told leader of Wells Fargo crime syndicate. https://t.co/yWEAi8ogLw,2016-09-23T16:44:44.000Z,,Ken Silverstein,"Washington, DC",false,2,2,1,4,2,-1
JennyAnchondoTV,The Wells Fargo CEO will give up $41 million in stock options for the fake account scandal. Do you think that is... https://t.co/kOkkkX7T06,2016-09-28T11:57:04.000Z,https://t.co/n2sE9HPBtc,Jenny Anchondo,DALLAS,true,1,1,0,3,2,-1
PDXBIZJournal,A huge blow for Wells Fargo: Calif. punishes the lender swiftly and powerfully. https://t.co/wEMU27E8Sf,2016-09-28T21:55:00.000Z,https://t.co/8XRrvdloll,Portland Business Journal,"Portland, OR",false,1,1,0,3,2,-1
yaronbrook,"I really wish Wells would fight back. Made mistakes, but this... ""Lawmakers take more swings at Wells Fargo CEO "" https://t.co/ubgCcuUpzy",2016-09-29T18:41:19.000Z,https://t.co/xEf90xFPLH,Yaron Brook,"San Juan, PR",false,3,5,2,7,2,-1
CNBC,BREAKING: Warren Buffett speaks to CNBC's @BeckyQuick regarding Wells Fargo. https://t.co/UxmVXhfeXO https://t.co/6AHHipbkmQ,2016-09-29T20:27:39.000Z,https://t.co/OhV9V1EIa6,CNBC,"Englewood Cliffs, NJ",true,16,10,1,12,2,-15
Ny1david,This is how you say nothing but insinuate a lot: JAMIE DIMON ON WELLS FARGO: 'Cooler heads should prevail' https://t.co/oDsaXfadKz,2016-10-03T21:01:43.000Z,https://t.co/y9Lx2oMD13,David Fiderer,New York City,false,1,1,0,3,2,-1
ExposingALEC,Stop telling @WellsFargo CEO he's being held accountable. https://t.co/nZy6Wzedi6 Prosecute him. https://t.co/r92Gg5XCrY,2016-10-05T08:49:39.000Z,https://t.co/IUqbaTpiZY,Ron Rabatsky,"Florida, USA",false,6,2,0,4,2,-6
matthewstoller,"Op-ed in banker trade publication on Wells Fargo says that in order to recover, Wells must first fire the CEO. https://t.co/ME8nIsrCjh",2016-10-06T17:02:14.000Z,https://t.co/8NgpF8Bovm,Matt Stoller,"Washington, DC",true,5,1,1,3,2,-4
MariaBartiromo,Where was the CFPB on the Wells Fargo scandal? https://t.co/W3G5BpDilI @RepSeanDuffy @FoxBusiness @MorningsMaria,2016-10-07T14:09:34.000Z,https://t.co/P2XOPgzZZ9,Maria Bartiromo,"New York, NY",true,7,13,3,15,2,-4
solomonmissouri,Aye @WellsFargo Tell me why y'all sent me an email about an account when i haven't had an account with y'all in 3 years....,2016-10-11T19:54:21.000Z,https://t.co/d0dhDuwPQm,So_a_king 🤌🏿,"Durham, NC",false,1,1,0,3,2,-1
byHeatherLong,Breaking: Wells Fargo CEO walks with $130 million   https://t.co/eVMzTAl7oM via @MattMEgan5   $WFC https://t.co/n6LJtPlnBa,2016-10-13T17:27:02.000Z,https://t.co/mufRh00QY1,Heather Long,"Washington, DC",true,8,2,4,4,2,-4
SquawkCNBC,"#Stumpf did the right thing, but Wells Fargo board should have acted sooner, @JeffSonnenfeld says $WFC https://t.co/9llujVpasf",2016-10-13T19:37:45.000Z,http://t.co/AMPUczhT7a,Squawk Box,"New York, NY",true,2,6,0,8,2,-2
MFoxCNBC,"Despite Stumpf’s departure, California not ready to do business with Wells Fargo @CNBCClosingBell https://t.co/AmsUP9alwg",2016-10-13T21:41:42.000Z,https://t.co/AiGJokMNuJ,Michelle Fox,new jersey,true,3,1,0,3,2,-3
CNBC,Here's what Wells Fargo is saying about consumers since the accounts scandal hit https://t.co/8BWizeDnxq,2016-10-14T13:58:23.000Z,https://t.co/OhV9V1EIa6,CNBC,"Englewood Cliffs, NJ",true,4,2,1,4,2,-3
latimes,"As Wells Fargo's earnings fall, new CEO wishes scandal was handled earlier https://t.co/4rTBAKKK6S https://t.co/qZ0kkrADdF",2016-10-15T02:35:05.000Z,https://t.co/WeffKZ2O0l,Los Angeles Times,"El Segundo, CA",true,12,7,0,9,2,-12
EmilyGlazer,Wells Fargo's expected enforcement action &amp; settlement over cross-selling/sales tactics: https://t.co/21qObuQqP8 More later today,2016-09-08T14:25:37.000Z,https://t.co/Smlhmnw57X,Emily Glazer,NY,true,3,1,0,2,1,-3
simonnread,"Crikey, massive $185million fine for America's biggest bank over dodgy account openings https://t.co/PUQJOnwgCv",2016-09-08T17:20:06.000Z,https://t.co/210wqISziP,simon read,"London, England",true,1,1,0,2,1,-1
suited_aces,What The Fargo? https://t.co/mGsD1QZpNI,2016-09-08T22:48:30.000Z,https://t.co/VzGYQG8qWJ,Anders Ohlsson,"San Francisco, CA",false,1,1,0,2,1,-1
VincentRK,"5,300 Wells Fargo employees fired over 2 MILLION phony accounts. This is beyond BIZARRE! Who can we trust anymore? https://t.co/VpTAMe8cXp",2016-09-08T23:06:57.000Z,https://t.co/G0uws6CHgS,Vincent Rajkumar,"Rochester, MN, USA",true,4,1,0,2,1,-4
mitchjackson,"5,300 Wells Fargo employees fired over 2 million phony accounts https://t.co/BQUIxVqnX4 via @CNNMoney",2016-09-08T23:19:33.000Z,https://t.co/pPpnpndYJV,"Mitch Jackson, Esq.","California, USA",false,1,2,0,3,1,-1
billresh,Another example of unintentionally subversive #PerformanceManagement incentives https://t.co/lIkNiXUhVB,2016-09-09T00:17:13.000Z,https://t.co/n23HAJInht,William Resh,The Wayside,false,1,1,1,2,1,0
denverpost,Wells Fargo to pay $185 million to settle allegations its workers opened fake accounts https://t.co/qP6PyDqJKA,2016-09-09T02:00:31.000Z,http://t.co/HvDYiwfHFX,The Denver Post,"Denver, CO",true,5,2,0,3,1,-5
mch7576,"Wells Fargo Just Fired 5,300 Workers For Ripping Off Millions Of Americans In MASSIVE Scam - https://t.co/sL1fMsA1Lj",2016-09-09T02:33:59.000Z,,Doc,Earth,false,9,2,0,3,1,-9
cbinflux,"LOCK THEM UP!!! 5,300 Wells Fargo employees fired over 2 million phony accounts  https://t.co/4y4KYcdjaH",2016-09-09T02:49:58.000Z,https://t.co/IvqG6IWqOR,JT Badenov,Mid-South,false,1,1,0,2,1,-1
dmuthuk,"If 5300 employees has committed fraud, it reflects on the culture and incentive system of the bank.
https://t.co/QHCPkwMYzF",2016-09-09T06:34:42.000Z,,D.Muthukrishnan,"Chennai, India",false,5,1,1,2,1,-4
WGNNews,"5,300 Wells Fargo employees fired for creating millions of phony accounts https://t.co/ZuQndW0eBe https://t.co/cr3WLsMxKs",2016-09-09T07:35:03.000Z,http://t.co/1Ah1yoD02k,WGN TV News,"Chicago, IL",true,5,1,0,2,1,-5
MikeHuckman,"Front page,top story in @WSJ.Where it should be.But why would you bury the firing of 5,300 people in the 5th graf? https://t.co/lgN0gJOiXE",2016-09-09T12:45:04.000Z,https://t.co/wgm1PY0XIT,Mike Huckman,"Wilmington, NC",false,1,1,0,2,1,-1
WMAR2News,".@WellsFargo fired 5,300 employees for creating phony accounts https://t.co/j1L6zTxLMI",2016-09-09T12:46:24.000Z,https://t.co/hu0mNQxRZD,WMAR-2 News,Baltimore,true,3,1,1,2,1,-2
SteveNoviello,"VIEWER QUESTION:
""What if I had an account compromised at Wells Fargo but now it's closed:
WELLS FARGO:
""If the... https://t.co/24xqfoVz06",2016-09-09T16:42:23.000Z,https://t.co/n8sZlAuOxx,Steve Noviello,Dallas TX,true,3,1,0,2,1,-3
WFANTrades,Imagine running the @WellsFargo Twitter account today?,2016-09-09T23:06:56.000Z,,WFANTrades,NA,false,1,3,1,4,1,0
downtoread,@WellsFargo how can current customers check for unauthorized accounts/credit cards/etc opened with our names by YOUR people? #WellsFargo,2016-09-10T17:36:30.000Z,https://t.co/5NZSpVeGJA,marah,"Dallas, TX",false,2,1,0,2,1,-2
Solano_Law,#WellsFargo Just Made The Case For Elizabeth Warren’s Bank Agency https://t.co/XBbWPJBjAY @Solano_Law #crime #ElizabethWarren #bankingfraud,2016-09-10T18:55:00.000Z,https://t.co/HsrZ77USVn,"Sarah Russo, Esq.","Suisun City, CA",false,1,1,1,2,1,0
ThomasAGiles1,"Thanks to Elizabeth Warren's Consumer Financial Protection Bureau, Wells Fargo Fined for Fraud via @politicususa https://t.co/S8Eiiu1c3H",2016-09-11T05:21:09.000Z,,Thomas A Giles,"Laguna Beach, CA #TheResistance",false,1,1,2,2,1,1
Johnkehoe23,Wells Fargo scam a warning for Westpac and local banks https://t.co/dRB1t5wKsw via @FinancialReview,2016-09-11T10:40:05.000Z,https://t.co/qilCoNgGZX,John Kehoe,Canberra,true,1,1,1,2,1,0
nminow,Wells Fargo in charge of phony account division received $124 million in exit pay https://t.co/mLGeXBCJy3 via @Salon #corpgov #corpcrime,2016-09-12T17:26:07.000Z,https://t.co/HMoEcOCbxy,Nell Minow (she/her),NA,false,5,1,0,2,1,-5
merstew,"Wells Fargo exec will receive $125m retirement package
How much does this piss you off @popsknox  https://t.co/9IftahawoN",2016-09-12T22:57:07.000Z,,howugonnawinifuaintrightwithin,212 ,false,3,2,0,3,1,-3
gracels,Wells Fargo: no one noticed the scam? No one?  https://t.co/rnSjmkeojT https://t.co/8F9K0vgcUw,2016-09-13T02:03:35.000Z,https://t.co/eKW33kNdHL,Grace Lidia Suárez,"Left Coast, California",false,2,1,0,2,1,-2
JustinJBariso,"""How Could 5,000 Employees Be So Deceptive? Science Explains the Wells Fargo Scandal"" https://t.co/1KOIdwq9xI Tip @LinkedInPulse",2016-09-13T14:07:21.000Z,https://t.co/CPBvQFUaxd,Justin Bariso,Germany / NYC,false,4,1,0,2,1,-4
