user_username,text,created_at,user_url,user_name,user_location,user_verified,retweet_count,like_count,quote_count,reply_count,ratio_reply_like,ratio_quote_retweet
MailOnline,Protesters trash H&amp;M store as race row over ‘coolest monkey in the jungle’ continues to escalate https://t.co/aV4C585eqt,2018-01-13T12:43:07.000Z,https://t.co/7WEFA27EgH,Daily Mail Online,NA,true,273,232,119,225,-7,-154
ladbible,Protesters storm H&amp;M and trash store over 'racist' hoodie advert. https://t.co/dGvtTySgvH https://t.co/30MBXduQqt,2018-01-13T14:22:00.000Z,https://t.co/Nz2emitt7N,LADbible,NA,true,74,232,286,176,-56,212
___envied,Calling white people crackers to defend the monkey h&amp;m hoodie joke isn’t cool fam. How u gon throw a racial slur to fuss about something racist? 2 wrongs don’t make a right.,2018-01-08T21:23:55.000Z,https://t.co/cyir6PxAPN,Hotboy Chuckie,"1948 W Pratt St, Baltimore, MD",false,140,226,14,6,-220,-126
tariqnasheed,"In response to the racist ad by H&amp;M, protesters in South African trashed one of the #H&amp;M stores https://t.co/E7R1FiHbVL",2018-01-13T19:38:17.000Z,https://t.co/yAUICwSl4j,Tariq Nasheed 🇺🇸,Los Angeles,true,93,226,14,57,-169,-79
Phil_Lewis_,H&amp;M sparks outrage for posing Black child model in 'coolest monkey in the jungle' sweatshirt https://t.co/01k4avu1To,2018-01-08T12:26:09.000Z,https://t.co/NiNrsmOc28,philip lewis,"Washington, DC",true,218,225,74,81,-144,-144
MeSeeks_J,"Pearl Thusi only said that how the EFF handled things were wrong in her view. She did not defend H&amp;M, there's a difference. Oh but now she's being attacked for being a light skinned black. Is that not racist or discrimination in itself?",2018-01-16T12:33:52.000Z,,Jason T.,South Africa,false,77,223,16,35,-188,-61
cnni,Musicians G-Eazy and The Weeknd have cut ties with H&amp;M over hoodie racism row https://t.co/E8AZ19wQa8,2018-01-10T14:01:26.000Z,http://t.co/kdkv08KSgi,CNN International,Everywhere,true,164,221,10,25,-196,-154
AminaMercury,"Urm?? H&amp;M. So you put the black boy in a ""coolest monkey in the jungle"" hoody but the white boy as the ""survival expert"". Since when was one human and the other an animal. Can't tell me you didn't think this through!! I know they're kids and all but?? ....I dunno yall https://t.co/e4cLMWxP5z",2018-01-08T00:40:00.000Z,,Aisha,South-East London/Algerian,false,108,220,32,18,-202,-76
TMZ,The Weeknd Cuts Ties with H&amp;amp;M After Racist Ad https://t.co/zAiEb60Fef,2018-01-09T07:01:06.000Z,https://t.co/LQPPfVeJqW,TMZ,"Los Angeles, CA",true,57,220,14,21,-199,-43
RollingStone,The Weeknd cuts ties with H&amp;M over “deeply offensive” photo https://t.co/owHenLEoeS https://t.co/KR0ZdUeiBH,2018-01-08T21:44:16.000Z,https://t.co/HPZh9kIhYX,Rolling Stone,"New York, New York",true,54,219,20,11,-208,-34
BuzzFeed,"The Weeknd says he won't work with H&amp;M after it used a black child to model a jumper with ""monkey"" written on it
https://t.co/jzQ59w3EuQ https://t.co/TSf8WufMtI",2018-01-09T17:31:00.000Z,https://t.co/9tsxyq9gNZ,BuzzFeed,New York,true,19,215,7,5,-210,-12
Locarconio,"Hola @hmespana, ¿podéis explicar esta mierda racista? 

Hi @hm could you please explain this racist shit?

H&amp;M usa a un niño negro con una sudadera:  ""El mono más chulo de la selva""

 This hoodie on a black kid: ""Coolest monkey in the jungle""

WTF?!

https://t.co/I7H2yOlYys",2018-01-08T13:24:54.000Z,,Locas del Coño,NA,true,289,214,21,11,-203,-268
BuzzFeed,"H&amp;M has apologized after it used a young black boy to model a jumper with ""monkey"" written on it
https://t.co/rLBItQkJke https://t.co/ZLUvjIuPiE",2018-01-08T18:21:00.000Z,https://t.co/9tsxyq9gNZ,BuzzFeed,New York,true,79,214,89,82,-132,10
CNN,"H&amp;M has appointed a diversity manager after dealing with the fallout from using a black child to advertise a hoodie with the slogan ""coolest monkey in the jungle"" https://t.co/xG0hR6S9Jz https://t.co/1V9WZEK8WE",2018-01-18T06:52:38.000Z,https://t.co/imGp4Ieixi,CNN,NA,true,107,214,74,111,-103,-33
thefader,G-Eazy ends partnership with H&amp;M following controversial “Monkey” sweatshirt. https://t.co/58aifJD3Ab https://t.co/ppYdlZDFF5,2018-01-10T00:15:01.000Z,,The FADER,"New York, NY",true,58,211,20,3,-208,-38
TMZ,"LeBron James Blasts Racist H&amp;M Ad, 'We Ain't Going for It' https://t.co/QiEK7lFlZm",2018-01-09T00:28:07.000Z,https://t.co/LQPPfVeJqW,TMZ,"Los Angeles, CA",true,72,209,6,11,-198,-66
DeelanRH,"“H&amp;M is willing to pay you $10000 to pose like a monkey for this photo shoot” 

Me: https://t.co/OO2oriPSxz",2018-01-09T00:55:39.000Z,https://t.co/lBhVzYS9NQ,🖤,#freepalestine ,false,87,208,11,5,-203,-76
breakfastclubam,"#DonkeyOfTheDay🐴: Charlamagne awards H&amp;M for using a black child to model their ""coolest monkey in the jungle"" hoodie https://t.co/Gz8QWWc7Zj",2018-01-08T17:19:08.000Z,https://t.co/4o09AIxHOC,The Breakfast Club,NYC,true,120,207,20,47,-160,-100
KarlousM,H&amp;M could’ve really made some money if they would’ve made some panties that said “Coldest Monkey in the Jungle” on the pussy part! 🙈,2018-01-08T19:42:50.000Z,https://t.co/k9XrRspso5,Los PopaVitch,WORLDWIDE Atlanta Ga,true,124,207,38,12,-195,-86
juiceboxmisha,"""Worlds Coolest monkey!? We monkeys to you!?"" - a niggah that just came to a H&amp;M jumping around on the displays and hollering",2018-01-09T03:16:33.000Z,,hseem,dmv,false,135,207,24,7,-200,-111
newaccntism6cks,can’t a kid just where the hoodie without people MAKING it into a bad scenario? @hm isn’t racist and neither is the person who did this. they picked a little kid to model a hoodie and you people turn the message of it bad/racist. https://t.co/CQQVzmhwQH,2018-01-08T18:02:13.000Z,,MAX L,NA,false,54,206,28,55,-151,-26
Simpson_6,"If you decide to be offended by the ‘incident’ with @hm then you’re the problem. If you decide to match the word monkey to that little boy then that’s on you, that’s where the issue is.",2018-01-09T17:17:24.000Z,,James,Essex,false,49,206,8,16,-190,-41
Complex,H&amp;M under fire for 'Coolest Monkey in the Jungle' hoodie. https://t.co/x56kpdWjPm https://t.co/IdS1ctACQQ,2018-01-08T14:03:12.000Z,https://t.co/5hVNTuKmVa,Complex,New York,true,91,205,31,15,-190,-60
