user_username,text,created_at,user_url,user_name,user_location,user_verified,retweet_count,like_count,quote_count,reply_count,ratio_reply_like,ratio_quote_retweet
sanjeevsanyal,"Apparently Oxfam was aware for a decade that its air workers were sexually exploiting children for over a decade:
https://t.co/ME3OYmdb5M",2018-02-17T10:43:21.000Z,https://t.co/CAvRSwaagh,Sanjeev Sanyal,"New Delhi, India",true,104,53,8,6,-47,-96
nytimes,"Oxfam, British Charity, Admits Sexual Misconduct by Workers in Haiti https://t.co/2hQUt1ID7T",2018-02-10T08:17:38.000Z,http://t.co/ahvuWqicF9,The New York Times,New York City,true,103,125,20,17,-108,-83
el_pais,"El Gobierno británico retirará la financiación a todas las ONG que no cumplan los estándares de comportamiento, en respuesta a las acusaciones de explotación sexual contra los trabajadores de Oxfam en Haití https://t.co/Qu7wKsU0JH",2018-02-11T11:27:00.000Z,https://t.co/6g5qG3Lgo3,EL PAÍS,Madrid,true,102,108,6,4,-104,-96
libertaddigital,"Menudo programón tiene aquí Jordi Évole, el jugo que con su habilidad le podría sacar a todo esto. https://t.co/9TJMxCThYY",2018-02-12T17:46:36.000Z,https://t.co/FZrTq7h70z,Libertad Digital,Madrid,true,101,107,5,10,-97,-96
toryboypierce,"#oxfamscandal  Charity Commission, failed to act on  warnings, was also asleep on job over Kids Company,  which was forced to close",2018-02-13T09:20:36.000Z,https://t.co/ZSgkhn15iq,Andrew Pierce,london,false,101,235,6,26,-209,-95
LBC,"Priti Patel, the former secretary for international development, says Oxfam should be stripped of its government funding over the allegations it covered up a sex scandal involving aid workers. Is she right? https://t.co/vB7GK44PPM",2018-02-10T12:20:33.000Z,https://t.co/fI8exPioWw,LBC,United Kingdom,true,100,261,55,200,-61,-45
Channel4News,"Oxfam whistleblower: Allegations of rape and sex in exchange for aid 

Watch the full interview with Helen Evans, former Global Head of Safeguarding:  https://t.co/DkO71pffT0",2018-02-12T20:21:35.000Z,https://t.co/LBhZvqcoKL,Channel 4 News,United Kingdom,true,100,63,23,16,-47,-77
moisejovenel,Ce qui s'est passé avec Oxfam en Haïti est une violation extrêmement grave de la dignité humaine.,2018-02-13T01:37:07.000Z,https://t.co/ju5eZqHACy,Président Jovenel Moïse,"Port-au-Prince, Haiti",true,100,304,17,75,-229,-83
HillelNeuer,"Oxfam's chief of Haiti relief effort in wake of earthquake devastation admits sex with aid recipient; he says he didn't pay her but rather gave her family ""diapers and powdered milk."" https://t.co/u8Xydnm8yL",2018-02-16T12:30:53.000Z,https://t.co/O6GXWfj4VR,Hillel Neuer,"Geneva, Switzerland",true,100,82,35,33,-49,-65
pritipatel,"The shocking scandal of the abuse of women &amp; children in the Aid sector must end. @Oxfam explain to the victims, your donors &amp;to taxpayers what are you doing now to secure the prosecution of those responsible for these crimes in your organisation? The lack of action is shameful.",2018-02-10T08:37:04.000Z,https://t.co/dhkvnJYo3X,Priti Patel,NA,true,99,203,8,49,-154,-91
thetimes,"Oxfam failed to warn aid agencies about staff caught using prostitutes in earthquake-torn Haiti, allowing them to take jobs among vulnerable people in other disaster zones
https://t.co/0IgTFztR5i",2018-02-10T06:18:50.000Z,https://t.co/aWO6ICt2VS,The Times,London,true,98,72,21,17,-55,-77
Mark_Goldring1,We at @oxfamgb commit to further improvements in aftermath of Haiti reports . Oxfam GB https://t.co/nClCrIUflW via @po_st,2018-02-11T14:22:26.000Z,,Mark Goldring,NA,false,97,139,21,55,-84,-76
guardian,Oxfam sexual abuse scandal is built on the aid industry’s white saviour mentality | Afua Hirsch https://t.co/PhidRjo3hH,2018-02-20T19:36:37.000Z,https://t.co/c53pnmnuIT,The Guardian,London,true,97,167,23,27,-140,-74
zerohedge,Top Oxfam staff paid Haiti quake survivors for sex https://t.co/QWImSAxlS8,2018-02-09T13:06:27.000Z,https://t.co/XKPaugBRRi,zerohedge,NA,false,96,55,24,9,-46,-72
periodistadigit,"La izquierda oculta el escándalo sexual de Oxfam': ""Si era una ONG católica la jauría progre la habría lapidado"" https://t.co/Lr71mDsVx3 vía @Periodistadigit",2018-02-12T13:08:18.000Z,https://t.co/VvLX28sQcy,Periodista Digital,Madrid,true,96,60,2,9,-51,-94
rodbishop15,These very holier than thou charities are making the #PresidentsClub look like a church cheese&amp;wine evening. #OxfamScandal #Oxfam,2018-02-12T18:39:10.000Z,,Rod Bishop 💎,NA,false,96,196,2,5,-191,-94
cathynewman,Exclusive on @Channel4News tonight: I speak to @oxfamgb whistleblower who begged bosses for more resources to keep vulnerable people safe from sexual abuse. She says she was repeatedly ignored and quit in despair. Watch at 7 https://t.co/LNuJbSmM0o,2018-02-12T18:40:58.000Z,https://t.co/821wMuhOqv,Cathy Newman,London,true,96,152,10,57,-95,-86
megan_nobert,The Oxfam scandal does not justify demonising the entire aid sector | Megan Nobert https://t.co/QCY6nG7cCD,2018-02-17T11:07:25.000Z,https://t.co/tQVF0fHPBr,Megan Nobert,"London, England",false,96,143,21,6,-137,-75
DanielHewittITV,Oxfam chief executive Mark Goldring tells @itvnews it is “highly likely” public donations to Oxfam would’ve fallen in 2011 if the charity had revealed the use of prostitutes by its staff in Haiti. He denied any cover up or that it had a moral obligation to reveal the full details https://t.co/DhM3AGDHDb,2018-02-10T18:49:50.000Z,https://t.co/gOWeuAT9dE,Daniel Hewitt,United Kingdom,true,95,81,15,46,-35,-80
el_pais,Oxfam admite que varios cooperantes suyos contrataron a jóvenes prostitutas para una orgía durante la operación de ayuda posterior al terremoto que destruyó Haití en 2010 https://t.co/T15swzIuO6,2018-02-09T11:10:50.000Z,https://t.co/6g5qG3Lgo3,EL PAÍS,Madrid,true,94,37,22,7,-30,-72
maranburuayala,Directivos de Oxfam pagaron por sexo a víctimas en #Haiti. Esto es lo que sucede cuando las personas sin vocación entran al mundo de la cooperación. https://t.co/B2IwBnvuyL,2018-02-09T19:15:20.000Z,,M.Aranburu Ayala,Cairo · Madrid · NY · Bogotá,false,94,60,2,10,-50,-92
DFID_UK,Statement from International Development Secretary @PennyMordaunt on Oxfam and UK action to tackle sexual exploitation in the aid sector https://t.co/txnxBctFdB https://t.co/XUEYRUhCeU,2018-02-12T17:59:18.000Z,https://t.co/j2B41UJuPV,DFID,London,true,94,64,11,7,-57,-83
oxfamgb,"""I know that this apology is by no means enough but I want to offer it unreservedly to our supporters, volunteers, staff and the people of Haiti and Chad for the things that happened in our name. I am so sorry."" Read Mark Goldring's full open letter at https://t.co/otmNiqs7ar",2018-02-15T17:05:26.000Z,https://t.co/oqNow3EnzX,Oxfam,NA,true,94,143,11,39,-104,-83
AFPespanol,#ÚLTIMAHORA Renuncia la directora adjunta de la ONG Oxfam tras escándalo sexual en Haití (comunicado) #AFP https://t.co/3EkY6Xe880,2018-02-12T14:40:48.000Z,https://t.co/xUUUHGq0CB,Agence France-Presse,"Montevideo, Uruguay",true,93,45,8,3,-42,-85
SkyNewsBreak,"Penny Lawrence has resigned as deputy chief executive of Oxfam saying she took ""full responsibility"" for the behaviour of staff in Chad and Haiti at the time when she was the charity's programme director",2018-02-12T14:38:44.000Z,https://t.co/5IrVnmPBxs,Sky News Breaking,"London, UK",true,92,83,23,49,-34,-69
ivanwhite48,"#bbcpm Penny Lawrence has resigned as deputy CEO of Oxfam because Haiti abuse ""happened on her watch"". Should Jeremy Hunt do likewise, as the NHS crisis occurred on his watch? Should Johnson resign because Nazanin Zaghari-Ratcliffe was recalled to court in Iran because of him?",2018-02-12T17:20:14.000Z,,Ivan White,"West Sussex, England",false,92,143,9,15,-128,-83
rodbishop15,Jesus wept. 14 year old #Oxfam shop staff in the UK were being abused and hushed up. Just bloody unbelievable. #oxfamscandal,2018-02-13T18:06:51.000Z,,Rod Bishop 💎,NA,false,92,148,5,22,-126,-87
TimesONeill,"breaking: after days of denial @oxfamgb realises it has a problem: ""As a direct result of the stories in The Times, staff members have come forward with concerns about how staff were recruited and vetted in this case."" #Haiti",2018-02-11T13:02:56.000Z,https://t.co/b8Zu01yBP4,Sean O'Neill,London,true,91,117,9,15,-102,-82
aldo_be,"Esto es brutal y asqueroso: 120 trabajadores de ONGs británicas acusados por abuso sexual. Entre las más conocidas están Oxfam, que tiene 87 casos, y Save The Children, con 31. Las víctimas derivan de países con necesidad de ayuda humanitaria.

https://t.co/Twd2jxDVNf",2018-02-11T14:50:12.000Z,,aldo,"Asunción, Paraguay",false,91,45,8,5,-40,-83
cnnbrk,Oxfam's deputy chief executive quits over a prostitution scandal involving the aid group's workers in Haiti and Chad https://t.co/1LtzQvq1TK https://t.co/aLNKOvUcfZ,2018-02-12T15:26:26.000Z,https://t.co/ojQgQKzKzX,CNN Breaking News,Everywhere,true,91,122,13,31,-91,-78
aldocardinali,"Diario Times, denunció a la ONG OXFAM, por abuso sexual con niñas en HAITI, hoy la subdirectora dimite de su cargo y asume responsabilidad. La situación de Chile pudiera no estar exenta de este tipo de acciones ilícitas que afecta a Organizaciones Mundiales humanitarias.",2018-02-14T12:34:26.000Z,,Alfa Charlie,NA,false,91,61,2,2,-59,-89
shailjapatel,"""...predatory paedophiles are now going to the developing world to gain access to children. According to authorities’ warnings, one of the paedophiles’ chosen methodologies to gain access to children is to join a children’s charity."" 
https://t.co/2RU1px17M5",2018-02-11T07:37:10.000Z,https://t.co/AUFccXeT4D,Shailja Patel,"Nonotuck land, Kwintekw Valley",true,90,37,9,5,-32,-81
RichardWellings,"Where is the Labour outrage at the sex scandal engulfing the Left's favourite charity, Oxfam? https://t.co/tcmDLg7A82",2018-02-12T21:46:02.000Z,https://t.co/Eg6XltwKn3,Richard Wellings,London,false,90,109,6,14,-95,-84
mcyava,"La organización apoyada y colaborada por toda la izquierda española! 
El presidente de Haití señala a Oxfam: “Es una violación extremadamente grave a la dignidad humana” https://t.co/HrFRlPmInJ",2018-02-13T19:13:10.000Z,,MCarmen #NoNosCallaran🇪🇸🇪🇸,España,false,90,68,0,9,-59,-90
chootchyface,"Oxfam trustee Chair Lady Liddell was given £670,000 pay-off by BBC as COO of the BBC, after the Savile scandal

She is the daughter of one Labour peer and married to another. Is this the base of their political bias

https://t.co/Xu3kMxcKqS",2018-02-14T15:21:47.000Z,,Chootchy Face 🌻🇺🇦🌻🇺🇦🌻🇺🇦,"London, England",false,90,84,9,10,-74,-81
sergioaguayo,#Oxfam armó orgías en #Haití. El escándalo en #Inglaterra deja una lección universal: también hay que vigilar a los #OrganismosdelaSociedadCivil @Oxfam,2018-02-15T14:00:52.000Z,https://t.co/HX11BWbDkV,Sergio Aguayo,NA,true,89,141,3,12,-129,-86
lemondefr,L’ancien directeur d’Oxfam en Haïti a reconnu avoir fait venir en 2011 des prostituées au domicile financé par l’organisation https://t.co/LyS9CZLDkd,2018-02-19T07:55:58.000Z,https://t.co/uIAz4qCE1u,Le Monde,Paris,true,89,33,10,14,-19,-79
