user_username,text,created_at,user_url,user_name,user_location,user_verified,retweet_count,like_count,quote_count,reply_count,ratio_reply_like,ratio_quote_retweet
SunPolitics,Oxfam deputy quits over sex abuse as gov’t orders charities to come clean https://t.co/dqrP1EwCzd,2018-02-12T20:50:05.000Z,https://t.co/1evKNl9fKu,Sun Politics,NA,true,6,1,0,2,1,-6
WashTimes,"Oxfam official resigns after reports of sexual misconduct by aid workers in Haiti, Chad https://t.co/fEEKnaHCvP",2018-02-12T21:22:17.000Z,https://t.co/Ncqu3Y9daA,The Washington Times,"Washington, D.C.",true,5,2,0,3,1,-5
_infoLibre,Dimite la subdirectora de #Oxfam por el escándalo sexual de la ONG en #Haití https://t.co/1s0V9fAlMQ https://t.co/sjyKq4yG7L,2018-02-12T23:30:06.000Z,https://t.co/M4He31eTia,infoLibre,Madrid,true,12,1,1,2,1,-11
HSteel5,Can someone please tell me why English men cannot keep their hands off prostitutes and children? This whole #OxfamScandal is totally not surprising. Typical #Victorian behaviour,2018-02-13T07:45:43.000Z,,Hezz 📚🇿🇦💙💛,"Cape Town, South Africa",false,1,2,0,3,1,-1
RedWedgie,"Disgusted with the way the #OXFAM scandal is being used. Pretty sure the exploitation of women in the developing world isn’t limited to charities. 🤔

Funny how this is happening alongside a campaign to cut international aid - and that the charity in question is on the Left. https://t.co/tA0l0PDXy1",2018-02-13T08:07:43.000Z,,Dan Owens,UK,false,2,1,0,2,1,-2
WB_UK,#whistleblowers are the vital element of a transparent society the sort of people we might expect to be honoured in the charitable sector - but no! https://t.co/eQoYuvtysu,2018-02-13T09:30:05.000Z,https://t.co/pBIZOzZQSs,WhistleblowersUK,United Kingdom,false,2,1,0,2,1,-2
htTweets,UK’s #Oxfam faces more pressure after new report of sex abuse by aid workers https://t.co/v3PXvVJmQQ,2018-02-13T11:23:51.000Z,https://t.co/ATdjJX9ibJ,Hindustan Times,India,true,3,2,1,3,1,-2
LABeachGal1,"Oxfam Faces Fresh Child Sex Abuse, 'Sex For Aid' Accusations https://t.co/Cvm9qGoHqU via @BreitbartNews These People ARE SICK. 
#QAnon
#TheGreatAwakening",2018-02-13T13:15:06.000Z,,Nurse Patriot,NA,false,3,1,3,2,1,0
