user_username,text,created_at,user_url,user_name,user_location,user_verified,retweet_count,like_count,quote_count,reply_count,ratio_reply_like,ratio_quote_retweet
CBSMornings,"Ex-employee: #WoundedWarriorProject conduct ""makes me sick."" Part 2 of our investigation: https://t.co/E2Wg7nxXts https://t.co/uTEOOq9l2I",2016-01-27T21:37:21.000Z,https://t.co/jLzzFAF7Ld,CBS Mornings,United States,true,2344,1598,0,6,-1592,-2344
nytimes,"As Wounded Warrior Project became a big name, it spent millions on things that seemed more lavish than appropriate https://t.co/Vk1XIMPaaT",2016-01-28T10:02:05.000Z,http://t.co/ahvuWqicF9,The New York Times,New York City,true,1353,309,0,22,-287,-1353
nytimes,"Special Report: The Wounded Warrior Project’s lavish staff spending is raising questions about its mission
https://t.co/avjH3oRgoB",2016-01-27T19:28:35.000Z,http://t.co/ahvuWqicF9,The New York Times,New York City,true,1254,460,1,28,-432,-1253
CBSMornings,#WoundedWarrior Project accused of wasting donation money: https://t.co/ugcCuxmc5d https://t.co/5BkJTGvNk3,2016-01-27T02:45:37.000Z,https://t.co/jLzzFAF7Ld,CBS Mornings,United States,true,1088,34,0,8,-26,-1088
CBSNews,Wounded Warrior Project accused of wasting donation money -- A CBS News investigation: https://t.co/aKuEZolTjL https://t.co/sBTn93tvPL,2016-01-27T06:00:09.000Z,https://t.co/WWGo4zp06H,CBS News,"New York, NY",true,210,115,0,29,-86,-210
jerrydoyle,Former employee accuses #WoundedWarriorProject of squandering money https://t.co/qEJst4B1DK https://t.co/LbsfwaMYTD,2016-01-28T01:01:05.000Z,https://t.co/xzchIqN9wd,Jerry Doyle,Las Vegas,false,204,94,0,0,-94,-204
nytimes,"As Wounded Warrior Project became a big name, it spent millions on things that seemed more lavish than appropriate https://t.co/FywbkagTd8",2016-01-28T02:06:03.000Z,http://t.co/ahvuWqicF9,The New York Times,New York City,true,197,160,0,14,-146,-197
CBSNews,CBS News investigation: Wounded Warrior Project accused of wasting donation money https://t.co/9kw4f6b29q,2016-01-27T00:16:23.000Z,https://t.co/WWGo4zp06H,CBS News,"New York, NY",true,183,114,0,48,-66,-183
BettyBowers,"Trump, pretending to be a Christian, will #BoycottFoxNewsDebate to help Wounded Warriors, pretending to be a charity.https://t.co/AUsJdBinYu",2016-01-28T02:36:18.000Z,https://t.co/jSfd62F38U,Mrs. Betty Bowers,A Country Not in Bible,false,181,146,0,18,-128,-181
townlecat,"#WoundedWarriorProject Spends Lavishly on Itself, Insiders Say https://t.co/8FoOixvVDW #Veterans don't see benefit.",2016-01-28T05:02:44.000Z,,townlecat,NA,false,175,63,0,0,-63,-175
nytimes,"As Wounded Warrior Project has grown, it has also embraced aggressive styles of management https://t.co/qBEVtHl2NK https://t.co/66SD75bT28",2016-01-28T05:06:03.000Z,http://t.co/ahvuWqicF9,The New York Times,New York City,true,143,161,0,41,-120,-143
nytimes,"As Wounded Warrior Project has grown, it has also embraced aggressive styles of management https://t.co/zyuj7lLEe0 https://t.co/ise4b24Zdj",2016-01-27T19:33:34.000Z,http://t.co/ahvuWqicF9,The New York Times,New York City,true,128,130,0,16,-114,-128
UnrestrainedNws,"#WoundedWarriorProject accused of lavish spending, wasting donor dollars...
https://t.co/8nnbbP88hw",2016-01-28T05:04:33.000Z,http://t.co/nZ88sLAnhX,Unrestrained News,NA,false,127,60,0,0,-60,-127
N_oeyBee,"Wounded Warrior Project Spends Lavishly on Itself, Insiders Say https://t.co/nZe8xVGXkk *HOW do you sleep at night? #WoundedWarriorProject",2016-01-28T05:00:15.000Z,,noebee,United States,false,126,61,0,0,-61,-126
David_Philipps,"Wounded Warrior Project Spends Lavishly on Itself, Ex-Employees Say. $500 hotel nights and business class to Europe https://t.co/aLEt7XoC1V",2016-01-27T19:37:33.000Z,https://t.co/HuOhDvIRws,David Philipps,colorado,false,114,91,1,19,-72,-113
nytimes,"As Wounded Warrior Project became a big name, it spent millions on things that seemed more lavish than appropriate https://t.co/DN8qxQuGY0",2016-01-29T02:41:36.000Z,http://t.co/ahvuWqicF9,The New York Times,New York City,true,109,98,0,8,-90,-109
JoshuaBuhr,"You have to read this expose' of the #WoundedWarriorProject.
https://t.co/ftW0peLr0F

Alternatives at the bottom:
https://t.co/uPD4LbqEQY",2016-01-28T05:53:59.000Z,,Joshua Buhr,United States,false,101,58,0,0,-58,-101
CBSNews,Charity watchdogs question Wounded Warrior's spending on vets https://t.co/X9C0EA4u4j https://t.co/TBSgmoheaq,2016-01-28T02:55:04.000Z,https://t.co/WWGo4zp06H,CBS News,"New York, NY",true,90,62,0,13,-49,-90
CBSNews,"Ex-employee: Wounded Warrior Project conduct ""makes me sick"" https://t.co/Toy3gc5eSX https://t.co/Vy7bxBum5r",2016-01-27T13:10:07.000Z,https://t.co/WWGo4zp06H,CBS News,"New York, NY",true,87,58,0,13,-45,-87
deray,"Wounded Warrior Project Spends Lavishly on Itself, Insiders Say https://t.co/6nd0sPEWrG",2016-01-28T12:42:55.000Z,https://t.co/xXkdEPyxGQ,deray,Wakanda,true,84,38,0,10,-28,-84
nytimes,The Wounded Warrior Project story that was just asked about during the Republican debate: https://t.co/GGhTIpSYdi,2016-01-29T02:42:50.000Z,http://t.co/ahvuWqicF9,The New York Times,New York City,true,75,94,0,11,-83,-75
CBSNews,"Ex-employee: Wounded Warrior Project conduct ""makes me sick"" https://t.co/RlJ3SqBnom https://t.co/66qIU1KiSD",2016-01-27T17:21:47.000Z,https://t.co/WWGo4zp06H,CBS News,"New York, NY",true,62,63,0,8,-55,-62
CBSEveningNews,.@CBSNews' investigation into a charity for wounded veterans. Where is the money going?: https://t.co/BPmIWuptQy https://t.co/gp7yGvFmqa,2016-01-27T00:14:28.000Z,https://t.co/Mm7FlsMteV,CBS Evening News,📺 6:30 p.m. ET,true,59,29,0,10,-19,-59
riseagainst,"RA fan &amp; veteran blowing the whistle: Wounded Warrior Project Spends Lavishly on Itself, Insiders Say, via @nytimes https://t.co/ryP8SKUonQ",2016-01-29T04:20:05.000Z,https://t.co/3E4yeedn2L,Rise Against,"Chicago, IL",true,51,121,0,3,-118,-51
th3j35t3r,https://t.co/xAQVuKlUzg &lt;&lt; ref. Deeply saddened having supported for yrs. I'll be withdrawing &amp; transfering support to @SemperFiFund. Out.,2016-01-28T03:33:40.000Z,https://t.co/SvHIVHIS09,JΞSŦΞR ✪ ΔCŦUΔL³³°¹,https://keybase.io/th3j35t3r,false,48,62,0,28,-34,-48
mattdpearce,"Five-star hotels, $500 rooms. Business-class for minor trips. Is Wounded Warrior Project using donors' money wisely? https://t.co/wV3rpXr4xT",2016-01-27T21:15:23.000Z,,Matt Pearce 🦅,he/him matt.pearce@latimes.com,true,42,24,0,3,-21,-42
wbznewsradio,"#CBS investigation finds lavish spending at #WoundedWarriorProject.
https://t.co/il7DlXW7bX",2016-01-28T10:50:03.000Z,,WBZ NewsRadio,Boston,true,41,30,0,8,-22,-41
DailyCaller,Investigation: Wounded Warrior Charity Only Spends 60 Percent Of Funds On Vets https://t.co/DC7UbOwfee https://t.co/SpodJuKPrc,2016-01-28T01:10:05.000Z,https://t.co/ePSMzp6Wnp,Daily Caller,"Washington, DC",true,39,19,0,7,-12,-39
charlesornstein,"Kinda stunning about Wounded Warrior Project. When finances questioned, they did this: https://t.co/QyEnkfJcxX https://t.co/ET3WjCXKMi",2016-01-27T22:06:52.000Z,https://t.co/GI7kafOuUM,Charles Ornstein,"New York, NY",true,36,14,0,3,-11,-36
propublica,"The Wounded Warrior Project raised $372 million in 2015, but insiders say it spends lavishly on itself. https://t.co/3zZpA5DyRO",2016-01-28T01:36:01.000Z,http://t.co/Fqv83dHVfq,ProPublica,"New York, NY",true,36,22,0,5,-17,-36
WashTimes,Wounded Warrior Project accused of wasting donor money: ‘It just makes me sick’ https://t.co/DGoK2EucdB #WWP https://t.co/oYGeDKrRVw,2016-01-27T15:42:24.000Z,https://t.co/Ncqu3Y9daA,The Washington Times,"Washington, D.C.",true,35,15,0,11,-4,-35
wwp,Wounded Warrior Project Responds: CBS Investigation 'Patently False'  https://t.co/4O4Zjuyu1Z via @non_profit_pro https://t.co/B8YcnifwrF,2016-01-29T19:15:11.000Z,https://t.co/823KUG2zCi,WWP,"Jacksonville, FL",true,35,54,0,12,-42,-35
sethmoulton,Sounds like the Wounded Warrior Project is in need of serious reform. Funds raised should directly support our vets. https://t.co/IKQBBH12ge,2016-01-27T23:52:14.000Z,https://t.co/4MkNnQ5XAk,Seth Moulton,"Salem, MA",true,31,34,0,7,-27,-31
CBSEveningNews,"Ex-employee: Wounded Warrior Project conduct ""makes me sick""; shortchanging veterans @WWP: https://t.co/qM8gu7qbJJ https://t.co/N9ylB5oevp",2016-01-29T03:41:44.000Z,https://t.co/Mm7FlsMteV,CBS Evening News,📺 6:30 p.m. ET,true,31,14,0,2,-12,-31
UniWatch,"WoundedWarriorProject, favorite charity for uniform tie-ins, wastes $$$, short-changes vets: https://t.co/KmEV7bJ4ad https://t.co/ja5Su4hWyc",2016-01-27T14:22:26.000Z,https://t.co/tliH7bShwp,Paul Lukas,"Brooklyn, NY",false,27,19,0,1,-18,-27
CBSMornings,"Former employee: Wounded Warrior Project conduct ""makes me sick"" https://t.co/vQ2rReRkyY https://t.co/IAqyEF7tAr",2016-01-27T15:58:06.000Z,https://t.co/jLzzFAF7Ld,CBS Mornings,United States,true,27,14,0,7,-7,-27
Gawker,Veteran's charity accused of wasting donations on itself https://t.co/eXVqGwYr8d,2016-01-28T03:17:08.000Z,https://t.co/5ytw1wtT1S,Gawker,NA,true,25,19,0,3,-16,-25
sergenyt,"Wounded Warrior Project Spends Lavishly on Itself, Insiders Say https://t.co/Za5HIXwtde",2016-01-27T23:06:17.000Z,https://t.co/KLLmMbqhSK,Serge Kovaleski,New York City,true,22,8,0,4,-4,-22
CBSEveningNews,"AHEAD: Part 2 of @CBSNews investigation into the Wounded Warrior Project. Where is the donation money really going?
https://t.co/NMOs26SCBv",2016-01-27T23:15:31.000Z,https://t.co/Mm7FlsMteV,CBS Evening News,📺 6:30 p.m. ET,true,21,6,0,4,-2,-21
JenGriffinFNC,#WoundedWarriorProject A cautionary tale. https://t.co/8ojY8ICYNZ,2016-01-27T20:35:37.000Z,http://t.co/Lt1i9wHYtS,Jennifer Griffin,NA,true,20,13,0,7,-6,-20
CBSEveningNews,Pt. 2- Our investigation into the Wounded Warrior Project &amp; questionable spending practices: https://t.co/sO5Nk0mZzQ https://t.co/ILn91StQhI,2016-01-28T00:15:06.000Z,https://t.co/Mm7FlsMteV,CBS Evening News,📺 6:30 p.m. ET,true,20,6,0,0,-6,-20
TheAtlantic,How is the Wounded Warrior Project spending its money? https://t.co/6RvzIfhH2m https://t.co/6L9rR2pPE9,2016-01-28T19:13:44.000Z,https://t.co/j4JSgDlv80,The Atlantic,NA,true,20,8,0,2,-6,-20
JessicaChasmar,Wounded Warrior Project accused of wasting donor money: ‘It just makes me sick’ https://t.co/yYte5Mb7ZD https://t.co/g5kN5ReODa,2016-01-27T15:42:01.000Z,https://t.co/AcLIrCr553,Jessica Chasmar,"Florida, USA",true,19,8,0,10,2,-19
OccupyWallStNYC,The Wounded Warrior Project is a bullshit charity that wastes tons of money. #veterans #WoundedWarrior https://t.co/cf2UrkE3fo,2016-01-27T20:05:03.000Z,https://t.co/DdA6rCJNwK,#GeneralStrike,"Wall Street, NYC",false,19,11,0,0,-11,-19
JessicaChasmar,"Wounded Warrior Project demands CBS News retract ‘absurd,' 'patently false’ spending report https://t.co/F5dXgJThbD https://t.co/9KNSSY5DIU",2016-01-28T17:41:39.000Z,https://t.co/AcLIrCr553,Jessica Chasmar,"Florida, USA",true,19,3,0,1,-2,-19
DavidShuster,"Top notch reporting, MUST WATCH story by Chip Reid @CBSNews re: Wounded Warrior project wasteful spending.  https://t.co/rQ6c3I3IlA",2016-01-27T18:21:02.000Z,,David Shuster,Retweets are not endorsements,true,18,12,0,4,-8,-18
BFriedmanDC,18 hours later and Wounded Warrior Project leadership still hasn't addressed these allegations. https://t.co/eiPYjv0y9y,2016-01-27T18:31:32.000Z,https://t.co/Jns833mvsA,Brandon Friedman,"Dallas, TX",true,18,13,0,2,-11,-18
CBSMornings,LATEST: Acting Secretary of the Army on @CBSNews Wounded Warrior Project spending investigation https://t.co/G9WAw8JSwp,2016-01-28T12:21:04.000Z,https://t.co/jLzzFAF7Ld,CBS Mornings,United States,true,18,15,0,3,-12,-18
NRO,New York Times: Wounded Warrior Project Spending Big — on Itself https://t.co/kzx8Ycw8ME https://t.co/RzrCDWkAfP,2016-01-28T22:33:07.000Z,https://t.co/s00ora6By7,National Review,New York,true,18,14,0,11,-3,-18
dick_nixon,"Regarding the ""Wounded Warrior Project,"" a charity that spends 40% on overhead walks up to the edge of a shell game.",2016-01-28T18:32:48.000Z,https://t.co/X6YWjg8rNV,Richard M. Nixon,"Woodcliff Lake, NJ",false,17,38,0,6,-32,-17
