user_username,text,created_at,user_url,user_name,user_location,user_verified,retweet_count,like_count,quote_count,reply_count,ratio_reply_like,ratio_quote_retweet
ElieNYC,"Starbucks is taking away coffee for a day. Maybe NOW white people will see that racism impacts them as well. :) 
#ADayWithoutCoffee #WhitePenance 
https://t.co/TLq2bmXvYR",2018-04-17T19:08:24.000Z,https://t.co/aTX8jX5TCg,Elie Mystal,NY,true,123,781,275,590,-191,152
USATODAY,The arrests at Starbucks raise a question: Is it ever OK to kick you out of a store? https://t.co/nOVB82MuiQ (Photo: AP) https://t.co/bDvRlKHvbT,2018-04-18T15:40:03.000Z,https://t.co/yNKGMNvztv,USA TODAY,"USA TODAY HQ, McLean, Va.",true,36,98,138,341,243,102
ericonederful,I'm going to Starbucks to take a knee... in a racist manager's face.,2018-04-14T23:34:06.000Z,https://t.co/9bBgYubOQl,Mr. Onederful®,"Los Angeles, CA",false,7,58,100,3,-55,93
Slate,Starbucks CEO apologizes for arrest of two black men waiting in Philadelphia store. https://t.co/ePAkzIMava https://t.co/ccUJ88KJNA,2018-04-16T04:17:21.000Z,https://t.co/m5NGCv2a2a,Slate,NA,true,143,314,213,47,-267,70
ericonederful,My coffee was so black in came in handcuffs. #BoycottStarbucks,2018-04-15T00:49:53.000Z,https://t.co/9bBgYubOQl,Mr. Onederful®,"Los Angeles, CA",false,8,25,64,2,-23,56
dumbassgenius,"Yes, #Starbucks had two black guys arrested for not buying drinks. But remember, the men are Realtors® and if left unchecked, would've shown some family a 6bd, 2ba fixer-upper in Chestnut Hill. https://t.co/4RSQbSKyr3",2018-04-15T03:18:12.000Z,https://t.co/WYke2bIYnm,Rick G. Rosner,Los Angeles,true,3,8,57,4,-4,54
ATLBlackStar,Starbucks Chairman Wants to See 'Reconciliation' Between Manager and Two Black Men; Says She's Suffered In Her Own Way https://t.co/f6OLuyDPdb https://t.co/szLD4vtjfk,2018-04-20T13:04:49.000Z,https://t.co/Ma1o45NWTZ,Atlanta Black Star,"Atlanta, GA",false,19,16,64,104,88,45
nytopinion,"""Starbucks should be a beacon for embarking on the work of racial healing both internally and externally — and not just for one day"" #NYTLetters https://t.co/6Fd7nqCg5Z",2018-04-19T18:30:50.000Z,https://t.co/oy7Q8cSQqk,New York Times Opinion,"NYC, London, Paris, Hong Kong",true,3,20,26,66,46,23
NBCNews,"Starbucks needs to work harder to condemn racism, say brand experts. https://t.co/e6JYgr20NT",2018-04-17T15:17:02.000Z,https://t.co/Z73is4fJ3x,NBC News,"New York, NY",true,38,84,51,111,27,13
YahooFinance,Starbucks will close all U.S. stores on May 29 for 'racial bias education' @SallyPancakes https://t.co/hlW95x0lnX https://t.co/12ZkXAhJ4x,2018-04-17T18:06:55.000Z,https://t.co/LrB4M4iv6B,Yahoo Finance,"New York, NY",true,17,21,27,14,-7,10
NEWS_MAKER,Black men arrested at STARBUCKS say feared for lives...,2018-04-19T11:46:46.000Z,,NEWS MAKER,US,false,23,64,33,245,181,10
OfficiallyReid,The Starbucks situation is very simple..its a business..you have to pay to be in here..or leave...if you don't leave...YOU ARE TRESPASSING..Cops will be called..if you still don't leave..u will be ARRESTED..now if they tried to buy product then got refused service it's different.,2018-04-16T21:04:12.000Z,https://t.co/73vTvZCGc6,Reid,"Detroit, MI ✈ Las Vegas, NV",false,1,12,10,3,-9,9
RAMRANTS,"After what happened to two innocent black men at a Philadelphia Starbucks, Hillary Clinton’s “super predator” remark comes to mind. Her and her husband’s administration paved the way for this type of discrimination and that shouldn’t be disregarded. 

It was only 22 years ago.",2018-04-15T19:54:20.000Z,https://t.co/pziIbRrqsb,RAM (Richard Armande Mills),"Oregon, USA",true,6,23,14,120,97,8
NEWS_MAKER,STARBUCKS CEO vows 'unconscious bias' training... https://t.co/1TYzqrrHsv,2018-04-17T02:36:13.000Z,,NEWS MAKER,US,false,19,38,27,98,60,8
TMZ,Lil Xan Not Boycotting Starbucks https://t.co/adFWDfD1Mq,2018-04-19T13:45:03.000Z,https://t.co/LQPPfVeJqW,TMZ,"Los Angeles, CA",true,2,10,10,6,-4,8
NRO,Women’s March Leader Calls for Starbucks Boycott Due to Partnership with Jewish Group https://t.co/lYfAjcIUic https://t.co/P4Vy3RI6vQ,2018-04-20T11:03:09.000Z,https://t.co/s00ora6By7,National Review,New York,true,33,22,41,28,6,8
HotNewHipHop,"Lil Xan flaunts his #Starbucks run seemingly unaware of boycott

🥤🥤
https://t.co/tawVadmkGQ https://t.co/UQVqrh1N8n",2018-04-19T18:45:02.000Z,,HotNewHipHop,NA,true,1,12,8,4,-8,7
kathyprojo,".@TrilloforGov “I am so sick of hearing people scream the word racism every time a minority gets arrested for something unlawful.  Sorry folks, if you’re asked to leave a business’s premises, you leave.  It’s not racism, it’s what happens when you break the law."" #Starbucks",2018-04-20T20:59:18.000Z,https://t.co/MpAEJrgi3O,katherine gregg,"Providence, R.I.",false,1,4,7,14,10,6
NBCBLK,Police chief defends officers in arrest of black men at Starbucks https://t.co/ckJIgaLtrH,2018-04-15T13:54:18.000Z,https://t.co/WmHot6WZGJ,NBCBLK,"New York, NY",true,6,4,11,15,11,5
RealSaavedra,"#BREAKING: Starbucks to close over 8,000 stores in the U.S. on May 29 ""to conduct racial-bias education geared toward preventing discrimination in our stores."" https://t.co/v4nHQJhwUr",2018-04-17T17:56:30.000Z,,Ryan Saavedra,USA,true,24,32,29,52,20,5
KTLA,Starbucks says the training will be developed with guidance from experts including former Attorney General Eric Holder https://t.co/EyMeBNvuQE,2018-04-17T19:07:36.000Z,http://t.co/ZgOP41jU0Y,KTLA,"Los Angeles, CA",true,27,98,32,48,-50,5
BreitbartNews,https://t.co/ZPWpKD4k37,2018-04-20T12:55:16.000Z,http://t.co/2sVbt3n6lO,Breitbart News,NA,true,8,32,13,102,70,5
fox6now,Police chief: Officers did nothing wrong in Starbucks arrest seen in viral video https://t.co/QZ7VR39MN3 https://t.co/FdCTFHxf8y,2018-04-15T03:35:10.000Z,https://t.co/A7pyOoAB2X,FOX6 News,Milwaukee,true,1,1,5,0,-1,4
NotReallyABear2,"On the Starbucks kerfluffle: it’s hard for me to feel bad for Starbucks. Not the workers dealing with the crazy, but the corporation. These are your rules, leftwingers. Identity politics. People in minority groups can do *anything* and if you’re bothered you get called racist.",2018-04-17T01:05:45.000Z,,all brie,"Washington, USA",false,2,30,6,7,-23,4
MarketWatch,Starbucks to close all U.S. stores on May 29 for racial-bias education https://t.co/an89z0iVI8,2018-04-17T17:45:50.000Z,https://t.co/Z9DRUcnQ8M,MarketWatch,"New York, NY",true,35,26,39,12,-14,4
envydatropic,GET the fuck outta here with that boycott Starbucks bullshit,2018-04-18T01:29:18.000Z,https://t.co/yg8dWDWsZQ,❤ Envy ❤,NA,false,45,106,49,13,-93,4
abcactionnews,"JUST IN | Starbucks spokesperson says manager in the store who called police leading to the arrest of two black men, no longer works at the store  https://t.co/9Em7tc3kam https://t.co/Aoml8fAvXe",2018-04-16T17:38:47.000Z,https://t.co/hjOLC3xFry,ABC Action News,Tampa,true,3,8,6,3,-5,3
chakaaaa__,Sorry. I can't boycott Starbucks.,2018-04-16T18:07:00.000Z,,tender roni.,GA,false,1,1,4,0,-1,3
HipHopWired,T.I. Calls For #Boycott Of #Starbucks After Philadelphia Incident #BoycottStarbucks https://t.co/KHdwzbsild #news https://t.co/9ECtoxU0Z5,2018-04-16T18:53:51.000Z,http://t.co/3QJrsNECJL,HipHopWired,NA,false,1,8,4,1,-7,3
WalshFreedom,"New policies coming to politically correct @Starbucks: 

1. Only white people must buy something in order to use the bathroom. 

2. No employee can call the police to report on a black person, even a black person committing a crime. 

3. Only white people must pay for coffee.",2018-04-17T19:58:01.000Z,https://t.co/UsBcAXBRZO,Joe Walsh,NA,true,89,258,92,480,222,3
chicagotribune,"Philadelphia police release 911 call from Starbucks employee that led to arrests of two black men: ""Hi, I have two gentlemen in my cafe that are refusing to make a purchase or leave."" https://t.co/Kv2nx79EOn https://t.co/8kMX6gubLw",2018-04-17T23:16:19.000Z,https://t.co/DekZkEnIYp,Chicago Tribune,"Chicago, IL",true,2,10,5,6,-4,3
DailyCaller,"Starbucks Is Shutting Down 8,000 Stores For The Day To Prove They’re Not Racist https://t.co/WcUHEaTXKD https://t.co/QMZhiRFnUw",2018-04-18T00:09:37.000Z,https://t.co/ePSMzp6Wnp,Daily Caller,"Washington, DC",true,5,8,8,24,16,3
kharytheceo,So this morning I lost my smartwatch.. I just called Starbucks and they're keeping it safe for me... Y'all can keep ya little boycott lol,2018-04-18T00:22:02.000Z,,European Vax Center,"Washington, DC",false,2,14,5,2,-12,3
bartmckinley,Eric Holder to Help Starbucks Train Employees For 'Racial Bias Education Day' https://t.co/wsAq6kMviX,2018-04-18T00:57:25.000Z,,Joe McKinley,NA,false,2,2,5,9,7,3
thinkprogress,Starbucks CEO's quick-fix plan to confront racial bias at company falls short of the mark https://t.co/eDF5aDRsWp https://t.co/RpnIBM0y3P,2018-04-18T12:10:00.000Z,https://t.co/I7Yhezk1Rr,ThinkProgress,"Washington, D.C.",false,4,5,7,8,3,3
FDRLST,How should we handle this? https://t.co/bsgGpjYWkH,2018-04-18T16:35:00.000Z,https://t.co/vsBExQUQf4,The Federalist,United States of America,true,1,8,4,15,7,3
Diggs757,I knew Starbucks was racist when one of my co workers asked me if i wanted my tea “nigger sweet” a couple years ago,2018-04-18T17:27:05.000Z,https://t.co/rHhj2kem6t,Diggs,"Norfolk, Virginia   7 ✋ 7 ",false,2,5,5,3,-2,3
kentbernard64,"@VibeHi The Starbucks ""prank"" impacts to the cause of racial injustice. You  undermined the very real, unjust arrest of two black men.  You selfishly  promote using a criminal act and encouraged others to do the same. The  Right use this to attack downplay our cause https://t.co/5M72tDRTZX",2018-04-20T15:55:09.000Z,,Kent Bernard,"Texas, USA",false,2,1,5,21,20,3
wusa9,Starbucks apologizes after police arrest 2 black men in Philadelphia store https://t.co/HKaRJL1rG0 https://t.co/EFv51WpUwA,2018-04-14T21:10:12.000Z,https://t.co/5155IbryUC,WUSA9,"Washington, DC",true,1,1,3,0,-1,2
KGWNews,Starbucks apologizes after police arrest 2 black men in Philadelphia store https://t.co/cIKCE1lvhW https://t.co/CXGpteMbF2,2018-04-14T21:20:08.000Z,https://t.co/E1l8O2yrSS,KGW News,"Portland, Oregon",true,3,12,5,23,11,2
dsupervilleap,Police chief: Officers did nothing wrong in Starbucks arrest (from @AP) https://t.co/adFCVJwF3Z,2018-04-15T12:40:12.000Z,https://t.co/gX7eQqonYs,darlene superville,"Washington, DC ",true,1,3,3,0,-3,2
Chris_1791,Starbucks CEO wants to apologize 'face-to-face' to black men arrested at Philadelphia store; protests of store planned https://t.co/ufhoqTP9Kr via @phillydotcom https://t.co/uQocJtCn4j,2018-04-15T13:42:11.000Z,https://t.co/5s2vn9uquh,Chris 🇺🇸,"Philadelphia PA, USA",false,1,1,3,0,-1,2
freep,Philadelphia police chief defends officers who arrested black men at Starbucks https://t.co/xv8OCIjB6D,2018-04-15T14:08:04.000Z,https://t.co/s5gYJzEU6k,Detroit Free Press,Detroit,true,1,1,3,6,5,2
disnazzio,"Meanwhile, apparently the Starbucks in Roland Park is advertising some bullshit ""coffee with a cop"" event. Anyone know when it is?",2018-04-15T17:05:53.000Z,,💁🏻‍♀️ KeyFobs4Kids #FreeKeithDavisJr,O Little Town of Baltimore,false,1,12,3,8,-4,2
komonews,Starbucks CEO apologizes to 2 black men arrested: https://t.co/QR6FxtdY1t https://t.co/4ZnVz0Alj4,2018-04-15T19:16:00.000Z,https://t.co/wOYxEXibj4,KOMO News,"Seattle, WA",true,1,9,3,4,-5,2
mythlabent,"Come on, @starbucks!  You all know damn well an apology is not going to cut it this time.  (And neither is a free drink before 2 p.m.) https://t.co/zToZ97KwPP",2018-04-16T01:04:07.000Z,https://t.co/XoyytjfrAu,Myth Lab Entertainment,Chicago,false,1,4,3,0,-4,2
JamaicanHoney,Well i can live without Starbucks 🤷🏽‍♀️ Soo these an easy boycott,2018-04-16T02:13:23.000Z,https://t.co/ptlxt2iX7v,Fatty Boom Boom,"Connecticut, now Atlanta ",false,1,4,3,0,-4,2
DailySabah,"Starbucks CEO Kevin Johnson apologizes to 2 black men who were arrested for sitting at Philadelphia store 
https://t.co/LXSqxLzXPS",2018-04-16T08:45:35.000Z,https://t.co/1sNgcPdRMP,DAILY SABAH,Istanbul,true,1,6,3,1,-5,2
MorningEdition,Starbucks COO Rosalind Brewer says the police should not have been called on the two black men in the Philadelphia store. https://t.co/VQ5eO0z2GL https://t.co/ujaY4Bn6Jx,2018-04-16T13:37:11.000Z,https://t.co/fvuT5Odn2l,Morning Edition,"Washington, DC",true,28,101,30,36,-65,2
snopes,"“I would like to have a dialogue with them to make sure we have the opportunity to really understand the situation and they can join me in finding constructive way to solve this issue,” #Starbucks CEO Kevin Johnson said:
https://t.co/1ywN9JFuyV",2018-04-16T15:31:21.000Z,https://t.co/tpL6uVDZbf,snopes.com,NA,true,1,6,3,2,-4,2
